[I 2023-11-06 21:30:20,482] A new study created in Journal with name: linear
[I 2023-11-06 21:30:20,698] Trial 2 finished with value: 0.21639542314774715 and parameters: {'alpha': 0.030660749709425932, 'l1_ratio': 0.023507058035717288}. Best is trial 0 with value: 0.21480493527605068.
[I 2023-11-06 21:30:20,714] Trial 0 finished with value: 0.21480493527605068 and parameters: {'alpha': 0.05500392062284138, 'l1_ratio': 0.8089514543626527}. Best is trial 0 with value: 0.21480493527605068.
[I 2023-11-06 21:30:20,735] Trial 1 finished with value: 0.21593195124561435 and parameters: {'alpha': 0.06876487402102471, 'l1_ratio': 0.9198176567532791}. Best is trial 0 with value: 0.21480493527605068.
[I 2023-11-06 21:30:20,735] Trial 3 finished with value: 0.21545405429854173 and parameters: {'alpha': 0.08916137666634041, 'l1_ratio': 0.10861125392706328}. Best is trial 0 with value: 0.21480493527605068.
[I 2023-11-06 21:30:20,736] Trial 4 finished with value: 0.2229012362599835 and parameters: {'alpha': 0.06787892724927198, 'l1_ratio': 0.9965845639507183}. Best is trial 0 with value: 0.21480493527605068.
[I 2023-11-06 21:30:20,743] A new study created in Journal with name: KRR
[I 2023-11-06 21:30:21,437] Trial 0 finished with value: 0.15119655954348354 and parameters: {'alpha': 0.9581728444949346, 'gamma': 4.1235397850165723e-16, 'kernel': 'linear'}. Best is trial 0 with value: 0.15119655954348354.
[I 2023-11-06 21:30:21,463] Trial 4 finished with value: 0.15354980423150044 and parameters: {'alpha': 0.9179825280689777, 'gamma': 8.655930960498746e-15, 'kernel': 'rbf'}. Best is trial 0 with value: 0.15119655954348354.
[I 2023-11-06 21:30:21,467] Trial 1 finished with value: 0.15555990146856705 and parameters: {'alpha': 0.32663510845761234, 'gamma': 4.702324390528252e-15, 'kernel': 'rbf'}. Best is trial 0 with value: 0.15119655954348354.
[I 2023-11-06 21:30:21,467] Trial 3 finished with value: 0.1636507791189399 and parameters: {'alpha': 0.10769199770914341, 'gamma': 4.8317637543252466e-15, 'kernel': 'linear'}. Best is trial 0 with value: 0.15119655954348354.
[I 2023-11-06 21:30:21,468] Trial 2 finished with value: 0.15932140679784787 and parameters: {'alpha': 0.9235893035226328, 'gamma': 2.304473720006894e-15, 'kernel': 'rbf'}. Best is trial 0 with value: 0.15119655954348354.
[I 2023-11-06 21:30:21,473] A new study created in Journal with name: GB
[I 2023-11-06 21:30:27,025] Trial 1 finished with value: 0.17513423453668173 and parameters: {'n_estimators': 200, 'learning_rate': 0.10777693211757988, 'max_depth': 1}. Best is trial 1 with value: 0.17513423453668173.
[I 2023-11-06 21:30:27,047] Trial 0 finished with value: 0.16106173828918902 and parameters: {'n_estimators': 500, 'learning_rate': 0.1969495815260162, 'max_depth': 2}. Best is trial 0 with value: 0.16106173828918902.
[I 2023-11-06 21:30:27,091] Trial 2 finished with value: 0.173465782487813 and parameters: {'n_estimators': 200, 'learning_rate': 0.3966364622220305, 'max_depth': 1}. Best is trial 0 with value: 0.16106173828918902.
[I 2023-11-06 21:30:27,115] Trial 3 finished with value: 0.18211319849313212 and parameters: {'n_estimators': 20, 'learning_rate': 0.32717887903700626, 'max_depth': 1}. Best is trial 0 with value: 0.16106173828918902.
[I 2023-11-06 21:30:27,125] Trial 4 finished with value: 0.1673502677901567 and parameters: {'n_estimators': 500, 'learning_rate': 0.10297096784583658, 'max_depth': 4}. Best is trial 0 with value: 0.16106173828918902.
[I 2023-11-06 21:30:27,132] A new study created in Journal with name: RF
[I 2023-11-06 21:30:39,226] Trial 1 finished with value: 0.16003506866664363 and parameters: {'n_estimators': 200, 'max_features': 'sqrt', 'max_depth': None}. Best is trial 1 with value: 0.16003506866664363.
[I 2023-11-06 21:30:39,229] Trial 2 finished with value: 0.17754998864484872 and parameters: {'n_estimators': 50, 'max_features': 'log2', 'max_depth': 3}. Best is trial 1 with value: 0.16003506866664363.
[I 2023-11-06 21:30:39,434] Trial 4 finished with value: 0.18236451138957474 and parameters: {'n_estimators': 50, 'max_features': 'log2', 'max_depth': 2}. Best is trial 1 with value: 0.16003506866664363.
[I 2023-11-06 21:30:39,497] Trial 0 finished with value: 0.17606522964735116 and parameters: {'n_estimators': 200, 'max_features': 'sqrt', 'max_depth': 2}. Best is trial 1 with value: 0.16003506866664363.
[I 2023-11-06 21:30:39,583] Trial 3 finished with value: 0.17463857370741934 and parameters: {'n_estimators': 20, 'max_features': 'auto', 'max_depth': 3}. Best is trial 1 with value: 0.16003506866664363.
[I 2023-11-06 21:30:39,589] A new study created in Journal with name: ANN
[I 2023-11-06 21:30:46,150] Trial 4 finished with value: 0.2563187282864842 and parameters: {'learning_rate_init': 0.01717448165958799, 'hidden_layer_sizes': [20, 20]}. Best is trial 4 with value: 0.2563187282864842.
[I 2023-11-06 21:30:46,310] Trial 3 finished with value: 0.2515133076779568 and parameters: {'learning_rate_init': 0.057192892371142, 'hidden_layer_sizes': [5, 5]}. Best is trial 3 with value: 0.2515133076779568.
[I 2023-11-06 21:30:46,334] Trial 2 finished with value: 0.25988385136680864 and parameters: {'learning_rate_init': 0.04510070887660287, 'hidden_layer_sizes': [5, 5, 5]}. Best is trial 3 with value: 0.2515133076779568.
[I 2023-11-06 21:30:46,364] Trial 1 finished with value: 0.2338691997201581 and parameters: {'learning_rate_init': 0.05014356782167753, 'hidden_layer_sizes': [50]}. Best is trial 1 with value: 0.2338691997201581.
[I 2023-11-06 21:30:46,436] Trial 0 finished with value: 0.2680899147738784 and parameters: {'learning_rate_init': 0.009936510298711395, 'hidden_layer_sizes': [50, 50, 50]}. Best is trial 1 with value: 0.2338691997201581.
     56, [63, 'CC(C)(O)c1cc(F)c2c(c1)C(=O)N(Cc1ccc(Cl)cn1)[C@@]2(OCC1(O)CC1)c1ccc(Cl)cc1', 0.9999999999999998, 13.1753, 1.4177, 11.3044, -7.3559, -125.8906, -119.4889]
     14, [23, 'Cc1ncsc1-c1ccc([C@H](CC(=O)NCCCCCCNC(=O)COc2c(-c3csc(N4CCOCC4)n3)ccc(F)c2F)NC(=O)[C@@H]2C[C@@H](O)CN2C(=O)[C@@H](NC(=O)C2(F)CC2)C(C)(C)C)cc1', 0.0622624201077031, 28.4327, 3.274, 23.4872, -4.0348, -286.1545, -257.0326]
     removed index 325 corresponding to NaN
     removed index 678 corresponding to NaN
     removed index 725 corresponding to NaN
     removed index 1053 corresponding to NaN
     1417, [439, 'CN1C(=O)c2ccccc2[S@+]([O-])c2ccc(C(=O)NCc3ccc(Br)cc3)cc21', 0.4181064270905321, 10.3104, 0.7256, 7.5559, -14.2816, -86.2027, -96.3091]
     356, [66, 'CC(=O)c1c(C)[nH]c(C(=O)Nc2cccc([S+](=O)([O-])Nc3cccc(C#N)c3)c2)c1C', 0.8327574291637871, 10.4683, 2.4345, 9.1374, -15.7732, -116.2014, -124.8128]
     151, [36, 'N#Cc1ccc(CN2CCC(N3CCNC3=O)CC2)cc1', 0.7615658362989324, 8.7086, 0.7824, 4.7992, -7.9813, -74.8159, -75.7409]
     38, [185, 'c1ccc(Nc2ncc(-c3cncnc3)c3c2OCC3)cc1', 1.0, 7.6502, 0.7908, 4.359, -17.5939, -69.2221, -78.0498]
     56, [30, 'COc1cccc([C@@H](CO)NC(=O)[C@@H](C)N2Cc3ccc(-c4nc(NC5CCOCC5)ncc4Cl)cc3C2=O)c1', 0.0147310164129507, 16.2478, 2.1011, 12.7179, -10.0882, -164.348, -156.2467]
     14, [29, 'O=C1CCC(N2C(=O)c3cccc(NCCOCCOCCNC(=O)c4ccc5c(c4)nc(Nc4cccc(Cl)c4)c4ccncc45)c3C2=O)C(=O)N1', 0.0400167292931223, 18.7621, 3.2764, 15.83, -24.805, -206.8013, -216.3639]
     removed index 627 corresponding to NaN
     removed index 628 corresponding to NaN
     removed index 1065 corresponding to NaN
     removed index 1109 corresponding to NaN
     1417, [41, 'CNC(=O)C1CCN(c2nc(-c3ccc(Br)cc3)cs2)CC1', 0.8728403593642018, 8.8766, 0.5795, 5.4967, -5.3755, -74.4969, -72.179]
     356, [675, 'O=c1cc(CN2CCCN(c3ccc(C(F)(F)F)cn3)CC2)nc2ccccn12', 0.2695231513476157, 11.6693, 0.0, 8.7277, -7.9637, -109.4358, -87.089]
     151, [9, 'Cc1cc(F)ccc1OC1CN(Cc2ccc(C#N)cc2)C1', 0.2473309608540924, 8.9224, 0.0, 4.8259, -11.1508, -61.3626, -68.7406]
     38, [20, 'Fc1cccc(-c2cnc([C@@H]3COCCN3Cc3cnc[nH]3)[nH]2)c1', 0.4599644128113878, 8.6917, 1.4354, 6.9778, -10.2452, -97.3783, -101.0987]
     56, [25, 'O=C(NC1CCN(CCc2c[nH]c3ccccc23)CC1)c1ccccc1', 0.0439188969472542, 9.3803, 1.1336, 4.4019, -10.2484, -68.9045, -79.1529]
     14, [44, 'COc1cc(F)cc([C@@H](CO)NC(=O)[C@@H](C)N2Cc3ccc(-c4nc(NC5COC5)ncc4Cl)cc3C2=O)c1', 0.1384047171537122, 15.1005, 2.4247, 13.7023, -11.5729, -168.823, -163.9418]
     removed index 1085 corresponding to NaN
     1420, [865, 'O=c1c(O)c(-c2ccc(O)cc2)oc2cc(O)cc(O)c12', 0.1807187284035936, 4.8109, 4.2098, 9.0356, -15.906, -100.4349, -116.3409]
     removed index 149 corresponding to NaN
     removed index 152 corresponding to NaN
     removed index 165 corresponding to NaN
     353, [963, 'COc1cc(C(=O)Nc2nc(-c3ccccc3)cs2)ccc1NS(=O)(=O)c1ccc(C)cc1', 0.1485832757429163, 10.6471, 1.8191, 7.4917, -18.2286, -98.1729, -109.0432]
     151, [107, 'O=C(Nc1cnc(-c2ccccc2)nc1)c1ccccc1', 1.0, 7.4704, 0.6471, 3.9158, -15.3358, -60.546, -70.5429]
     38, [104, 'Cc1ccccc1-c1[nH]nc2ncc(-c3ccccc3)nc12', 0.7215302491103203, 6.5793, 0.7599, 2.616, -18.8676, -48.3099, -58.8456]
random 3A4 linear
random 3A4 KRR
random 3A4 GB
random 3A4 RF
random 3A4 ANN
random RLM linear
Traceback (most recent call last):
  File "/home/it4i-majerl/Documents/datacytochromy/optuna-it4i.py", line 155, in <module>
    JournalFileStorage(f"./project_resources/optuna/{_type}/{splitter_name}/{isozyme}/{model_identifier}_journal.log", lock_obj=lock_obj)
  File "/home/it4i-majerl/.local/lib/python3.11/site-packages/optuna/storages/_journal/file.py", line 160, in __init__
    open(self._file_path, "ab").close()  # Create a file if it does not exist
    ^^^^^^^^^^^^^^^^^^^^^^^^^^^
FileNotFoundError: [Errno 2] No such file or directory: './project_resources/optuna/morgan/random/RLM/linear_journal.log'
