[I 2023-11-07 17:28:56,179] Trial 4 finished with value: 0.27080576207642076 and parameters: {'n_estimators': 10, 'learning_rate': 0.618599990319447, 'max_depth': 1}. Best is trial 1 with value: 0.2673906455658081.
[I 2023-11-07 17:28:56,186] Using an existing study with name 'RF' instead of creating a new one.
[I 2023-11-07 17:29:00,433] Trial 4 finished with value: 0.27002057491994963 and parameters: {'n_estimators': 200, 'max_features': 'auto', 'max_depth': 5}. Best is trial 0 with value: 0.2677642292700792.
[I 2023-11-07 17:29:00,440] Using an existing study with name 'ANN' instead of creating a new one.
[I 2023-11-07 17:29:04,119] Trial 4 finished with value: 0.31848100470405444 and parameters: {'learning_rate_init': 0.07931382383918643, 'hidden_layer_sizes': [10, 10, 10]}. Best is trial 3 with value: 0.30921506461333975.
[I 2023-11-07 17:29:04,124] Using an existing study with name 'linear' instead of creating a new one.
[I 2023-11-07 17:29:04,176] Trial 4 finished with value: 0.21164794516737984 and parameters: {'alpha': 0.061188449999987495, 'l1_ratio': 0.07448769835469848}. Best is trial 4 with value: 0.21164794516737984.
[I 2023-11-07 17:29:04,182] Using an existing study with name 'KRR' instead of creating a new one.
[I 2023-11-07 17:29:04,252] Trial 4 finished with value: 0.16103804476499503 and parameters: {'alpha': 0.8675887113894024, 'gamma': 7.744859284293017e-15, 'kernel': 'linear'}. Best is trial 2 with value: 0.13967776073074545.
[I 2023-11-07 17:29:04,257] Using an existing study with name 'GB' instead of creating a new one.
[I 2023-11-07 17:29:05,614] Trial 4 finished with value: 0.1572673145445879 and parameters: {'n_estimators': 200, 'learning_rate': 0.9960812468101133, 'max_depth': 3}. Best is trial 0 with value: 0.10324836117333373.
[I 2023-11-07 17:29:05,620] Using an existing study with name 'RF' instead of creating a new one.
[I 2023-11-07 17:29:08,571] Trial 4 finished with value: 0.1457692880960244 and parameters: {'n_estimators': 50, 'max_features': 'sqrt', 'max_depth': 2}. Best is trial 1 with value: 0.13033864323678376.
[I 2023-11-07 17:29:08,577] Using an existing study with name 'ANN' instead of creating a new one.
[I 2023-11-07 17:29:10,478] Trial 4 finished with value: 0.24951454690348926 and parameters: {'learning_rate_init': 0.016669648064947168, 'hidden_layer_sizes': [20]}. Best is trial 0 with value: 0.2465075969227216.
[I 2023-11-07 17:29:10,484] Using an existing study with name 'linear' instead of creating a new one.
[I 2023-11-07 17:29:10,540] Trial 4 finished with value: 0.24778024990265898 and parameters: {'alpha': 0.007707869901143596, 'l1_ratio': 0.1514195311722516}. Best is trial 3 with value: 0.2474879832963269.
[I 2023-11-07 17:29:10,545] Using an existing study with name 'KRR' instead of creating a new one.
[I 2023-11-07 17:29:11,495] Trial 4 finished with value: 0.23618539823313933 and parameters: {'alpha': 0.026701375553218804, 'gamma': 1.5495981396572468e-15, 'kernel': 'linear'}. Best is trial 0 with value: 0.23575721399277358.
[I 2023-11-07 17:29:11,501] Using an existing study with name 'GB' instead of creating a new one.
[I 2023-11-07 17:29:21,245] Trial 4 finished with value: 0.2256250267511201 and parameters: {'n_estimators': 20, 'learning_rate': 0.996102137649341, 'max_depth': 2}. Best is trial 1 with value: 0.2253864094793028.
[I 2023-11-07 17:29:21,253] Using an existing study with name 'RF' instead of creating a new one.
[I 2023-11-07 17:30:01,626] Trial 4 finished with value: 0.22069502151913123 and parameters: {'n_estimators': 500, 'max_features': 'log2', 'max_depth': 5}. Best is trial 0 with value: 0.21890862037935035.
[I 2023-11-07 17:30:01,632] Using an existing study with name 'ANN' instead of creating a new one.
[I 2023-11-07 17:30:21,333] Trial 4 finished with value: 0.2645448431754199 and parameters: {'learning_rate_init': 0.017085249768593342, 'hidden_layer_sizes': [20]}. Best is trial 4 with value: 0.2645448431754199.
[I 2023-11-07 17:30:21,339] Using an existing study with name 'linear' instead of creating a new one.
[I 2023-11-07 17:30:21,378] Trial 4 finished with value: 0.28001030835114293 and parameters: {'alpha': 0.03715397076528846, 'l1_ratio': 0.7583633847135431}. Best is trial 3 with value: 0.27962687896211086.
[I 2023-11-07 17:30:21,385] Using an existing study with name 'KRR' instead of creating a new one.
[I 2023-11-07 17:30:21,443] Trial 4 finished with value: 0.28828257612142155 and parameters: {'alpha': 0.15651112802065148, 'gamma': 5.1848172974595044e-15, 'kernel': 'linear'}. Best is trial 2 with value: 0.27296973093493354.
[I 2023-11-07 17:30:21,449] Using an existing study with name 'GB' instead of creating a new one.
[I 2023-11-07 17:30:23,311] Trial 4 finished with value: 0.2670313950661601 and parameters: {'n_estimators': 500, 'learning_rate': 0.09737835501656843, 'max_depth': 3}. Best is trial 1 with value: 0.25579944588375864.
[I 2023-11-07 17:30:23,319] Using an existing study with name 'RF' instead of creating a new one.
[I 2023-11-07 17:30:27,235] Trial 4 finished with value: 0.2480697556570327 and parameters: {'n_estimators': 500, 'max_features': 'sqrt', 'max_depth': 10}. Best is trial 3 with value: 0.24485431040551975.
[I 2023-11-07 17:30:27,243] Using an existing study with name 'ANN' instead of creating a new one.
[I 2023-11-07 17:30:30,233] Trial 4 finished with value: 0.33582695982866867 and parameters: {'learning_rate_init': 0.05740530196433369, 'hidden_layer_sizes': [5]}. Best is trial 3 with value: 0.32697045599980434.
[I 2023-11-07 17:30:30,238] Using an existing study with name 'linear' instead of creating a new one.
[I 2023-11-07 17:30:30,274] Trial 4 finished with value: 0.1272921991610333 and parameters: {'alpha': 0.015154844471159511, 'l1_ratio': 0.3964716569072958}. Best is trial 2 with value: 0.1263750621900681.
[I 2023-11-07 17:30:30,279] Using an existing study with name 'KRR' instead of creating a new one.
[I 2023-11-07 17:30:30,348] Trial 4 finished with value: 0.1268053554465495 and parameters: {'alpha': 0.47813413727455295, 'gamma': 3.4924215758672585e-15, 'kernel': 'laplacian'}. Best is trial 2 with value: 0.12511874037691656.
[I 2023-11-07 17:30:30,354] Using an existing study with name 'GB' instead of creating a new one.
[I 2023-11-07 17:30:31,691] Trial 4 finished with value: 0.13698839977896451 and parameters: {'n_estimators': 500, 'learning_rate': 0.7527223593578465, 'max_depth': 2}. Best is trial 1 with value: 0.13605880775044277.
[I 2023-11-07 17:30:31,698] Using an existing study with name 'RF' instead of creating a new one.
[I 2023-11-07 17:30:34,657] Trial 4 finished with value: 0.1268521525842666 and parameters: {'n_estimators': 500, 'max_features': 'sqrt', 'max_depth': None}. Best is trial 4 with value: 0.1268521525842666.
[I 2023-11-07 17:30:34,664] Using an existing study with name 'ANN' instead of creating a new one.
[I 2023-11-07 17:30:36,462] Trial 4 finished with value: 0.27332123916067164 and parameters: {'learning_rate_init': 0.013490600441857115, 'hidden_layer_sizes': [50]}. Best is trial 1 with value: 0.24416734248193808.
[I 2023-11-07 17:30:36,468] Using an existing study with name 'linear' instead of creating a new one.
[I 2023-11-07 17:30:36,532] Trial 4 finished with value: 0.2563789024636251 and parameters: {'alpha': 0.031706586996864246, 'l1_ratio': 0.1648151894717459}. Best is trial 1 with value: 0.25624895264142994.
[I 2023-11-07 17:30:36,538] Using an existing study with name 'KRR' instead of creating a new one.
[I 2023-11-07 17:30:37,529] Trial 4 finished with value: 0.2506503718316136 and parameters: {'alpha': 0.8283224160669665, 'gamma': 6.9798597726683084e-15, 'kernel': 'laplacian'}. Best is trial 3 with value: 0.24972683136737803.
[I 2023-11-07 17:30:37,538] Using an existing study with name 'GB' instead of creating a new one.
[I 2023-11-07 17:30:47,376] Trial 4 finished with value: 0.24161958334777264 and parameters: {'n_estimators': 10, 'learning_rate': 0.5623960382174522, 'max_depth': 4}. Best is trial 3 with value: 0.24150834049494632.
[I 2023-11-07 17:30:47,384] Using an existing study with name 'RF' instead of creating a new one.
[I 2023-11-07 17:31:28,248] Trial 4 finished with value: 0.23640393907738022 and parameters: {'n_estimators': 200, 'max_features': 'log2', 'max_depth': 10}. Best is trial 2 with value: 0.235784747381632.
[I 2023-11-07 17:31:28,255] Using an existing study with name 'ANN' instead of creating a new one.
[I 2023-11-07 17:31:50,373] Trial 4 finished with value: 0.2902420852736918 and parameters: {'learning_rate_init': 0.026829540332669294, 'hidden_layer_sizes': [50]}. Best is trial 4 with value: 0.2902420852736918.
[I 2023-11-07 17:31:50,380] Using an existing study with name 'linear' instead of creating a new one.
[I 2023-11-07 17:31:50,420] Trial 4 finished with value: 0.31246310770998953 and parameters: {'alpha': 0.06524195825388958, 'l1_ratio': 0.9132706027239662}. Best is trial 2 with value: 0.3123010278266924.
[I 2023-11-07 17:31:50,427] Using an existing study with name 'KRR' instead of creating a new one.
[I 2023-11-07 17:31:50,485] Trial 4 finished with value: 0.3506357310298775 and parameters: {'alpha': 0.5472972479315257, 'gamma': 7.589002924260395e-15, 'kernel': 'rbf'}. Best is trial 3 with value: 0.34279261400939265.
[I 2023-11-07 17:31:50,492] Using an existing study with name 'GB' instead of creating a new one.
[I 2023-11-07 17:31:52,361] Trial 4 finished with value: 0.2855224310340681 and parameters: {'n_estimators': 50, 'learning_rate': 0.5941312192933793, 'max_depth': 3}. Best is trial 3 with value: 0.2791749969975384.
[I 2023-11-07 17:31:52,369] Using an existing study with name 'RF' instead of creating a new one.
[I 2023-11-07 17:31:56,696] Trial 4 finished with value: 0.2761133784705266 and parameters: {'n_estimators': 10, 'max_features': 'auto', 'max_depth': None}. Best is trial 4 with value: 0.2761133784705266.
[I 2023-11-07 17:31:56,703] Using an existing study with name 'ANN' instead of creating a new one.
[I 2023-11-07 17:31:59,902] Trial 4 finished with value: 0.33882822090847214 and parameters: {'learning_rate_init': 0.011880530281835111, 'hidden_layer_sizes': [10, 10, 10]}. Best is trial 2 with value: 0.3190149049954781.
[I 2023-11-07 17:31:59,909] Using an existing study with name 'linear' instead of creating a new one.
[I 2023-11-07 17:31:59,941] Trial 4 finished with value: 0.2175575561816678 and parameters: {'alpha': 0.08973917535024016, 'l1_ratio': 0.7394773254730714}. Best is trial 3 with value: 0.2109055857294363.
[I 2023-11-07 17:31:59,947] Using an existing study with name 'KRR' instead of creating a new one.
[I 2023-11-07 17:31:59,992] Trial 4 finished with value: 0.2209701483536418 and parameters: {'alpha': 0.8518935463023871, 'gamma': 7.779576480908023e-16, 'kernel': 'laplacian'}. Best is trial 4 with value: 0.2209701483536418.
[I 2023-11-07 17:31:59,997] Using an existing study with name 'GB' instead of creating a new one.
[I 2023-11-07 17:32:00,933] Trial 4 finished with value: 0.12758161460096343 and parameters: {'n_estimators': 50, 'learning_rate': 0.4737382900534533, 'max_depth': 1}. Best is trial 3 with value: 0.12436507346202648.
[I 2023-11-07 17:32:00,940] Using an existing study with name 'RF' instead of creating a new one.
[I 2023-11-07 17:32:03,066] Trial 4 finished with value: 0.15637231466325943 and parameters: {'n_estimators': 500, 'max_features': 'log2', 'max_depth': 10}. Best is trial 2 with value: 0.1368294480595562.
[I 2023-11-07 17:32:03,073] Using an existing study with name 'ANN' instead of creating a new one.
[I 2023-11-07 17:32:03,796] Trial 4 finished with value: 3.822510171793938 and parameters: {'learning_rate_init': 0.016595671700565834, 'hidden_layer_sizes': [5]}. Best is trial 3 with value: 3.5108689877220614.
[I 2023-11-07 17:32:03,802] Using an existing study with name 'linear' instead of creating a new one.
[I 2023-11-07 17:32:03,836] Trial 3 finished with value: 0.25470640541259887 and parameters: {'alpha': 0.02095689059719154, 'l1_ratio': 0.2680556483164921}. Best is trial 1 with value: 0.25467759149475944.
[I 2023-11-07 17:32:03,841] Using an existing study with name 'KRR' instead of creating a new one.
[I 2023-11-07 17:32:04,801] Trial 3 finished with value: 0.25095292234429545 and parameters: {'alpha': 0.4574963987643353, 'gamma': 8.577994300998945e-15, 'kernel': 'linear'}. Best is trial 0 with value: 0.2507609665077765.
[I 2023-11-07 17:32:04,807] Using an existing study with name 'GB' instead of creating a new one.
[I 2023-11-07 17:32:11,979] Trial 3 finished with value: 0.24771541743829975 and parameters: {'n_estimators': 10, 'learning_rate': 0.2954242010639619, 'max_depth': 4}. Best is trial 0 with value: 0.24631789092936593.
[I 2023-11-07 17:32:11,986] Using an existing study with name 'RF' instead of creating a new one.
[I 2023-11-07 17:32:29,028] Trial 3 finished with value: 0.24552123896790368 and parameters: {'n_estimators': 50, 'max_features': 'sqrt', 'max_depth': 5}. Best is trial 1 with value: 0.2445509531198717.
[I 2023-11-07 17:32:29,034] Using an existing study with name 'ANN' instead of creating a new one.
[I 2023-11-07 17:32:39,879] Trial 3 finished with value: 0.26300109742385075 and parameters: {'learning_rate_init': 0.05768948331589845, 'hidden_layer_sizes': [10, 10]}. Best is trial 2 with value: 0.256484572110143.
[I 2023-11-07 17:32:39,885] Using an existing study with name 'linear' instead of creating a new one.
[I 2023-11-07 17:32:39,940] Trial 3 finished with value: 0.30739827997312225 and parameters: {'alpha': 0.02482800857632663, 'l1_ratio': 0.922812157006719}. Best is trial 3 with value: 0.30739827997312225.
[I 2023-11-07 17:32:39,946] Using an existing study with name 'KRR' instead of creating a new one.
[I 2023-11-07 17:32:39,990] Trial 3 finished with value: 0.32172548328621026 and parameters: {'alpha': 0.5661325127018967, 'gamma': 5.926411450070147e-15, 'kernel': 'linear'}. Best is trial 1 with value: 0.3187320810627488.
[I 2023-11-07 17:32:39,996] Using an existing study with name 'GB' instead of creating a new one.
[I 2023-11-07 17:32:41,247] Trial 3 finished with value: 0.3109995510540728 and parameters: {'n_estimators': 50, 'learning_rate': 0.26968333516140663, 'max_depth': 5}. Best is trial 2 with value: 0.309660024546424.
[I 2023-11-07 17:32:41,254] Using an existing study with name 'RF' instead of creating a new one.
[I 2023-11-07 17:32:43,891] Trial 3 finished with value: 0.29494063849672175 and parameters: {'n_estimators': 10, 'max_features': 'log2', 'max_depth': None}. Best is trial 1 with value: 0.29294834929574587.
[I 2023-11-07 17:32:43,898] Using an existing study with name 'ANN' instead of creating a new one.
[I 2023-11-07 17:32:45,582] Trial 3 finished with value: 1.6943843711377908 and parameters: {'learning_rate_init': 0.059179443068004746, 'hidden_layer_sizes': [10, 10]}. Best is trial 3 with value: 1.6943843711377908.
[I 2023-11-07 17:32:45,587] Using an existing study with name 'linear' instead of creating a new one.
[I 2023-11-07 17:32:45,623] Trial 3 finished with value: 0.20781347182277535 and parameters: {'alpha': 0.01041208891772215, 'l1_ratio': 0.6681722015125836}. Best is trial 3 with value: 0.20781347182277535.
[I 2023-11-07 17:32:45,628] Using an existing study with name 'KRR' instead of creating a new one.
[I 2023-11-07 17:32:45,666] Trial 3 finished with value: 0.2145717531693686 and parameters: {'alpha': 0.2741912686168318, 'gamma': 9.681218067337034e-15, 'kernel': 'linear'}. Best is trial 1 with value: 0.21366867701019673.
[I 2023-11-07 17:32:45,671] Using an existing study with name 'GB' instead of creating a new one.
[I 2023-11-07 17:32:46,569] Trial 3 finished with value: 0.09774487474652337 and parameters: {'n_estimators': 50, 'learning_rate': 0.5005120010569913, 'max_depth': 3}. Best is trial 3 with value: 0.09774487474652337.
[I 2023-11-07 17:32:46,576] Using an existing study with name 'RF' instead of creating a new one.
[I 2023-11-07 17:32:48,742] Trial 3 finished with value: 0.13732930201330848 and parameters: {'n_estimators': 50, 'max_features': 'log2', 'max_depth': 5}. Best is trial 2 with value: 0.12796977358527464.
[I 2023-11-07 17:32:48,748] Using an existing study with name 'ANN' instead of creating a new one.
[I 2023-11-07 17:32:49,897] Trial 3 finished with value: 4.28752588873787 and parameters: {'learning_rate_init': 0.011282053846833735, 'hidden_layer_sizes': [5, 5, 5]}. Best is trial 1 with value: 3.224885790358211.
[I 2023-11-07 17:32:49,903] Using an existing study with name 'linear' instead of creating a new one.
[I 2023-11-07 17:32:49,946] Trial 3 finished with value: 0.24680192820780744 and parameters: {'alpha': 0.045694287776357395, 'l1_ratio': 0.46838606859098164}. Best is trial 1 with value: 0.24668778803111657.
[I 2023-11-07 17:32:49,951] Using an existing study with name 'KRR' instead of creating a new one.
[I 2023-11-07 17:32:50,916] Trial 3 finished with value: 0.2392755673151703 and parameters: {'alpha': 0.9621773221300899, 'gamma': 1.7034023957027179e-15, 'kernel': 'rbf'}. Best is trial 2 with value: 0.23924402135226486.
[I 2023-11-07 17:32:50,923] Using an existing study with name 'GB' instead of creating a new one.
[I 2023-11-07 17:32:58,075] Trial 3 finished with value: 0.232797350800676 and parameters: {'n_estimators': 10, 'learning_rate': 0.2276329949900674, 'max_depth': 2}. Best is trial 3 with value: 0.232797350800676.
[I 2023-11-07 17:32:58,082] Using an existing study with name 'RF' instead of creating a new one.
[I 2023-11-07 17:33:14,594] Trial 3 finished with value: 0.23098753538028136 and parameters: {'n_estimators': 500, 'max_features': 'log2', 'max_depth': 10}. Best is trial 2 with value: 0.2307371956202666.
[I 2023-11-07 17:33:14,601] Using an existing study with name 'ANN' instead of creating a new one.
[I 2023-11-07 17:33:27,844] Trial 3 finished with value: 0.2542402045734648 and parameters: {'learning_rate_init': 0.033866842254478814, 'hidden_layer_sizes': [5]}. Best is trial 2 with value: 0.24328057856179033.
[I 2023-11-07 17:33:27,849] Using an existing study with name 'linear' instead of creating a new one.
[I 2023-11-07 17:33:27,882] Trial 3 finished with value: 0.27287458917608093 and parameters: {'alpha': 0.017737259424229025, 'l1_ratio': 0.5386013559499548}. Best is trial 2 with value: 0.2719044931371943.
[I 2023-11-07 17:33:27,887] Using an existing study with name 'KRR' instead of creating a new one.
[I 2023-11-07 17:33:27,932] Trial 3 finished with value: 0.2832077755713147 and parameters: {'alpha': 0.15064977186111306, 'gamma': 7.493632487963491e-15, 'kernel': 'rbf'}. Best is trial 3 with value: 0.2832077755713147.
[I 2023-11-07 17:33:27,937] Using an existing study with name 'GB' instead of creating a new one.
[I 2023-11-07 17:33:29,188] Trial 3 finished with value: 0.27252221086767964 and parameters: {'n_estimators': 50, 'learning_rate': 0.46064777741239243, 'max_depth': 2}. Best is trial 0 with value: 0.2649217640348484.
[I 2023-11-07 17:33:29,195] Using an existing study with name 'RF' instead of creating a new one.
[I 2023-11-07 17:33:31,730] Trial 3 finished with value: 0.2596278771157242 and parameters: {'n_estimators': 10, 'max_features': 'sqrt', 'max_depth': 3}. Best is trial 2 with value: 0.255378300724355.
[I 2023-11-07 17:33:31,736] Using an existing study with name 'ANN' instead of creating a new one.
[I 2023-11-07 17:33:32,639] Trial 3 finished with value: 1.9737979816907998 and parameters: {'learning_rate_init': 0.058088494319407546, 'hidden_layer_sizes': [10, 10]}. Best is trial 1 with value: 1.8319872272029258.
[I 2023-11-07 17:33:32,644] Using an existing study with name 'linear' instead of creating a new one.
[I 2023-11-07 17:33:32,676] Trial 3 finished with value: 0.125286460804254 and parameters: {'alpha': 0.043257237342344566, 'l1_ratio': 0.4218398671859819}. Best is trial 3 with value: 0.125286460804254.
[I 2023-11-07 17:33:32,681] Using an existing study with name 'KRR' instead of creating a new one.
[I 2023-11-07 17:33:32,717] Trial 3 finished with value: 0.12499296112108534 and parameters: {'alpha': 0.8406452380441473, 'gamma': 8.668368103177915e-16, 'kernel': 'rbf'}. Best is trial 3 with value: 0.12499296112108534.
[I 2023-11-07 17:33:32,722] Using an existing study with name 'GB' instead of creating a new one.
[I 2023-11-07 17:33:33,615] Trial 3 finished with value: 0.13394781991819732 and parameters: {'n_estimators': 200, 'learning_rate': 0.5051051731397067, 'max_depth': 2}. Best is trial 3 with value: 0.13394781991819732.
[I 2023-11-07 17:33:33,622] Using an existing study with name 'RF' instead of creating a new one.
[I 2023-11-07 17:33:35,738] Trial 3 finished with value: 0.12686756058808885 and parameters: {'n_estimators': 20, 'max_features': 'sqrt', 'max_depth': 4}. Best is trial 3 with value: 0.12686756058808885.
[I 2023-11-07 17:33:35,744] Using an existing study with name 'ANN' instead of creating a new one.
[I 2023-11-07 17:33:36,499] Trial 3 finished with value: 4.815754815136373 and parameters: {'learning_rate_init': 0.011248032700587128, 'hidden_layer_sizes': [50, 50]}. Best is trial 1 with value: 3.0110506383483333.
[I 2023-11-07 17:33:36,504] Using an existing study with name 'linear' instead of creating a new one.
[I 2023-11-07 17:33:36,538] Trial 3 finished with value: 0.2541229083971127 and parameters: {'alpha': 0.06313844201850652, 'l1_ratio': 0.3371714584337777}. Best is trial 2 with value: 0.25403816429663606.
[I 2023-11-07 17:33:36,543] Using an existing study with name 'KRR' instead of creating a new one.
[I 2023-11-07 17:33:38,117] Trial 3 finished with value: 0.24966823113825587 and parameters: {'alpha': 0.6123770193079472, 'gamma': 3.077462766816964e-15, 'kernel': 'laplacian'}. Best is trial 3 with value: 0.24966823113825587.
[I 2023-11-07 17:33:38,123] Using an existing study with name 'GB' instead of creating a new one.
