[I 2023-11-07 17:07:14,817] Using an existing study with name 'linear' instead of creating a new one.
[I 2023-11-07 17:07:14,858] Trial 6 finished with value: 0.21434861636515612 and parameters: {'alpha': 0.0423200446690952, 'l1_ratio': 0.4141232547581708}. Best is trial 5 with value: 0.21049608409845244.
[I 2023-11-07 17:07:14,865] Using an existing study with name 'KRR' instead of creating a new one.
[I 2023-11-07 17:07:15,135] Trial 6 finished with value: 0.15077376334749332 and parameters: {'alpha': 0.30870192900457055, 'gamma': 9.569738429907634e-15, 'kernel': 'laplacian'}. Best is trial 3 with value: 0.14792048671299554.
[I 2023-11-07 17:07:15,141] Using an existing study with name 'GB' instead of creating a new one.
[I 2023-11-07 17:07:16,444] Trial 6 finished with value: 0.2263450577624692 and parameters: {'n_estimators': 10, 'learning_rate': 0.024157481021952705, 'max_depth': 1}. Best is trial 5 with value: 0.15790287215256196.
[I 2023-11-07 17:07:16,452] Using an existing study with name 'RF' instead of creating a new one.
[I 2023-11-07 17:07:19,414] Trial 6 finished with value: 0.17677336626247228 and parameters: {'n_estimators': 50, 'max_features': 'log2', 'max_depth': None}. Best is trial 4 with value: 0.16261154785998602.
[I 2023-11-07 17:07:19,421] Using an existing study with name 'ANN' instead of creating a new one.
[I 2023-11-07 17:07:21,325] Trial 6 finished with value: 0.26396369599418706 and parameters: {'learning_rate_init': 0.07471391149723043, 'hidden_layer_sizes': [50]}. Best is trial 3 with value: 0.2218633477001349.
[I 2023-11-07 17:07:21,332] Using an existing study with name 'linear' instead of creating a new one.
[I 2023-11-07 17:07:21,396] Trial 6 finished with value: 0.25709143072840207 and parameters: {'alpha': 0.02722065874321434, 'l1_ratio': 0.22175359858840815}. Best is trial 4 with value: 0.25691167822082345.
[I 2023-11-07 17:07:21,403] Using an existing study with name 'KRR' instead of creating a new one.
[I 2023-11-07 17:07:22,655] Trial 6 finished with value: 0.2495241394316322 and parameters: {'alpha': 0.6642718482318362, 'gamma': 1.4331350689088363e-15, 'kernel': 'laplacian'}. Best is trial 6 with value: 0.2495241394316322.
[I 2023-11-07 17:07:22,662] Using an existing study with name 'GB' instead of creating a new one.
[I 2023-11-07 17:07:32,506] Trial 6 finished with value: 0.24313923661109668 and parameters: {'n_estimators': 10, 'learning_rate': 0.8527307221758827, 'max_depth': 3}. Best is trial 5 with value: 0.24268398989185572.
[I 2023-11-07 17:07:32,513] Using an existing study with name 'RF' instead of creating a new one.
[I 2023-11-07 17:08:13,636] Trial 6 finished with value: 0.2371191863933592 and parameters: {'n_estimators': 20, 'max_features': 'log2', 'max_depth': 3}. Best is trial 2 with value: 0.23643367289893102.
[I 2023-11-07 17:08:13,642] Using an existing study with name 'ANN' instead of creating a new one.
[I 2023-11-07 17:08:33,043] Trial 1 finished with value: 0.289836292447544 and parameters: {'learning_rate_init': 0.09888770352734137, 'hidden_layer_sizes': [10, 10, 10]}. Best is trial 0 with value: 0.28963630595478557.
[I 2023-11-07 17:08:33,049] Using an existing study with name 'linear' instead of creating a new one.
[I 2023-11-07 17:08:33,085] Trial 1 finished with value: 0.31725988138603584 and parameters: {'alpha': 0.037027517754806706, 'l1_ratio': 0.37051771750761775}. Best is trial 1 with value: 0.31725988138603584.
[I 2023-11-07 17:08:33,093] Using an existing study with name 'KRR' instead of creating a new one.
[I 2023-11-07 17:08:33,143] Trial 1 finished with value: 0.2972821705184329 and parameters: {'alpha': 0.8957658598757146, 'gamma': 9.849894975906633e-15, 'kernel': 'rbf'}. Best is trial 1 with value: 0.2972821705184329.
[I 2023-11-07 17:08:33,148] Using an existing study with name 'GB' instead of creating a new one.
[I 2023-11-07 17:08:35,010] Trial 1 finished with value: 0.2673906455658081 and parameters: {'n_estimators': 500, 'learning_rate': 0.8235596848190072, 'max_depth': 2}. Best is trial 1 with value: 0.2673906455658081.
[I 2023-11-07 17:08:35,016] Using an existing study with name 'RF' instead of creating a new one.
[I 2023-11-07 17:08:39,251] Trial 1 finished with value: 0.2717812761858673 and parameters: {'n_estimators': 10, 'max_features': 'log2', 'max_depth': 3}. Best is trial 0 with value: 0.2677642292700792.
[I 2023-11-07 17:08:39,257] Using an existing study with name 'ANN' instead of creating a new one.
[I 2023-11-07 17:08:42,224] Trial 1 finished with value: 0.3121796326453741 and parameters: {'learning_rate_init': 0.08209540500400386, 'hidden_layer_sizes': [50, 50]}. Best is trial 1 with value: 0.3121796326453741.
[I 2023-11-07 17:08:42,230] Using an existing study with name 'linear' instead of creating a new one.
[I 2023-11-07 17:08:42,263] Trial 1 finished with value: 0.21187289129156708 and parameters: {'alpha': 0.02939278866703981, 'l1_ratio': 0.5385899433753308}. Best is trial 1 with value: 0.21187289129156708.
[I 2023-11-07 17:08:42,268] Using an existing study with name 'KRR' instead of creating a new one.
[I 2023-11-07 17:08:42,305] Trial 1 finished with value: 0.14728674332771385 and parameters: {'alpha': 0.1299572518722846, 'gamma': 8.475198484929381e-15, 'kernel': 'rbf'}. Best is trial 1 with value: 0.14728674332771385.
[I 2023-11-07 17:08:42,310] Using an existing study with name 'GB' instead of creating a new one.
[I 2023-11-07 17:08:43,591] Trial 1 finished with value: 0.15461286119072667 and parameters: {'n_estimators': 20, 'learning_rate': 0.43621302087042224, 'max_depth': 4}. Best is trial 0 with value: 0.10324836117333373.
[I 2023-11-07 17:08:43,597] Using an existing study with name 'RF' instead of creating a new one.
[I 2023-11-07 17:08:46,493] Trial 1 finished with value: 0.13033864323678376 and parameters: {'n_estimators': 500, 'max_features': 'log2', 'max_depth': 2}. Best is trial 1 with value: 0.13033864323678376.
[I 2023-11-07 17:08:46,499] Using an existing study with name 'ANN' instead of creating a new one.
[I 2023-11-07 17:08:48,083] Trial 1 finished with value: 0.2618024767633292 and parameters: {'learning_rate_init': 0.07413412885025543, 'hidden_layer_sizes': [5, 5]}. Best is trial 0 with value: 0.2465075969227216.
[I 2023-11-07 17:08:48,089] Using an existing study with name 'linear' instead of creating a new one.
[I 2023-11-07 17:08:48,143] Trial 1 finished with value: 0.24762813372321282 and parameters: {'alpha': 0.029781855128576295, 'l1_ratio': 0.991960625326651}. Best is trial 1 with value: 0.24762813372321282.
[I 2023-11-07 17:08:48,148] Using an existing study with name 'KRR' instead of creating a new one.
[I 2023-11-07 17:08:49,062] Trial 1 finished with value: 0.2364314004182634 and parameters: {'alpha': 0.14059241462333621, 'gamma': 5.897308846433941e-15, 'kernel': 'laplacian'}. Best is trial 0 with value: 0.23575721399277358.
[I 2023-11-07 17:08:49,068] Using an existing study with name 'GB' instead of creating a new one.
[I 2023-11-07 17:08:58,828] Trial 1 finished with value: 0.2253864094793028 and parameters: {'n_estimators': 20, 'learning_rate': 0.15998217979784646, 'max_depth': 1}. Best is trial 1 with value: 0.2253864094793028.
[I 2023-11-07 17:08:58,834] Using an existing study with name 'RF' instead of creating a new one.
[I 2023-11-07 17:09:39,168] Trial 1 finished with value: 0.2190944068080977 and parameters: {'n_estimators': 50, 'max_features': 'log2', 'max_depth': None}. Best is trial 0 with value: 0.21890862037935035.
[I 2023-11-07 17:09:39,174] Using an existing study with name 'ANN' instead of creating a new one.
[I 2023-11-07 17:09:58,813] Trial 1 finished with value: 0.2681718189713164 and parameters: {'learning_rate_init': 0.019118161158977846, 'hidden_layer_sizes': [10]}. Best is trial 0 with value: 0.26800315095819954.
[I 2023-11-07 17:09:58,820] Using an existing study with name 'linear' instead of creating a new one.
[I 2023-11-07 17:09:58,859] Trial 1 finished with value: 0.2807509087576459 and parameters: {'alpha': 0.02547461478335959, 'l1_ratio': 0.20418663415815774}. Best is trial 0 with value: 0.2800306419417924.
[I 2023-11-07 17:09:58,865] Using an existing study with name 'KRR' instead of creating a new one.
[I 2023-11-07 17:09:58,920] Trial 1 finished with value: 0.2773653518171047 and parameters: {'alpha': 0.41895445469687304, 'gamma': 5.987804901035284e-15, 'kernel': 'rbf'}. Best is trial 1 with value: 0.2773653518171047.
[I 2023-11-07 17:09:58,926] Using an existing study with name 'GB' instead of creating a new one.
[I 2023-11-07 17:10:00,794] Trial 1 finished with value: 0.25579944588375864 and parameters: {'n_estimators': 50, 'learning_rate': 0.10323356869088876, 'max_depth': 3}. Best is trial 1 with value: 0.25579944588375864.
[I 2023-11-07 17:10:00,801] Using an existing study with name 'RF' instead of creating a new one.
[I 2023-11-07 17:10:04,725] Trial 1 finished with value: 0.24721923389918024 and parameters: {'n_estimators': 50, 'max_features': 'sqrt', 'max_depth': 2}. Best is trial 1 with value: 0.24721923389918024.
[I 2023-11-07 17:10:04,731] Using an existing study with name 'ANN' instead of creating a new one.
[I 2023-11-07 17:10:07,197] Trial 1 finished with value: 0.35032986967116436 and parameters: {'learning_rate_init': 0.061568863391276527, 'hidden_layer_sizes': [20]}. Best is trial 0 with value: 0.33696097637544925.
[I 2023-11-07 17:10:07,202] Using an existing study with name 'linear' instead of creating a new one.
[I 2023-11-07 17:10:07,241] Trial 1 finished with value: 0.12714143589982208 and parameters: {'alpha': 0.04695207342540243, 'l1_ratio': 0.6028679455720838}. Best is trial 0 with value: 0.1270292187149268.
[I 2023-11-07 17:10:07,245] Using an existing study with name 'KRR' instead of creating a new one.
[I 2023-11-07 17:10:07,287] Trial 1 finished with value: 0.12965926624604462 and parameters: {'alpha': 0.5594231396035696, 'gamma': 4.802611937449941e-16, 'kernel': 'rbf'}. Best is trial 1 with value: 0.12965926624604462.
[I 2023-11-07 17:10:07,292] Using an existing study with name 'GB' instead of creating a new one.
[I 2023-11-07 17:10:08,616] Trial 1 finished with value: 0.13605880775044277 and parameters: {'n_estimators': 500, 'learning_rate': 0.3279800015082921, 'max_depth': 3}. Best is trial 1 with value: 0.13605880775044277.
[I 2023-11-07 17:10:08,622] Using an existing study with name 'RF' instead of creating a new one.
[I 2023-11-07 17:10:11,571] Trial 1 finished with value: 0.13283602433240724 and parameters: {'n_estimators': 200, 'max_features': 'sqrt', 'max_depth': 10}. Best is trial 0 with value: 0.13238265975279348.
[I 2023-11-07 17:10:11,577] Using an existing study with name 'ANN' instead of creating a new one.
[I 2023-11-07 17:10:13,138] Trial 1 finished with value: 0.24416734248193808 and parameters: {'learning_rate_init': 0.05047600876282974, 'hidden_layer_sizes': [50, 50, 50]}. Best is trial 1 with value: 0.24416734248193808.
[I 2023-11-07 17:10:13,144] Using an existing study with name 'linear' instead of creating a new one.
[I 2023-11-07 17:10:13,202] Trial 1 finished with value: 0.25624895264142994 and parameters: {'alpha': 0.026523051105745377, 'l1_ratio': 0.09348221498404541}. Best is trial 1 with value: 0.25624895264142994.
[I 2023-11-07 17:10:13,207] Using an existing study with name 'KRR' instead of creating a new one.
[I 2023-11-07 17:10:14,126] Trial 1 finished with value: 0.2500477655162643 and parameters: {'alpha': 0.6262370448275887, 'gamma': 7.386917244065251e-15, 'kernel': 'laplacian'}. Best is trial 1 with value: 0.2500477655162643.
[I 2023-11-07 17:10:14,131] Using an existing study with name 'GB' instead of creating a new one.
[I 2023-11-07 17:10:23,894] Trial 1 finished with value: 0.24271126246930977 and parameters: {'n_estimators': 200, 'learning_rate': 0.0957054414401203, 'max_depth': 1}. Best is trial 0 with value: 0.2423317415188532.
[I 2023-11-07 17:10:23,901] Using an existing study with name 'RF' instead of creating a new one.
[I 2023-11-07 17:11:04,772] Trial 1 finished with value: 0.23609156115525554 and parameters: {'n_estimators': 50, 'max_features': 'sqrt', 'max_depth': 5}. Best is trial 1 with value: 0.23609156115525554.
[I 2023-11-07 17:11:04,779] Using an existing study with name 'ANN' instead of creating a new one.
[I 2023-11-07 17:11:24,650] Trial 1 finished with value: 0.2924621123347735 and parameters: {'learning_rate_init': 0.05562738118441408, 'hidden_layer_sizes': [50]}. Best is trial 1 with value: 0.2924621123347735.
[I 2023-11-07 17:11:24,656] Using an existing study with name 'linear' instead of creating a new one.
[I 2023-11-07 17:11:24,691] Trial 1 finished with value: 0.31280515378624024 and parameters: {'alpha': 0.04937982444593594, 'l1_ratio': 0.1556347173217656}. Best is trial 0 with value: 0.3127190433529298.
[I 2023-11-07 17:11:24,696] Using an existing study with name 'KRR' instead of creating a new one.
[I 2023-11-07 17:11:24,748] Trial 1 finished with value: 0.35253880489970557 and parameters: {'alpha': 0.5392683376842816, 'gamma': 9.933201273289516e-16, 'kernel': 'rbf'}. Best is trial 0 with value: 0.3490277183368873.
[I 2023-11-07 17:11:24,754] Using an existing study with name 'GB' instead of creating a new one.
[I 2023-11-07 17:11:26,621] Trial 1 finished with value: 0.28265874413547687 and parameters: {'n_estimators': 500, 'learning_rate': 0.5554388435170868, 'max_depth': 1}. Best is trial 1 with value: 0.28265874413547687.
[I 2023-11-07 17:11:26,627] Using an existing study with name 'RF' instead of creating a new one.
[I 2023-11-07 17:11:30,939] Trial 1 finished with value: 0.28012407509771164 and parameters: {'n_estimators': 10, 'max_features': 'sqrt', 'max_depth': 5}. Best is trial 0 with value: 0.2761349382232521.
[I 2023-11-07 17:11:30,945] Using an existing study with name 'ANN' instead of creating a new one.
[I 2023-11-07 17:11:34,983] Trial 1 finished with value: 0.34131694728478923 and parameters: {'learning_rate_init': 0.08899576366554132, 'hidden_layer_sizes': [10]}. Best is trial 0 with value: 0.32675560518790286.
[I 2023-11-07 17:11:34,988] Using an existing study with name 'linear' instead of creating a new one.
[I 2023-11-07 17:11:35,040] Trial 1 finished with value: 0.21201947379903233 and parameters: {'alpha': 0.04250969933248896, 'l1_ratio': 0.22612473141533374}. Best is trial 1 with value: 0.21201947379903233.
[I 2023-11-07 17:11:35,045] Using an existing study with name 'KRR' instead of creating a new one.
[I 2023-11-07 17:11:35,081] Trial 1 finished with value: 0.22688651749213243 and parameters: {'alpha': 0.933132161423501, 'gamma': 8.68674974953187e-15, 'kernel': 'laplacian'}. Best is trial 0 with value: 0.22161596581278975.
[I 2023-11-07 17:11:35,086] Using an existing study with name 'GB' instead of creating a new one.
[I 2023-11-07 17:11:35,989] Trial 1 finished with value: 0.13159168021514525 and parameters: {'n_estimators': 20, 'learning_rate': 0.6086855629867898, 'max_depth': 3}. Best is trial 1 with value: 0.13159168021514525.
[I 2023-11-07 17:11:35,995] Using an existing study with name 'RF' instead of creating a new one.
[I 2023-11-07 17:11:38,162] Trial 1 finished with value: 0.14719727685027684 and parameters: {'n_estimators': 20, 'max_features': 'sqrt', 'max_depth': 5}. Best is trial 1 with value: 0.14719727685027684.
[I 2023-11-07 17:11:38,168] Using an existing study with name 'ANN' instead of creating a new one.
[I 2023-11-07 17:11:39,067] Trial 1 finished with value: 3.9561638962655734 and parameters: {'learning_rate_init': 0.029652303543019478, 'hidden_layer_sizes': [5, 5, 5]}. Best is trial 1 with value: 3.9561638962655734.
[I 2023-11-07 17:11:39,073] A new study created in Journal with name: linear
[I 2023-11-07 17:11:39,114] Trial 0 finished with value: 0.25478760852186005 and parameters: {'alpha': 0.04092351015250634, 'l1_ratio': 0.1893317556749733}. Best is trial 0 with value: 0.25478760852186005.
[I 2023-11-07 17:11:39,118] A new study created in Journal with name: KRR
[I 2023-11-07 17:11:39,995] Trial 0 finished with value: 0.2507609665077765 and parameters: {'alpha': 0.4398071666544524, 'gamma': 7.392146900686814e-15, 'kernel': 'rbf'}. Best is trial 0 with value: 0.2507609665077765.
[I 2023-11-07 17:11:40,000] A new study created in Journal with name: GB
[I 2023-11-07 17:11:47,192] Trial 0 finished with value: 0.24631789092936593 and parameters: {'n_estimators': 200, 'learning_rate': 0.2458979831041545, 'max_depth': 5}. Best is trial 0 with value: 0.24631789092936593.
[I 2023-11-07 17:11:47,199] A new study created in Journal with name: RF
[I 2023-11-07 17:12:04,260] Trial 0 finished with value: 0.24775482652829872 and parameters: {'n_estimators': 50, 'max_features': 'sqrt', 'max_depth': 2}. Best is trial 0 with value: 0.24775482652829872.
[I 2023-11-07 17:12:04,266] A new study created in Journal with name: ANN
[I 2023-11-07 17:12:17,875] Trial 0 finished with value: 0.2644675508221352 and parameters: {'learning_rate_init': 0.019218887583514168, 'hidden_layer_sizes': [5, 5, 5]}. Best is trial 0 with value: 0.2644675508221352.
[I 2023-11-07 17:12:17,880] A new study created in Journal with name: linear
[I 2023-11-07 17:12:17,913] Trial 0 finished with value: 0.3084181628485548 and parameters: {'alpha': 0.049760448320556386, 'l1_ratio': 0.22857207966289983}. Best is trial 0 with value: 0.3084181628485548.
[I 2023-11-07 17:12:17,918] A new study created in Journal with name: KRR
[I 2023-11-07 17:12:17,961] Trial 0 finished with value: 0.3191788888241646 and parameters: {'alpha': 0.5442834909151862, 'gamma': 9.136277093616027e-15, 'kernel': 'linear'}. Best is trial 0 with value: 0.3191788888241646.
[I 2023-11-07 17:12:17,966] A new study created in Journal with name: GB
[I 2023-11-07 17:12:19,209] Trial 0 finished with value: 0.3169929810497198 and parameters: {'n_estimators': 50, 'learning_rate': 0.2794913975031061, 'max_depth': 1}. Best is trial 0 with value: 0.3169929810497198.
[I 2023-11-07 17:12:19,215] A new study created in Journal with name: RF
[I 2023-11-07 17:12:21,836] Trial 0 finished with value: 0.29976977459959686 and parameters: {'n_estimators': 50, 'max_features': 'log2', 'max_depth': None}. Best is trial 0 with value: 0.29976977459959686.
[I 2023-11-07 17:12:21,841] A new study created in Journal with name: ANN
[I 2023-11-07 17:12:22,882] Trial 0 finished with value: 2.314678992777019 and parameters: {'learning_rate_init': 0.09974089576434778, 'hidden_layer_sizes': [50, 50]}. Best is trial 0 with value: 2.314678992777019.
[I 2023-11-07 17:12:22,887] A new study created in Journal with name: linear
[I 2023-11-07 17:12:22,947] Trial 0 finished with value: 0.21164275295371157 and parameters: {'alpha': 0.02380977408154973, 'l1_ratio': 0.48194767204709366}. Best is trial 0 with value: 0.21164275295371157.
[I 2023-11-07 17:12:22,952] A new study created in Journal with name: KRR
[I 2023-11-07 17:12:23,018] Trial 0 finished with value: 0.21855212137304345 and parameters: {'alpha': 0.08046974645504452, 'gamma': 8.087317572849003e-15, 'kernel': 'rbf'}. Best is trial 0 with value: 0.21855212137304345.
[I 2023-11-07 17:12:23,023] A new study created in Journal with name: GB
[I 2023-11-07 17:12:23,973] Trial 0 finished with value: 0.11603163221557662 and parameters: {'n_estimators': 20, 'learning_rate': 0.8828765165061809, 'max_depth': 1}. Best is trial 0 with value: 0.11603163221557662.
[I 2023-11-07 17:12:23,979] A new study created in Journal with name: RF
[I 2023-11-07 17:12:26,084] Trial 0 finished with value: 0.13688549824105645 and parameters: {'n_estimators': 200, 'max_features': 'auto', 'max_depth': 4}. Best is trial 0 with value: 0.13688549824105645.
[I 2023-11-07 17:12:26,090] A new study created in Journal with name: ANN
[I 2023-11-07 17:12:26,966] Trial 0 finished with value: 3.2493659286462506 and parameters: {'learning_rate_init': 0.0791321638557223, 'hidden_layer_sizes': [5, 5]}. Best is trial 0 with value: 3.2493659286462506.
[I 2023-11-07 17:12:26,971] A new study created in Journal with name: linear
[I 2023-11-07 17:12:27,006] Trial 0 finished with value: 0.24679969911670252 and parameters: {'alpha': 0.09439282993793481, 'l1_ratio': 0.5433204568201354}. Best is trial 0 with value: 0.24679969911670252.
[I 2023-11-07 17:12:27,011] A new study created in Journal with name: KRR
[I 2023-11-07 17:12:27,881] Trial 0 finished with value: 0.23952635718112014 and parameters: {'alpha': 0.8234776828771981, 'gamma': 3.0998750146521714e-15, 'kernel': 'linear'}. Best is trial 0 with value: 0.23952635718112014.
[I 2023-11-07 17:12:27,886] A new study created in Journal with name: GB
[I 2023-11-07 17:12:35,045] Trial 0 finished with value: 0.23529146944340065 and parameters: {'n_estimators': 10, 'learning_rate': 0.8224909023195965, 'max_depth': 5}. Best is trial 0 with value: 0.23529146944340065.
[I 2023-11-07 17:12:35,051] A new study created in Journal with name: RF
[I 2023-11-07 17:12:51,557] Trial 0 finished with value: 0.23119801221647754 and parameters: {'n_estimators': 10, 'max_features': 'sqrt', 'max_depth': 4}. Best is trial 0 with value: 0.23119801221647754.
[I 2023-11-07 17:12:51,563] A new study created in Journal with name: ANN
[I 2023-11-07 17:13:04,610] Trial 0 finished with value: 0.2610051061088237 and parameters: {'learning_rate_init': 0.06214878171363768, 'hidden_layer_sizes': [5]}. Best is trial 0 with value: 0.2610051061088237.
[I 2023-11-07 17:13:04,615] A new study created in Journal with name: linear
[I 2023-11-07 17:13:04,651] Trial 0 finished with value: 0.2734840674702814 and parameters: {'alpha': 0.06043822600916502, 'l1_ratio': 0.585867532986771}. Best is trial 0 with value: 0.2734840674702814.
[I 2023-11-07 17:13:04,655] A new study created in Journal with name: KRR
