[I 2023-11-03 23:53:10,447] Trial 242 finished with value: 0.24954982101140022 and parameters: {'alpha': 0.21051322206681233, 'gamma': 4.7158796260669664e-15, 'kernel': 'laplacian'}. Best is trial 46 with value: 0.24894111818082743.
[I 2023-11-03 23:53:10,543] Trial 248 finished with value: 0.25082728689789446 and parameters: {'alpha': 0.5025326954897089, 'gamma': 1.1635164196771566e-15, 'kernel': 'laplacian'}. Best is trial 46 with value: 0.24894111818082743.
[I 2023-11-03 23:53:11,220] Trial 246 finished with value: 0.25139341557351796 and parameters: {'alpha': 0.504765720238619, 'gamma': 4.68070279047058e-15, 'kernel': 'laplacian'}. Best is trial 46 with value: 0.24894111818082743.
[I 2023-11-03 23:53:12,467] Trial 267 finished with value: 0.24948326992132544 and parameters: {'alpha': 0.21015380262796016, 'gamma': 4.171418834423337e-15, 'kernel': 'laplacian'}. Best is trial 46 with value: 0.24894111818082743.
[I 2023-11-03 23:53:18,997] Trial 269 finished with value: 0.2517899898795566 and parameters: {'alpha': 0.21257930983102338, 'gamma': 4.751256810135286e-15, 'kernel': 'laplacian'}. Best is trial 46 with value: 0.24894111818082743.
[I 2023-11-03 23:53:19,009] Trial 250 finished with value: 0.251233283975302 and parameters: {'alpha': 0.5105890205120478, 'gamma': 5.401743929630045e-15, 'kernel': 'laplacian'}. Best is trial 46 with value: 0.24894111818082743.
[I 2023-11-03 23:53:25,790] Trial 297 finished with value: 0.2522196528087692 and parameters: {'alpha': 0.19612090184867045, 'gamma': 4.823712371354894e-15, 'kernel': 'laplacian'}. Best is trial 46 with value: 0.24894111818082743.
[I 2023-11-03 23:53:25,811] Trial 295 finished with value: 0.2502924249077928 and parameters: {'alpha': 0.15757707827015358, 'gamma': 4.852281949804359e-15, 'kernel': 'laplacian'}. Best is trial 46 with value: 0.24894111818082743.
[I 2023-11-03 23:53:26,903] Trial 300 finished with value: 0.2511763637694355 and parameters: {'alpha': 0.18858044445456373, 'gamma': 4.85490511031964e-15, 'kernel': 'laplacian'}. Best is trial 46 with value: 0.24894111818082743.
[I 2023-11-03 23:53:26,921] Trial 234 finished with value: 0.2513892487542424 and parameters: {'alpha': 0.2000179517916328, 'gamma': 5.513233392527904e-15, 'kernel': 'laplacian'}. Best is trial 46 with value: 0.24894111818082743.
[I 2023-11-03 23:53:26,925] Trial 232 finished with value: 0.2514958480973957 and parameters: {'alpha': 0.5047535289367021, 'gamma': 4.1719224616788574e-15, 'kernel': 'laplacian'}. Best is trial 46 with value: 0.24894111818082743.
[I 2023-11-03 23:53:26,927] Trial 303 finished with value: 0.2520989534484889 and parameters: {'alpha': 0.18854368619331432, 'gamma': 4.803413182004075e-15, 'kernel': 'laplacian'}. Best is trial 46 with value: 0.24894111818082743.
[I 2023-11-03 23:53:27,794] Trial 236 finished with value: 0.2502269388508931 and parameters: {'alpha': 0.20057815744745108, 'gamma': 4.712493057849931e-15, 'kernel': 'laplacian'}. Best is trial 46 with value: 0.24894111818082743.
[I 2023-11-03 23:53:28,114] Trial 233 finished with value: 0.2514038000530721 and parameters: {'alpha': 0.22051201753385785, 'gamma': 4.8691243665268495e-15, 'kernel': 'laplacian'}. Best is trial 46 with value: 0.24894111818082743.
[I 2023-11-03 23:53:28,195] Trial 229 finished with value: 0.2510976765847129 and parameters: {'alpha': 0.1869922052921114, 'gamma': 4.8137842764008465e-15, 'kernel': 'laplacian'}. Best is trial 46 with value: 0.24894111818082743.
[I 2023-11-03 23:53:28,227] Trial 284 finished with value: 0.2518841822044751 and parameters: {'alpha': 0.18882091383236135, 'gamma': 4.785943861810865e-15, 'kernel': 'laplacian'}. Best is trial 46 with value: 0.24894111818082743.
[I 2023-11-03 23:53:28,235] Trial 285 finished with value: 0.2513224949810536 and parameters: {'alpha': 0.22576649805653753, 'gamma': 5.131228262801528e-15, 'kernel': 'laplacian'}. Best is trial 46 with value: 0.24894111818082743.
[I 2023-11-03 23:53:31,004] Trial 281 finished with value: 0.25100083301925463 and parameters: {'alpha': 0.25475912810317675, 'gamma': 4.703480448834844e-15, 'kernel': 'laplacian'}. Best is trial 46 with value: 0.24894111818082743.
[I 2023-11-03 23:53:33,020] Trial 288 finished with value: 0.2518302914393801 and parameters: {'alpha': 0.22749501438875444, 'gamma': 5.497468373677223e-15, 'kernel': 'laplacian'}. Best is trial 46 with value: 0.24894111818082743.
[I 2023-11-03 23:53:38,648] Trial 252 finished with value: 0.25110868526354463 and parameters: {'alpha': 0.5001143296196462, 'gamma': 4.770367273642258e-15, 'kernel': 'laplacian'}. Best is trial 46 with value: 0.24894111818082743.
[I 2023-11-03 23:53:38,818] Trial 283 finished with value: 0.25002219042718443 and parameters: {'alpha': 0.5011279866686269, 'gamma': 4.7706351294750855e-15, 'kernel': 'laplacian'}. Best is trial 46 with value: 0.24894111818082743.
[I 2023-11-03 23:53:39,217] Trial 237 finished with value: 0.25130119843255877 and parameters: {'alpha': 0.49613218058428343, 'gamma': 5.185511428841795e-15, 'kernel': 'laplacian'}. Best is trial 46 with value: 0.24894111818082743.
[I 2023-11-03 23:53:39,310] Trial 254 finished with value: 0.2505685004463486 and parameters: {'alpha': 0.19673137967730606, 'gamma': 4.861754878978694e-15, 'kernel': 'laplacian'}. Best is trial 46 with value: 0.24894111818082743.
[I 2023-11-03 23:53:39,644] Trial 290 finished with value: 0.2492696507862114 and parameters: {'alpha': 0.2355137182384631, 'gamma': 4.7468040173391704e-15, 'kernel': 'laplacian'}. Best is trial 46 with value: 0.24894111818082743.
[I 2023-11-03 23:53:40,552] Trial 271 finished with value: 0.25079708570765474 and parameters: {'alpha': 0.1920792860524706, 'gamma': 4.657838182265552e-15, 'kernel': 'laplacian'}. Best is trial 46 with value: 0.24894111818082743.
[I 2023-11-03 23:53:40,555] Trial 294 finished with value: 0.25036635211148545 and parameters: {'alpha': 0.20121011568592517, 'gamma': 5.300463895518262e-15, 'kernel': 'laplacian'}. Best is trial 46 with value: 0.24894111818082743.
[I 2023-11-03 23:53:40,563] Trial 293 finished with value: 0.25027890373809986 and parameters: {'alpha': 0.19061339175275585, 'gamma': 4.9522280590618345e-15, 'kernel': 'laplacian'}. Best is trial 46 with value: 0.24894111818082743.
[I 2023-11-03 23:53:40,590] Trial 264 finished with value: 0.2502299849483291 and parameters: {'alpha': 0.22374369463166444, 'gamma': 4.893810845003115e-15, 'kernel': 'laplacian'}. Best is trial 46 with value: 0.24894111818082743.
[I 2023-11-03 23:53:40,594] Trial 292 finished with value: 0.25167925803669866 and parameters: {'alpha': 0.225429144952895, 'gamma': 5.57817703366931e-15, 'kernel': 'laplacian'}. Best is trial 46 with value: 0.24894111818082743.
[I 2023-11-03 23:53:40,598] Trial 270 finished with value: 0.250458790420173 and parameters: {'alpha': 0.20381365137655466, 'gamma': 5.285829494139542e-15, 'kernel': 'laplacian'}. Best is trial 46 with value: 0.24894111818082743.
[I 2023-11-03 23:53:40,608] Trial 310 finished with value: 0.25073966465501807 and parameters: {'alpha': 0.19861086087108998, 'gamma': 4.837985350073266e-15, 'kernel': 'laplacian'}. Best is trial 46 with value: 0.24894111818082743.
[I 2023-11-03 23:53:44,628] Trial 302 finished with value: 0.2510017980740024 and parameters: {'alpha': 0.1945263148417363, 'gamma': 1.4564344422169396e-15, 'kernel': 'laplacian'}. Best is trial 46 with value: 0.24894111818082743.
[I 2023-11-03 23:53:44,778] Trial 301 finished with value: 0.2496578896680209 and parameters: {'alpha': 0.2120907156848927, 'gamma': 5.267249542370013e-15, 'kernel': 'laplacian'}. Best is trial 46 with value: 0.24894111818082743.
[I 2023-11-03 23:53:45,173] Trial 272 finished with value: 0.25224824844850047 and parameters: {'alpha': 0.18911206105938577, 'gamma': 4.827698703958484e-15, 'kernel': 'laplacian'}. Best is trial 46 with value: 0.24894111818082743.
[I 2023-11-03 23:53:47,099] Trial 279 finished with value: 0.25184534826725896 and parameters: {'alpha': 0.19227733499987135, 'gamma': 5.4881732790434245e-15, 'kernel': 'laplacian'}. Best is trial 46 with value: 0.24894111818082743.
[I 2023-11-03 23:53:47,700] Trial 314 finished with value: 0.2520848186210347 and parameters: {'alpha': 0.18398237208536808, 'gamma': 4.704939444946482e-15, 'kernel': 'laplacian'}. Best is trial 46 with value: 0.24894111818082743.
[I 2023-11-03 23:53:49,047] Trial 241 finished with value: 0.2522948355420284 and parameters: {'alpha': 0.1849699691777506, 'gamma': 4.296125493478089e-15, 'kernel': 'laplacian'}. Best is trial 46 with value: 0.24894111818082743.
[I 2023-11-03 23:53:51,401] Trial 239 finished with value: 0.2509944491611484 and parameters: {'alpha': 0.2081778323008624, 'gamma': 4.742694727468597e-15, 'kernel': 'laplacian'}. Best is trial 46 with value: 0.24894111818082743.
[I 2023-11-03 23:53:51,995] Trial 308 finished with value: 0.25125651020096823 and parameters: {'alpha': 0.25098528381646945, 'gamma': 5.041844194352357e-15, 'kernel': 'laplacian'}. Best is trial 46 with value: 0.24894111818082743.
[I 2023-11-03 23:53:52,908] Trial 286 finished with value: 0.2500086156646765 and parameters: {'alpha': 0.18422508976950158, 'gamma': 4.2871070689191305e-15, 'kernel': 'laplacian'}. Best is trial 46 with value: 0.24894111818082743.
[I 2023-11-03 23:53:54,277] Trial 287 finished with value: 0.25184327442367765 and parameters: {'alpha': 0.19558816923414937, 'gamma': 4.699955630778846e-15, 'kernel': 'laplacian'}. Best is trial 46 with value: 0.24894111818082743.
[I 2023-11-03 23:53:55,385] Trial 243 finished with value: 0.2509168008722421 and parameters: {'alpha': 0.18206809070083396, 'gamma': 4.091257110720608e-15, 'kernel': 'laplacian'}. Best is trial 46 with value: 0.24894111818082743.
[I 2023-11-03 23:53:55,914] Trial 251 finished with value: 0.2518821036796362 and parameters: {'alpha': 0.21311136774453876, 'gamma': 4.17822779342982e-15, 'kernel': 'laplacian'}. Best is trial 46 with value: 0.24894111818082743.
[I 2023-11-03 23:53:56,959] Trial 306 finished with value: 0.2501646806091655 and parameters: {'alpha': 0.24792642898350237, 'gamma': 5.324657272603876e-15, 'kernel': 'laplacian'}. Best is trial 46 with value: 0.24894111818082743.
[I 2023-11-03 23:53:58,234] Trial 321 finished with value: 0.2506424849854531 and parameters: {'alpha': 0.22521488481266383, 'gamma': 4.544130643418472e-15, 'kernel': 'laplacian'}. Best is trial 46 with value: 0.24894111818082743.
[I 2023-11-03 23:53:58,838] Trial 265 finished with value: 0.24985108712501367 and parameters: {'alpha': 0.22081984942199978, 'gamma': 5.36747326188268e-15, 'kernel': 'laplacian'}. Best is trial 46 with value: 0.24894111818082743.
[I 2023-11-03 23:53:58,839] Trial 255 finished with value: 0.24944037643688569 and parameters: {'alpha': 0.2294755684471373, 'gamma': 4.607580505716223e-15, 'kernel': 'laplacian'}. Best is trial 46 with value: 0.24894111818082743.
[I 2023-11-03 23:53:58,999] Trial 263 finished with value: 0.2517034655466643 and parameters: {'alpha': 0.23836460554806388, 'gamma': 4.137669987193764e-15, 'kernel': 'laplacian'}. Best is trial 46 with value: 0.24894111818082743.
[I 2023-11-03 23:54:00,127] Trial 296 finished with value: 0.2505757111363382 and parameters: {'alpha': 0.25345929895308233, 'gamma': 4.357468804222167e-15, 'kernel': 'laplacian'}. Best is trial 46 with value: 0.24894111818082743.
[I 2023-11-03 23:54:00,180] Trial 259 finished with value: 0.2517772743105284 and parameters: {'alpha': 0.1926992364320579, 'gamma': 4.095832153835833e-15, 'kernel': 'laplacian'}. Best is trial 46 with value: 0.24894111818082743.
[I 2023-11-03 23:54:02,495] Trial 298 finished with value: 0.25098003806219943 and parameters: {'alpha': 0.23709767325688347, 'gamma': 5.088536343471449e-15, 'kernel': 'laplacian'}. Best is trial 46 with value: 0.24894111818082743.
[I 2023-11-03 23:54:03,233] Trial 323 finished with value: 0.25073613585947224 and parameters: {'alpha': 0.22482143608334554, 'gamma': 4.230109381348622e-15, 'kernel': 'laplacian'}. Best is trial 46 with value: 0.24894111818082743.
[I 2023-11-03 23:54:03,914] Trial 231 finished with value: 0.2498186878123769 and parameters: {'alpha': 0.20241596340024245, 'gamma': 5.191415858227673e-15, 'kernel': 'laplacian'}. Best is trial 46 with value: 0.24894111818082743.
[I 2023-11-03 23:54:04,213] Trial 238 finished with value: 0.25147373044855903 and parameters: {'alpha': 0.2239491909631318, 'gamma': 4.821352235382334e-15, 'kernel': 'laplacian'}. Best is trial 46 with value: 0.24894111818082743.
[I 2023-11-03 23:54:04,247] Trial 322 finished with value: 0.25106147247665317 and parameters: {'alpha': 0.24629015683088298, 'gamma': 4.193639628528155e-15, 'kernel': 'laplacian'}. Best is trial 46 with value: 0.24894111818082743.
[I 2023-11-03 23:54:04,422] Trial 282 finished with value: 0.25146024753400514 and parameters: {'alpha': 0.18129342363194542, 'gamma': 5.350234140378715e-15, 'kernel': 'laplacian'}. Best is trial 46 with value: 0.24894111818082743.
[I 2023-11-03 23:54:04,429] Trial 311 finished with value: 0.2523545881045943 and parameters: {'alpha': 0.25264023247569056, 'gamma': 4.3538215611292796e-15, 'kernel': 'laplacian'}. Best is trial 46 with value: 0.24894111818082743.
[I 2023-11-03 23:54:04,874] Trial 289 finished with value: 0.2490280175673102 and parameters: {'alpha': 0.2473787647882423, 'gamma': 4.620308597125425e-15, 'kernel': 'laplacian'}. Best is trial 46 with value: 0.24894111818082743.
[I 2023-11-03 23:54:05,158] Trial 266 finished with value: 0.25123563735313387 and parameters: {'alpha': 0.18235931074740105, 'gamma': 4.13081442932593e-15, 'kernel': 'laplacian'}. Best is trial 46 with value: 0.24894111818082743.
[I 2023-11-03 23:54:05,572] Trial 305 finished with value: 0.25207987265924237 and parameters: {'alpha': 0.2470312134605222, 'gamma': 4.187068966716987e-15, 'kernel': 'linear'}. Best is trial 46 with value: 0.24894111818082743.
[I 2023-11-03 23:54:05,576] Trial 230 finished with value: 0.25290532856473064 and parameters: {'alpha': 0.24481032143481218, 'gamma': 4.518546883079641e-15, 'kernel': 'laplacian'}. Best is trial 46 with value: 0.24894111818082743.
[I 2023-11-03 23:54:05,581] Trial 228 finished with value: 0.2502903055005131 and parameters: {'alpha': 0.2553375278077285, 'gamma': 5.1646909328426435e-15, 'kernel': 'laplacian'}. Best is trial 46 with value: 0.24894111818082743.
[I 2023-11-03 23:54:05,613] Trial 313 finished with value: 0.2515844197303015 and parameters: {'alpha': 0.23841828405571305, 'gamma': 4.114085021747923e-15, 'kernel': 'linear'}. Best is trial 46 with value: 0.24894111818082743.
[I 2023-11-03 23:54:06,359] Trial 324 finished with value: 0.25106042688185415 and parameters: {'alpha': 0.2517802994458335, 'gamma': 4.210721519106176e-15, 'kernel': 'linear'}. Best is trial 46 with value: 0.24894111818082743.
[I 2023-11-03 23:54:06,861] Trial 258 finished with value: 0.2514229480354138 and parameters: {'alpha': 0.18068312120922242, 'gamma': 4.11195303814441e-15, 'kernel': 'laplacian'}. Best is trial 46 with value: 0.24894111818082743.
[I 2023-11-03 23:54:06,866] Trial 319 finished with value: 0.2507910150489905 and parameters: {'alpha': 0.2462991366562548, 'gamma': 4.226779937213505e-15, 'kernel': 'laplacian'}. Best is trial 46 with value: 0.24894111818082743.
[I 2023-11-03 23:54:06,936] Trial 277 finished with value: 0.250928883238767 and parameters: {'alpha': 0.2510286879693059, 'gamma': 4.402312185044225e-15, 'kernel': 'laplacian'}. Best is trial 46 with value: 0.24894111818082743.
[I 2023-11-03 23:54:07,088] Trial 315 finished with value: 0.24975594736199425 and parameters: {'alpha': 0.2477723236346374, 'gamma': 3.886538427584693e-15, 'kernel': 'linear'}. Best is trial 46 with value: 0.24894111818082743.
[I 2023-11-03 23:54:07,107] Trial 316 finished with value: 0.25164557668024795 and parameters: {'alpha': 0.19802422872816053, 'gamma': 4.266102424550207e-15, 'kernel': 'laplacian'}. Best is trial 46 with value: 0.24894111818082743.
[I 2023-11-03 23:54:07,643] Trial 291 finished with value: 0.25072821192587486 and parameters: {'alpha': 0.23752038544387732, 'gamma': 4.331605447219905e-15, 'kernel': 'linear'}. Best is trial 46 with value: 0.24894111818082743.
[I 2023-11-03 23:54:07,805] Trial 327 finished with value: 0.25089827090738154 and parameters: {'alpha': 0.6748649219811421, 'gamma': 4.426378455761851e-15, 'kernel': 'linear'}. Best is trial 46 with value: 0.24894111818082743.
[I 2023-11-03 23:54:07,874] Trial 299 finished with value: 0.25168432812789 and parameters: {'alpha': 0.24537322096363756, 'gamma': 4.2996637518991466e-15, 'kernel': 'linear'}. Best is trial 46 with value: 0.24894111818082743.
[I 2023-11-03 23:54:08,257] Trial 309 finished with value: 0.25083820409154334 and parameters: {'alpha': 0.2515553477517253, 'gamma': 4.477847372108813e-15, 'kernel': 'linear'}. Best is trial 46 with value: 0.24894111818082743.
[I 2023-11-03 23:54:08,260] Trial 280 finished with value: 0.25158556879923094 and parameters: {'alpha': 0.236489402314134, 'gamma': 4.375771597392454e-15, 'kernel': 'rbf'}. Best is trial 46 with value: 0.24894111818082743.
[I 2023-11-03 23:54:08,316] Trial 318 finished with value: 0.25096092456494795 and parameters: {'alpha': 0.24637965426661365, 'gamma': 4.35861115118786e-15, 'kernel': 'linear'}. Best is trial 46 with value: 0.24894111818082743.
[I 2023-11-03 23:54:08,331] Trial 262 finished with value: 0.2502564428021578 and parameters: {'alpha': 0.25617630415256154, 'gamma': 4.213493500651883e-15, 'kernel': 'linear'}. Best is trial 46 with value: 0.24894111818082743.
[I 2023-11-03 23:54:08,400] Trial 320 finished with value: 0.25218742900811514 and parameters: {'alpha': 0.25723180638952947, 'gamma': 4.2099984995765825e-15, 'kernel': 'linear'}. Best is trial 46 with value: 0.24894111818082743.
[I 2023-11-03 23:54:08,467] Trial 257 finished with value: 0.25104535327904404 and parameters: {'alpha': 0.2671295639845468, 'gamma': 4.134423253169352e-15, 'kernel': 'linear'}. Best is trial 46 with value: 0.24894111818082743.
[I 2023-11-03 23:54:09,358] Trial 249 finished with value: 0.25216204511909046 and parameters: {'alpha': 0.24349534211313048, 'gamma': 4.321073280315054e-15, 'kernel': 'linear'}. Best is trial 46 with value: 0.24894111818082743.
[I 2023-11-03 23:54:12,362] Trial 278 finished with value: 0.24967390256424585 and parameters: {'alpha': 0.24201830072371525, 'gamma': 4.326063591675343e-15, 'kernel': 'laplacian'}. Best is trial 46 with value: 0.24894111818082743.
[I 2023-11-03 23:54:16,358] Trial 304 finished with value: 0.251154122569123 and parameters: {'alpha': 0.2599037832493315, 'gamma': 4.3128122202011765e-15, 'kernel': 'laplacian'}. Best is trial 46 with value: 0.24894111818082743.
[I 2023-11-03 23:54:17,502] Trial 247 finished with value: 0.25014044786281614 and parameters: {'alpha': 0.2526652845937873, 'gamma': 4.364111816721246e-15, 'kernel': 'laplacian'}. Best is trial 46 with value: 0.24894111818082743.
[I 2023-11-03 23:54:17,733] Trial 307 finished with value: 0.2511823208039885 and parameters: {'alpha': 0.244815542720813, 'gamma': 4.426413007378175e-15, 'kernel': 'laplacian'}. Best is trial 46 with value: 0.24894111818082743.
[I 2023-11-03 23:54:17,757] Trial 268 finished with value: 0.25078873246966404 and parameters: {'alpha': 0.7497813792828307, 'gamma': 3.89467884993042e-15, 'kernel': 'linear'}. Best is trial 46 with value: 0.24894111818082743.
[I 2023-11-03 23:54:21,600] Trial 326 finished with value: 0.2500521907074907 and parameters: {'alpha': 0.23715496841649955, 'gamma': 4.422575220216522e-15, 'kernel': 'linear'}. Best is trial 46 with value: 0.24894111818082743.
[I 2023-11-03 23:54:22,882] Trial 275 finished with value: 0.25108203312064287 and parameters: {'alpha': 0.6695686832386663, 'gamma': 3.792412627304414e-15, 'kernel': 'linear'}. Best is trial 46 with value: 0.24894111818082743.
[I 2023-11-03 23:54:23,690] Trial 244 finished with value: 0.25215139696311684 and parameters: {'alpha': 0.7491104476471135, 'gamma': 1.574398970455317e-15, 'kernel': 'linear'}. Best is trial 46 with value: 0.24894111818082743.
[I 2023-11-03 23:54:24,925] Trial 253 finished with value: 0.25142128454822865 and parameters: {'alpha': 0.730165529022157, 'gamma': 3.902675721652524e-15, 'kernel': 'linear'}. Best is trial 46 with value: 0.24894111818082743.
[I 2023-11-03 23:54:25,324] Trial 261 finished with value: 0.251093989299874 and parameters: {'alpha': 0.6946437789799076, 'gamma': 4.502344333188076e-15, 'kernel': 'linear'}. Best is trial 46 with value: 0.24894111818082743.
[I 2023-11-03 23:54:25,832] Trial 325 finished with value: 0.2509316016349299 and parameters: {'alpha': 0.6709741394831268, 'gamma': 5.652682129565092e-15, 'kernel': 'linear'}. Best is trial 46 with value: 0.24894111818082743.
[I 2023-11-03 23:54:26,287] Trial 312 finished with value: 0.24956774395010628 and parameters: {'alpha': 0.7342319319849584, 'gamma': 4.461046925835699e-15, 'kernel': 'linear'}. Best is trial 46 with value: 0.24894111818082743.
[I 2023-11-03 23:54:26,315] Trial 317 finished with value: 0.2507588402352011 and parameters: {'alpha': 0.7428392758137646, 'gamma': 6.028800039785345e-15, 'kernel': 'linear'}. Best is trial 46 with value: 0.24894111818082743.
[I 2023-11-03 23:54:26,334] Trial 273 finished with value: 0.2520714874417815 and parameters: {'alpha': 0.6713489670257332, 'gamma': 4.46754509655333e-15, 'kernel': 'linear'}. Best is trial 46 with value: 0.24894111818082743.
[I 2023-11-03 23:54:26,615] Using an existing study with name 'GB' instead of creating a new one.
[I 2023-11-03 23:56:20,574] Trial 247 finished with value: 0.2426058299931354 and parameters: {'n_estimators': 20, 'learning_rate': 0.6372022862464598, 'max_depth': 3}. Best is trial 133 with value: 0.24134805988183708.
[I 2023-11-03 23:56:20,617] Trial 231 finished with value: 0.24237848770694112 and parameters: {'n_estimators': 20, 'learning_rate': 0.8593040566835856, 'max_depth': 3}. Best is trial 133 with value: 0.24134805988183708.
