[I 2023-11-03 20:11:32,967] Trial 327 finished with value: 0.17904773016034414 and parameters: {'alpha': 0.9400855186039029, 'gamma': 7.795351301036604e-15, 'kernel': 'linear'}. Best is trial 333 with value: 0.14039191190246494.
[I 2023-11-03 20:11:32,972] Trial 397 finished with value: 0.1581843294324426 and parameters: {'alpha': 0.7524438441421712, 'gamma': 7.888578383145088e-15, 'kernel': 'linear'}. Best is trial 333 with value: 0.14039191190246494.
[I 2023-11-03 20:11:33,218] Using an existing study with name 'GB' instead of creating a new one.
[I 2023-11-03 20:12:59,279] Trial 285 finished with value: 0.18711812533513147 and parameters: {'n_estimators': 50, 'learning_rate': 0.6432767042088456, 'max_depth': 3}. Best is trial 141 with value: 0.1614025761490123.
[I 2023-11-03 20:12:59,281] Trial 283 finished with value: 0.17705887243234628 and parameters: {'n_estimators': 50, 'learning_rate': 0.6457029578646155, 'max_depth': 3}. Best is trial 141 with value: 0.1614025761490123.
[I 2023-11-03 20:13:10,271] Trial 270 finished with value: 0.16227903103139565 and parameters: {'n_estimators': 50, 'learning_rate': 0.5927913695549879, 'max_depth': 3}. Best is trial 299 with value: 0.15484887105175477.
[I 2023-11-03 20:13:10,311] Trial 274 finished with value: 0.1832828884238972 and parameters: {'n_estimators': 50, 'learning_rate': 0.9717757519346244, 'max_depth': 3}. Best is trial 299 with value: 0.15484887105175477.
[I 2023-11-03 20:13:10,766] Trial 321 finished with value: 0.18542734312367756 and parameters: {'n_estimators': 50, 'learning_rate': 0.5944918057353492, 'max_depth': 3}. Best is trial 299 with value: 0.15484887105175477.
[I 2023-11-03 20:13:11,033] Trial 268 finished with value: 0.1653941591870124 and parameters: {'n_estimators': 50, 'learning_rate': 0.8715466484497727, 'max_depth': 3}. Best is trial 299 with value: 0.15484887105175477.
[I 2023-11-03 20:13:11,844] Trial 278 finished with value: 0.20352567514705508 and parameters: {'n_estimators': 50, 'learning_rate': 0.5930602231620258, 'max_depth': 3}. Best is trial 299 with value: 0.15484887105175477.
[I 2023-11-03 20:13:13,854] Trial 282 finished with value: 0.21891771271329766 and parameters: {'n_estimators': 50, 'learning_rate': 0.9404699135563601, 'max_depth': 3}. Best is trial 299 with value: 0.15484887105175477.
[I 2023-11-03 20:13:16,187] Trial 288 finished with value: 0.19690696104876146 and parameters: {'n_estimators': 50, 'learning_rate': 0.015148179367388825, 'max_depth': 3}. Best is trial 299 with value: 0.15484887105175477.
[I 2023-11-03 20:13:17,676] Trial 279 finished with value: 0.20060098562419745 and parameters: {'n_estimators': 50, 'learning_rate': 0.25983184671525106, 'max_depth': 3}. Best is trial 299 with value: 0.15484887105175477.
[I 2023-11-03 20:13:17,707] Trial 271 finished with value: 0.18318636320925874 and parameters: {'n_estimators': 50, 'learning_rate': 0.6242798107781008, 'max_depth': 3}. Best is trial 299 with value: 0.15484887105175477.
[I 2023-11-03 20:13:17,719] Trial 328 finished with value: 0.18959170389077803 and parameters: {'n_estimators': 50, 'learning_rate': 0.4055485114539462, 'max_depth': 3}. Best is trial 299 with value: 0.15484887105175477.
[I 2023-11-03 20:13:17,724] Trial 287 finished with value: 0.19200107189535823 and parameters: {'n_estimators': 50, 'learning_rate': 0.645485579223616, 'max_depth': 3}. Best is trial 299 with value: 0.15484887105175477.
[I 2023-11-03 20:13:19,933] Trial 299 finished with value: 0.15484887105175477 and parameters: {'n_estimators': 50, 'learning_rate': 0.6484857457715879, 'max_depth': 3}. Best is trial 286 with value: 0.1494682659708949.
[I 2023-11-03 20:13:21,787] Trial 297 finished with value: 0.18977496109467532 and parameters: {'n_estimators': 50, 'learning_rate': 0.5971551976645861, 'max_depth': 3}. Best is trial 286 with value: 0.1494682659708949.
[I 2023-11-03 20:13:22,322] Trial 295 finished with value: 0.16002510826272356 and parameters: {'n_estimators': 50, 'learning_rate': 0.2251227203438917, 'max_depth': 3}. Best is trial 286 with value: 0.1494682659708949.
[I 2023-11-03 20:13:23,565] Trial 291 finished with value: 0.16480771025841748 and parameters: {'n_estimators': 50, 'learning_rate': 0.1669087087498211, 'max_depth': 3}. Best is trial 286 with value: 0.1494682659708949.
[I 2023-11-03 20:13:25,090] Trial 336 finished with value: 0.16439647189869255 and parameters: {'n_estimators': 50, 'learning_rate': 0.01765371793787246, 'max_depth': 3}. Best is trial 286 with value: 0.1494682659708949.
[I 2023-11-03 20:13:25,481] Trial 338 finished with value: 0.1742600302265218 and parameters: {'n_estimators': 50, 'learning_rate': 0.6544903070925547, 'max_depth': 3}. Best is trial 286 with value: 0.1494682659708949.
[I 2023-11-03 20:13:27,314] Trial 312 finished with value: 0.19119116718917306 and parameters: {'n_estimators': 50, 'learning_rate': 0.009585713979378074, 'max_depth': 3}. Best is trial 286 with value: 0.1494682659708949.
[I 2023-11-03 20:13:29,067] Trial 316 finished with value: 0.17722690791249088 and parameters: {'n_estimators': 50, 'learning_rate': 0.5922467282337789, 'max_depth': 3}. Best is trial 286 with value: 0.1494682659708949.
[I 2023-11-03 20:13:30,900] Trial 308 finished with value: 0.18708830194719198 and parameters: {'n_estimators': 50, 'learning_rate': 0.593490380561613, 'max_depth': 3}. Best is trial 286 with value: 0.1494682659708949.
[I 2023-11-03 20:13:30,912] Trial 340 finished with value: 0.15944281274314742 and parameters: {'n_estimators': 50, 'learning_rate': 0.644438231815721, 'max_depth': 3}. Best is trial 286 with value: 0.1494682659708949.
[I 2023-11-03 20:13:32,550] Trial 273 finished with value: 0.17190597900056606 and parameters: {'n_estimators': 50, 'learning_rate': 0.8649157126625198, 'max_depth': 2}. Best is trial 286 with value: 0.1494682659708949.
[I 2023-11-03 20:13:32,597] Trial 318 finished with value: 0.17857563904817042 and parameters: {'n_estimators': 50, 'learning_rate': 0.6453946829608933, 'max_depth': 3}. Best is trial 286 with value: 0.1494682659708949.
[I 2023-11-03 20:13:34,456] Trial 277 finished with value: 0.17770179168750833 and parameters: {'n_estimators': 50, 'learning_rate': 0.5928643035404118, 'max_depth': 3}. Best is trial 286 with value: 0.1494682659708949.
[I 2023-11-03 20:13:35,954] Trial 281 finished with value: 0.1818709628882348 and parameters: {'n_estimators': 50, 'learning_rate': 0.9136779494321242, 'max_depth': 3}. Best is trial 276 with value: 0.14373769278577175.
[I 2023-11-03 20:13:39,466] Trial 294 finished with value: 0.16837110468264907 and parameters: {'n_estimators': 50, 'learning_rate': 0.5902537882215475, 'max_depth': 3}. Best is trial 276 with value: 0.14373769278577175.
[I 2023-11-03 20:13:40,308] Trial 290 finished with value: 0.16836065353620322 and parameters: {'n_estimators': 10, 'learning_rate': 0.8801434799606791, 'max_depth': 3}. Best is trial 276 with value: 0.14373769278577175.
[I 2023-11-03 20:13:41,545] Trial 300 finished with value: 0.16596653976202916 and parameters: {'n_estimators': 50, 'learning_rate': 0.8617780416815806, 'max_depth': 3}. Best is trial 276 with value: 0.14373769278577175.
[I 2023-11-03 20:13:41,594] Trial 303 finished with value: 0.19474471426227546 and parameters: {'n_estimators': 10, 'learning_rate': 0.6010013529323098, 'max_depth': 5}. Best is trial 276 with value: 0.14373769278577175.
[I 2023-11-03 20:13:41,636] Trial 302 finished with value: 0.19268097194696676 and parameters: {'n_estimators': 50, 'learning_rate': 0.5937400758733475, 'max_depth': 3}. Best is trial 276 with value: 0.14373769278577175.
[I 2023-11-03 20:13:42,199] Trial 286 finished with value: 0.1494682659708949 and parameters: {'n_estimators': 10, 'learning_rate': 0.5967606057971978, 'max_depth': 3}. Best is trial 276 with value: 0.14373769278577175.
[I 2023-11-03 20:13:42,210] Trial 298 finished with value: 0.19586101046771578 and parameters: {'n_estimators': 50, 'learning_rate': 0.594355948384314, 'max_depth': 3}. Best is trial 276 with value: 0.14373769278577175.
[I 2023-11-03 20:13:42,227] Trial 293 finished with value: 0.17421603396036342 and parameters: {'n_estimators': 10, 'learning_rate': 0.5937967886278912, 'max_depth': 3}. Best is trial 276 with value: 0.14373769278577175.
[I 2023-11-03 20:13:43,024] Trial 289 finished with value: 0.1714883726130981 and parameters: {'n_estimators': 10, 'learning_rate': 0.6007637478505059, 'max_depth': 3}. Best is trial 276 with value: 0.14373769278577175.
[I 2023-11-03 20:13:43,996] Trial 306 finished with value: 0.18248920248082692 and parameters: {'n_estimators': 50, 'learning_rate': 0.410670552123209, 'max_depth': 3}. Best is trial 276 with value: 0.14373769278577175.
[I 2023-11-03 20:13:45,680] Trial 301 finished with value: 0.1891360089401921 and parameters: {'n_estimators': 50, 'learning_rate': 0.013844940385761617, 'max_depth': 3}. Best is trial 276 with value: 0.14373769278577175.
[I 2023-11-03 20:13:46,594] Trial 310 finished with value: 0.16965076124163528 and parameters: {'n_estimators': 10, 'learning_rate': 0.9418560622497599, 'max_depth': 3}. Best is trial 276 with value: 0.14373769278577175.
[I 2023-11-03 20:13:48,645] Trial 269 finished with value: 0.18590745944130324 and parameters: {'n_estimators': 50, 'learning_rate': 0.5953064651103978, 'max_depth': 2}. Best is trial 276 with value: 0.14373769278577175.
[I 2023-11-03 20:13:50,093] Trial 315 finished with value: 0.17974981156389191 and parameters: {'n_estimators': 10, 'learning_rate': 0.7658775641854727, 'max_depth': 3}. Best is trial 276 with value: 0.14373769278577175.
[I 2023-11-03 20:13:50,100] Trial 314 finished with value: 0.18248745843521377 and parameters: {'n_estimators': 50, 'learning_rate': 0.8214263438352154, 'max_depth': 3}. Best is trial 276 with value: 0.14373769278577175.
[I 2023-11-03 20:13:52,203] Trial 337 finished with value: 0.16854802222787066 and parameters: {'n_estimators': 10, 'learning_rate': 0.6166012505897821, 'max_depth': 3}. Best is trial 276 with value: 0.14373769278577175.
[I 2023-11-03 20:13:52,698] Trial 276 finished with value: 0.14373769278577175 and parameters: {'n_estimators': 50, 'learning_rate': 0.4795722111525974, 'max_depth': 3}. Best is trial 332 with value: 0.14253886734486645.
[I 2023-11-03 20:13:55,470] Trial 322 finished with value: 0.16360495562162722 and parameters: {'n_estimators': 10, 'learning_rate': 0.8701755806861495, 'max_depth': 3}. Best is trial 332 with value: 0.14253886734486645.
[I 2023-11-03 20:13:55,479] Trial 355 finished with value: 0.17294503159090646 and parameters: {'n_estimators': 10, 'learning_rate': 0.6176209207626067, 'max_depth': 3}. Best is trial 332 with value: 0.14253886734486645.
[I 2023-11-03 20:13:55,954] Trial 280 finished with value: 0.1925761860965843 and parameters: {'n_estimators': 50, 'learning_rate': 0.8371072596634448, 'max_depth': 3}. Best is trial 332 with value: 0.14253886734486645.
[I 2023-11-03 20:13:56,003] Trial 334 finished with value: 0.15379335793601182 and parameters: {'n_estimators': 10, 'learning_rate': 0.5949770018558164, 'max_depth': 3}. Best is trial 332 with value: 0.14253886734486645.
[I 2023-11-03 20:13:56,047] Trial 329 finished with value: 0.2031183684455837 and parameters: {'n_estimators': 10, 'learning_rate': 0.5943343162528956, 'max_depth': 3}. Best is trial 332 with value: 0.14253886734486645.
[I 2023-11-03 20:13:56,808] Trial 320 finished with value: 0.17252397381593987 and parameters: {'n_estimators': 10, 'learning_rate': 0.9111028730138782, 'max_depth': 3}. Best is trial 332 with value: 0.14253886734486645.
[I 2023-11-03 20:13:56,837] Trial 324 finished with value: 0.1562883488449689 and parameters: {'n_estimators': 50, 'learning_rate': 0.5920405018976771, 'max_depth': 3}. Best is trial 332 with value: 0.14253886734486645.
[I 2023-11-03 20:13:57,116] Trial 357 finished with value: 0.1857631411904622 and parameters: {'n_estimators': 10, 'learning_rate': 0.8620497103191342, 'max_depth': 3}. Best is trial 332 with value: 0.14253886734486645.
[I 2023-11-03 20:13:57,586] Trial 304 finished with value: 0.18194132761613832 and parameters: {'n_estimators': 50, 'learning_rate': 0.6456852402802815, 'max_depth': 3}. Best is trial 332 with value: 0.14253886734486645.
[I 2023-11-03 20:13:59,101] Trial 272 finished with value: 0.17391437535490759 and parameters: {'n_estimators': 10, 'learning_rate': 0.9028739621704942, 'max_depth': 3}. Best is trial 332 with value: 0.14253886734486645.
[I 2023-11-03 20:13:59,214] Trial 335 finished with value: 0.1616101491594353 and parameters: {'n_estimators': 10, 'learning_rate': 0.140058849085818, 'max_depth': 3}. Best is trial 332 with value: 0.14253886734486645.
[I 2023-11-03 20:14:00,175] Trial 348 finished with value: 0.21084444493772816 and parameters: {'n_estimators': 10, 'learning_rate': 0.10411509607555625, 'max_depth': 3}. Best is trial 332 with value: 0.14253886734486645.
[I 2023-11-03 20:14:00,694] Trial 346 finished with value: 0.2183377224144407 and parameters: {'n_estimators': 10, 'learning_rate': 0.17074524940298347, 'max_depth': 3}. Best is trial 332 with value: 0.14253886734486645.
[I 2023-11-03 20:14:01,684] Trial 343 finished with value: 0.1984513217003833 and parameters: {'n_estimators': 10, 'learning_rate': 0.9957666932528996, 'max_depth': 3}. Best is trial 332 with value: 0.14253886734486645.
[I 2023-11-03 20:14:01,713] Trial 296 finished with value: 0.15372365342718794 and parameters: {'n_estimators': 10, 'learning_rate': 0.6005894615885482, 'max_depth': 3}. Best is trial 332 with value: 0.14253886734486645.
[I 2023-11-03 20:14:02,055] Trial 323 finished with value: 0.22334688256535595 and parameters: {'n_estimators': 200, 'learning_rate': 0.8657942369790194, 'max_depth': 3}. Best is trial 332 with value: 0.14253886734486645.
[I 2023-11-03 20:14:02,061] Trial 292 finished with value: 0.18778344604193875 and parameters: {'n_estimators': 10, 'learning_rate': 0.860043102096766, 'max_depth': 3}. Best is trial 332 with value: 0.14253886734486645.
[I 2023-11-03 20:14:02,065] Trial 305 finished with value: 0.1596375428789593 and parameters: {'n_estimators': 200, 'learning_rate': 0.8283521790696696, 'max_depth': 3}. Best is trial 332 with value: 0.14253886734486645.
[I 2023-11-03 20:14:02,085] Trial 313 finished with value: 0.18333998498684725 and parameters: {'n_estimators': 10, 'learning_rate': 0.9286982930180835, 'max_depth': 3}. Best is trial 332 with value: 0.14253886734486645.
[I 2023-11-03 20:14:02,103] Trial 330 finished with value: 0.19706011874895935 and parameters: {'n_estimators': 10, 'learning_rate': 0.22397158013118726, 'max_depth': 3}. Best is trial 332 with value: 0.14253886734486645.
[I 2023-11-03 20:14:02,107] Trial 344 finished with value: 0.15345480058999147 and parameters: {'n_estimators': 200, 'learning_rate': 0.12592183077957542, 'max_depth': 3}. Best is trial 332 with value: 0.14253886734486645.
[I 2023-11-03 20:14:02,125] Trial 345 finished with value: 0.157922405348058 and parameters: {'n_estimators': 10, 'learning_rate': 0.8710880218783733, 'max_depth': 3}. Best is trial 332 with value: 0.14253886734486645.
[I 2023-11-03 20:14:02,206] Trial 339 finished with value: 0.21198047879541448 and parameters: {'n_estimators': 200, 'learning_rate': 0.8755381069740404, 'max_depth': 3}. Best is trial 332 with value: 0.14253886734486645.
[I 2023-11-03 20:14:02,223] Trial 332 finished with value: 0.14253886734486645 and parameters: {'n_estimators': 10, 'learning_rate': 0.8768684531505767, 'max_depth': 3}. Best is trial 332 with value: 0.14253886734486645.
[I 2023-11-03 20:14:02,227] Trial 353 finished with value: 0.15067960005723802 and parameters: {'n_estimators': 200, 'learning_rate': 0.8792570598663858, 'max_depth': 3}. Best is trial 332 with value: 0.14253886734486645.
[I 2023-11-03 20:14:02,359] Trial 327 finished with value: 0.20499737180957242 and parameters: {'n_estimators': 10, 'learning_rate': 0.18157177985457554, 'max_depth': 3}. Best is trial 332 with value: 0.14253886734486645.
[I 2023-11-03 20:14:02,372] Trial 360 finished with value: 0.15620346797095255 and parameters: {'n_estimators': 10, 'learning_rate': 0.10217830552965318, 'max_depth': 3}. Best is trial 332 with value: 0.14253886734486645.
[I 2023-11-03 20:14:02,423] Trial 325 finished with value: 0.185652670806933 and parameters: {'n_estimators': 50, 'learning_rate': 0.3123498128064017, 'max_depth': 3}. Best is trial 332 with value: 0.14253886734486645.
[I 2023-11-03 20:14:02,431] Trial 311 finished with value: 0.18526993322759347 and parameters: {'n_estimators': 200, 'learning_rate': 0.8076594286909929, 'max_depth': 3}. Best is trial 332 with value: 0.14253886734486645.
[I 2023-11-03 20:14:02,440] Trial 326 finished with value: 0.18589405642263748 and parameters: {'n_estimators': 200, 'learning_rate': 0.11900814986794533, 'max_depth': 3}. Best is trial 332 with value: 0.14253886734486645.
[I 2023-11-03 20:14:02,441] Trial 354 finished with value: 0.16677559385714744 and parameters: {'n_estimators': 50, 'learning_rate': 0.8709612150058567, 'max_depth': 3}. Best is trial 332 with value: 0.14253886734486645.
[I 2023-11-03 20:14:02,622] Trial 347 finished with value: 0.16825983486320376 and parameters: {'n_estimators': 200, 'learning_rate': 0.1046423991127412, 'max_depth': 3}. Best is trial 332 with value: 0.14253886734486645.
[I 2023-11-03 20:14:02,637] Trial 275 finished with value: 0.19328840421021679 and parameters: {'n_estimators': 50, 'learning_rate': 0.8662930369427846, 'max_depth': 3}. Best is trial 332 with value: 0.14253886734486645.
[I 2023-11-03 20:14:02,647] Trial 356 finished with value: 0.21221071411743553 and parameters: {'n_estimators': 10, 'learning_rate': 0.8693430263965248, 'max_depth': 3}. Best is trial 332 with value: 0.14253886734486645.
[I 2023-11-03 20:14:02,662] Trial 359 finished with value: 0.17576008812024335 and parameters: {'n_estimators': 200, 'learning_rate': 0.10836971227825602, 'max_depth': 3}. Best is trial 332 with value: 0.14253886734486645.
[I 2023-11-03 20:14:02,702] Trial 307 finished with value: 0.16687729338360813 and parameters: {'n_estimators': 10, 'learning_rate': 0.1271540906117104, 'max_depth': 3}. Best is trial 332 with value: 0.14253886734486645.
[I 2023-11-03 20:14:02,732] Trial 349 finished with value: 0.171727684509281 and parameters: {'n_estimators': 10, 'learning_rate': 0.8621342510150846, 'max_depth': 3}. Best is trial 332 with value: 0.14253886734486645.
[I 2023-11-03 20:14:05,380] Trial 350 finished with value: 0.1481650954523942 and parameters: {'n_estimators': 10, 'learning_rate': 0.11987478920530158, 'max_depth': 3}. Best is trial 332 with value: 0.14253886734486645.
[I 2023-11-03 20:14:07,067] Trial 351 finished with value: 0.21458258276289754 and parameters: {'n_estimators': 10, 'learning_rate': 0.09162071444704696, 'max_depth': 3}. Best is trial 332 with value: 0.14253886734486645.
[I 2023-11-03 20:14:07,869] Trial 317 finished with value: 0.19555401426395816 and parameters: {'n_estimators': 10, 'learning_rate': 0.21037352900623205, 'max_depth': 3}. Best is trial 332 with value: 0.14253886734486645.
[I 2023-11-03 20:14:08,934] Trial 342 finished with value: 0.14435354977236634 and parameters: {'n_estimators': 10, 'learning_rate': 0.1239203410640016, 'max_depth': 3}. Best is trial 332 with value: 0.14253886734486645.
[I 2023-11-03 20:14:10,293] Trial 362 finished with value: 0.19713713470092387 and parameters: {'n_estimators': 10, 'learning_rate': 0.07561419283579808, 'max_depth': 3}. Best is trial 332 with value: 0.14253886734486645.
[I 2023-11-03 20:14:11,690] Trial 284 finished with value: 0.184859054857728 and parameters: {'n_estimators': 10, 'learning_rate': 0.14619864243554714, 'max_depth': 3}. Best is trial 332 with value: 0.14253886734486645.
[I 2023-11-03 20:14:12,989] Trial 366 finished with value: 0.1784832513023864 and parameters: {'n_estimators': 10, 'learning_rate': 0.1400887890554497, 'max_depth': 3}. Best is trial 332 with value: 0.14253886734486645.
[I 2023-11-03 20:14:14,525] Trial 331 finished with value: 0.18723431275961433 and parameters: {'n_estimators': 10, 'learning_rate': 0.160033643899086, 'max_depth': 3}. Best is trial 332 with value: 0.14253886734486645.
[I 2023-11-03 20:14:15,561] Trial 333 finished with value: 0.1687830139469901 and parameters: {'n_estimators': 10, 'learning_rate': 0.0523877423173619, 'max_depth': 3}. Best is trial 332 with value: 0.14253886734486645.
[I 2023-11-03 20:14:17,050] Trial 363 finished with value: 0.16327694997388018 and parameters: {'n_estimators': 10, 'learning_rate': 0.18201922411998542, 'max_depth': 3}. Best is trial 332 with value: 0.14253886734486645.
[I 2023-11-03 20:14:17,793] Trial 352 finished with value: 0.1931058245108722 and parameters: {'n_estimators': 10, 'learning_rate': 0.15642243270945871, 'max_depth': 3}. Best is trial 332 with value: 0.14253886734486645.
[I 2023-11-03 20:14:17,817] Trial 341 finished with value: 0.2031173145542561 and parameters: {'n_estimators': 200, 'learning_rate': 0.21191881317996775, 'max_depth': 3}. Best is trial 332 with value: 0.14253886734486645.
[I 2023-11-03 20:14:18,447] Trial 365 finished with value: 0.18533069725481668 and parameters: {'n_estimators': 10, 'learning_rate': 0.1143168203117603, 'max_depth': 3}. Best is trial 332 with value: 0.14253886734486645.
[I 2023-11-03 20:14:19,757] Trial 358 finished with value: 0.18470353979362086 and parameters: {'n_estimators': 10, 'learning_rate': 0.06468263264784868, 'max_depth': 3}. Best is trial 332 with value: 0.14253886734486645.
[I 2023-11-03 20:14:19,826] Trial 319 finished with value: 0.1890755068493023 and parameters: {'n_estimators': 10, 'learning_rate': 0.15868454486178218, 'max_depth': 3}. Best is trial 332 with value: 0.14253886734486645.
[I 2023-11-03 20:14:19,834] Trial 361 finished with value: 0.16308850756125046 and parameters: {'n_estimators': 200, 'learning_rate': 0.07361717377257608, 'max_depth': 3}. Best is trial 332 with value: 0.14253886734486645.
