[I 2023-11-03 23:50:27,971] Trial 243 finished with value: 0.257200063462197 and parameters: {'alpha': 0.08617711238674353, 'l1_ratio': 0.24037317252273072}. Best is trial 145 with value: 0.2568487370091133.
[I 2023-11-03 23:50:27,981] Trial 241 finished with value: 0.2569739126884296 and parameters: {'alpha': 0.09030672398609342, 'l1_ratio': 0.4739376097031612}. Best is trial 145 with value: 0.2568487370091133.
[I 2023-11-03 23:50:28,163] Trial 246 finished with value: 0.2571473427735889 and parameters: {'alpha': 0.08569272752720487, 'l1_ratio': 0.24891115304955946}. Best is trial 145 with value: 0.2568487370091133.
[I 2023-11-03 23:50:28,269] Trial 248 finished with value: 0.25695708893027197 and parameters: {'alpha': 0.08534354927491059, 'l1_ratio': 0.24154896057766065}. Best is trial 145 with value: 0.2568487370091133.
[I 2023-11-03 23:50:28,922] Trial 258 finished with value: 0.2570425183254368 and parameters: {'alpha': 0.08457967021835046, 'l1_ratio': 0.47417460528638844}. Best is trial 145 with value: 0.2568487370091133.
[I 2023-11-03 23:50:28,931] Trial 262 finished with value: 0.2571168092416005 and parameters: {'alpha': 0.08978623395309922, 'l1_ratio': 0.21580860097066976}. Best is trial 145 with value: 0.2568487370091133.
[I 2023-11-03 23:50:29,525] Trial 272 finished with value: 0.25702325591173025 and parameters: {'alpha': 0.09391888308558397, 'l1_ratio': 0.5074956233664201}. Best is trial 145 with value: 0.2568487370091133.
[I 2023-11-03 23:50:29,867] Trial 228 finished with value: 0.25705472350875347 and parameters: {'alpha': 0.09027885162707927, 'l1_ratio': 0.24391554622767775}. Best is trial 145 with value: 0.2568487370091133.
[I 2023-11-03 23:50:29,870] Trial 279 finished with value: 0.25710146665782113 and parameters: {'alpha': 0.08465343491590273, 'l1_ratio': 0.46174549282425975}. Best is trial 145 with value: 0.2568487370091133.
[I 2023-11-03 23:50:29,875] Trial 280 finished with value: 0.2570158726350895 and parameters: {'alpha': 0.08388077690680294, 'l1_ratio': 0.21453235858288766}. Best is trial 145 with value: 0.2568487370091133.
[I 2023-11-03 23:50:30,043] Trial 282 finished with value: 0.2570379460208796 and parameters: {'alpha': 0.08262378847759545, 'l1_ratio': 0.2180682055545412}. Best is trial 145 with value: 0.2568487370091133.
[I 2023-11-03 23:50:30,260] Trial 278 finished with value: 0.2569742618868955 and parameters: {'alpha': 0.08956998720040973, 'l1_ratio': 0.5069083570613216}. Best is trial 145 with value: 0.2568487370091133.
[I 2023-11-03 23:50:30,308] Trial 242 finished with value: 0.2569796479947606 and parameters: {'alpha': 0.08461448460421639, 'l1_ratio': 0.4865096545770649}. Best is trial 145 with value: 0.2568487370091133.
[I 2023-11-03 23:50:30,324] Trial 281 finished with value: 0.2571138379444493 and parameters: {'alpha': 0.09004357682968772, 'l1_ratio': 0.2563629623028708}. Best is trial 145 with value: 0.2568487370091133.
[I 2023-11-03 23:50:30,379] Trial 285 finished with value: 0.2570169575872948 and parameters: {'alpha': 0.089404301595971, 'l1_ratio': 0.2478655177680097}. Best is trial 145 with value: 0.2568487370091133.
[I 2023-11-03 23:50:30,390] Trial 234 finished with value: 0.2569489636985695 and parameters: {'alpha': 0.0903109599476572, 'l1_ratio': 0.4527090155900488}. Best is trial 145 with value: 0.2568487370091133.
[I 2023-11-03 23:50:30,560] Trial 284 finished with value: 0.25710164563162347 and parameters: {'alpha': 0.04121364373219771, 'l1_ratio': 0.2412921129424321}. Best is trial 145 with value: 0.2568487370091133.
[I 2023-11-03 23:50:30,564] Trial 289 finished with value: 0.2570055747381805 and parameters: {'alpha': 0.08718012759752393, 'l1_ratio': 0.22760621126522582}. Best is trial 145 with value: 0.2568487370091133.
[I 2023-11-03 23:50:30,577] Trial 250 finished with value: 0.2569784364635865 and parameters: {'alpha': 0.08520449688639144, 'l1_ratio': 0.4781890587266043}. Best is trial 145 with value: 0.2568487370091133.
[I 2023-11-03 23:50:30,578] Trial 240 finished with value: 0.25698207621043156 and parameters: {'alpha': 0.09119776151294796, 'l1_ratio': 0.4568837686219248}. Best is trial 145 with value: 0.2568487370091133.
[I 2023-11-03 23:50:30,580] Trial 244 finished with value: 0.2569668678015003 and parameters: {'alpha': 0.08545173216081567, 'l1_ratio': 0.4643061042728057}. Best is trial 145 with value: 0.2568487370091133.
[I 2023-11-03 23:50:30,583] Trial 249 finished with value: 0.2569634675815023 and parameters: {'alpha': 0.08810673569464164, 'l1_ratio': 0.2267143928046281}. Best is trial 145 with value: 0.2568487370091133.
[I 2023-11-03 23:50:30,681] Trial 254 finished with value: 0.25700798843253336 and parameters: {'alpha': 0.08769395069655464, 'l1_ratio': 0.21888904308955687}. Best is trial 145 with value: 0.2568487370091133.
[I 2023-11-03 23:50:30,691] Trial 252 finished with value: 0.257134756868509 and parameters: {'alpha': 0.09110189282952458, 'l1_ratio': 0.2119477377938678}. Best is trial 145 with value: 0.2568487370091133.
[I 2023-11-03 23:50:31,086] Trial 293 finished with value: 0.25708256826888864 and parameters: {'alpha': 0.09329185175484479, 'l1_ratio': 0.4653027793892682}. Best is trial 145 with value: 0.2568487370091133.
[I 2023-11-03 23:50:31,113] Trial 260 finished with value: 0.25699470640781374 and parameters: {'alpha': 0.02402850094725397, 'l1_ratio': 0.1802928049917823}. Best is trial 145 with value: 0.2568487370091133.
[I 2023-11-03 23:50:31,118] Trial 266 finished with value: 0.25715064498814955 and parameters: {'alpha': 0.09040334118721717, 'l1_ratio': 0.25111394472829496}. Best is trial 145 with value: 0.2568487370091133.
[I 2023-11-03 23:50:31,153] Trial 291 finished with value: 0.2570238178733897 and parameters: {'alpha': 0.0964584103193216, 'l1_ratio': 0.21823149706361383}. Best is trial 145 with value: 0.2568487370091133.
[I 2023-11-03 23:50:31,187] Trial 256 finished with value: 0.25702292212985217 and parameters: {'alpha': 0.09035215946483455, 'l1_ratio': 0.24887491664504682}. Best is trial 145 with value: 0.2568487370091133.
[I 2023-11-03 23:50:31,225] Trial 265 finished with value: 0.2570076197800338 and parameters: {'alpha': 0.0933769898185673, 'l1_ratio': 0.4534375341854851}. Best is trial 145 with value: 0.2568487370091133.
[I 2023-11-03 23:50:31,343] Trial 267 finished with value: 0.25688149008837446 and parameters: {'alpha': 0.08458847577775899, 'l1_ratio': 0.18892101760005572}. Best is trial 145 with value: 0.2568487370091133.
[I 2023-11-03 23:50:31,345] Trial 316 finished with value: 0.2569976359009411 and parameters: {'alpha': 0.09567895168917277, 'l1_ratio': 0.17386426941014843}. Best is trial 145 with value: 0.2568487370091133.
[I 2023-11-03 23:50:31,393] Trial 299 finished with value: 0.2570889979678806 and parameters: {'alpha': 0.09446604013902381, 'l1_ratio': 0.18225397188385434}. Best is trial 145 with value: 0.2568487370091133.
[I 2023-11-03 23:50:31,407] Trial 302 finished with value: 0.2570076953402686 and parameters: {'alpha': 0.09005905498954973, 'l1_ratio': 0.21022015152449802}. Best is trial 145 with value: 0.2568487370091133.
[I 2023-11-03 23:50:31,409] Trial 235 finished with value: 0.2569712348058886 and parameters: {'alpha': 0.09310043988038064, 'l1_ratio': 0.18039938369721248}. Best is trial 145 with value: 0.2568487370091133.
[I 2023-11-03 23:50:31,411] Trial 268 finished with value: 0.25691086562371007 and parameters: {'alpha': 0.08211764968953851, 'l1_ratio': 0.4869907678689769}. Best is trial 145 with value: 0.2568487370091133.
[I 2023-11-03 23:50:31,415] Trial 232 finished with value: 0.25704122305336113 and parameters: {'alpha': 0.0231971796414929, 'l1_ratio': 0.18440662819077663}. Best is trial 145 with value: 0.2568487370091133.
[I 2023-11-03 23:50:31,677] Trial 308 finished with value: 0.2570233319310559 and parameters: {'alpha': 0.023829570173950265, 'l1_ratio': 0.18711577833604637}. Best is trial 145 with value: 0.2568487370091133.
[I 2023-11-03 23:50:31,731] Trial 288 finished with value: 0.25709357790475057 and parameters: {'alpha': 0.02464236940435812, 'l1_ratio': 0.17572909149955715}. Best is trial 145 with value: 0.2568487370091133.
[I 2023-11-03 23:50:31,767] Trial 295 finished with value: 0.25706500773927443 and parameters: {'alpha': 0.023397379777229547, 'l1_ratio': 0.18436678683119248}. Best is trial 145 with value: 0.2568487370091133.
[I 2023-11-03 23:50:31,768] Trial 247 finished with value: 0.2570150786605692 and parameters: {'alpha': 0.09467979174654506, 'l1_ratio': 0.1803650966965702}. Best is trial 145 with value: 0.2568487370091133.
[I 2023-11-03 23:50:31,774] Trial 287 finished with value: 0.2569640122014649 and parameters: {'alpha': 0.0873979054152059, 'l1_ratio': 0.25197147126719355}. Best is trial 145 with value: 0.2568487370091133.
[I 2023-11-03 23:50:31,807] Trial 310 finished with value: 0.2570220057584756 and parameters: {'alpha': 0.022753450796404208, 'l1_ratio': 0.1853816420775141}. Best is trial 145 with value: 0.2568487370091133.
[I 2023-11-03 23:50:31,809] Trial 311 finished with value: 0.2569963079269911 and parameters: {'alpha': 0.09662069854268451, 'l1_ratio': 0.18155787149670685}. Best is trial 145 with value: 0.2568487370091133.
[I 2023-11-03 23:50:31,811] Trial 320 finished with value: 0.2570552236943209 and parameters: {'alpha': 0.02342539793283671, 'l1_ratio': 0.1694555637365832}. Best is trial 145 with value: 0.2568487370091133.
[I 2023-11-03 23:50:31,835] Trial 239 finished with value: 0.257022835611394 and parameters: {'alpha': 0.09347525227113976, 'l1_ratio': 0.5088262621866784}. Best is trial 145 with value: 0.2568487370091133.
[I 2023-11-03 23:50:31,835] Trial 318 finished with value: 0.25699902726106805 and parameters: {'alpha': 0.023589962765724615, 'l1_ratio': 0.14944786863902437}. Best is trial 145 with value: 0.2568487370091133.
[I 2023-11-03 23:50:31,840] Trial 294 finished with value: 0.256960093301488 and parameters: {'alpha': 0.02396547918262849, 'l1_ratio': 0.18024188669110275}. Best is trial 145 with value: 0.2568487370091133.
[I 2023-11-03 23:50:31,853] Trial 257 finished with value: 0.25709689979105094 and parameters: {'alpha': 0.02357396034692648, 'l1_ratio': 0.22361579739489648}. Best is trial 145 with value: 0.2568487370091133.
[I 2023-11-03 23:50:31,924] Trial 253 finished with value: 0.25695841009985976 and parameters: {'alpha': 0.02344251201184059, 'l1_ratio': 0.17796913303408318}. Best is trial 145 with value: 0.2568487370091133.
[I 2023-11-03 23:50:32,238] Trial 312 finished with value: 0.2570340763335073 and parameters: {'alpha': 0.022848275388525158, 'l1_ratio': 0.16987146426675617}. Best is trial 145 with value: 0.2568487370091133.
[I 2023-11-03 23:50:32,239] Trial 301 finished with value: 0.257025280556369 and parameters: {'alpha': 0.09292161009502505, 'l1_ratio': 0.24415043717454799}. Best is trial 145 with value: 0.2568487370091133.
[I 2023-11-03 23:50:32,246] Trial 271 finished with value: 0.2569413172726807 and parameters: {'alpha': 0.024582844396864756, 'l1_ratio': 0.15024794969096353}. Best is trial 145 with value: 0.2568487370091133.
[I 2023-11-03 23:50:32,247] Trial 304 finished with value: 0.2571215738912946 and parameters: {'alpha': 0.09385694849246233, 'l1_ratio': 0.19118818376856545}. Best is trial 145 with value: 0.2568487370091133.
[I 2023-11-03 23:50:32,253] Trial 303 finished with value: 0.25698530302025663 and parameters: {'alpha': 0.023027354050823335, 'l1_ratio': 0.17213297750139792}. Best is trial 145 with value: 0.2568487370091133.
[I 2023-11-03 23:50:32,255] Trial 300 finished with value: 0.25702383187906 and parameters: {'alpha': 0.02187978723087005, 'l1_ratio': 0.574458612394956}. Best is trial 145 with value: 0.2568487370091133.
[I 2023-11-03 23:50:32,272] Trial 306 finished with value: 0.25693296899092277 and parameters: {'alpha': 0.07618272460793088, 'l1_ratio': 0.15547103699267723}. Best is trial 145 with value: 0.2568487370091133.
[I 2023-11-03 23:50:32,273] Trial 245 finished with value: 0.25712403974928716 and parameters: {'alpha': 0.023181776732258626, 'l1_ratio': 0.3466517511794763}. Best is trial 145 with value: 0.2568487370091133.
[I 2023-11-03 23:50:32,274] Trial 230 finished with value: 0.2570486135818572 and parameters: {'alpha': 0.016758511667199404, 'l1_ratio': 0.15963433127844143}. Best is trial 145 with value: 0.2568487370091133.
[I 2023-11-03 23:50:32,278] Trial 297 finished with value: 0.2569238717667727 and parameters: {'alpha': 0.09224547006595696, 'l1_ratio': 0.19570869550121936}. Best is trial 145 with value: 0.2568487370091133.
[I 2023-11-03 23:50:32,303] Trial 296 finished with value: 0.25698330765843114 and parameters: {'alpha': 0.02346801534505559, 'l1_ratio': 0.355139921534543}. Best is trial 145 with value: 0.2568487370091133.
[I 2023-11-03 23:50:32,306] Trial 269 finished with value: 0.2571348479922204 and parameters: {'alpha': 0.024509127140449866, 'l1_ratio': 0.18186999548763835}. Best is trial 145 with value: 0.2568487370091133.
[I 2023-11-03 23:50:32,308] Trial 314 finished with value: 0.2569367757946676 and parameters: {'alpha': 0.024074191738739783, 'l1_ratio': 0.178606379074964}. Best is trial 145 with value: 0.2568487370091133.
[I 2023-11-03 23:50:32,318] Trial 324 finished with value: 0.2569964126718102 and parameters: {'alpha': 0.024659047514531247, 'l1_ratio': 0.16792946403963227}. Best is trial 145 with value: 0.2568487370091133.
[I 2023-11-03 23:50:32,325] Trial 229 finished with value: 0.2570643630741239 and parameters: {'alpha': 0.02912595935885329, 'l1_ratio': 0.4289049067742211}. Best is trial 145 with value: 0.2568487370091133.
[I 2023-11-03 23:50:32,329] Trial 237 finished with value: 0.2569794231040812 and parameters: {'alpha': 0.02941730599641325, 'l1_ratio': 0.4314634307176663}. Best is trial 145 with value: 0.2568487370091133.
[I 2023-11-03 23:50:32,336] Trial 231 finished with value: 0.2570212302471639 and parameters: {'alpha': 0.021421854657428817, 'l1_ratio': 0.15138299811043932}. Best is trial 145 with value: 0.2568487370091133.
[I 2023-11-03 23:50:32,365] Trial 276 finished with value: 0.2571386213281937 and parameters: {'alpha': 0.021247509722289934, 'l1_ratio': 0.1526343909426834}. Best is trial 145 with value: 0.2568487370091133.
[I 2023-11-03 23:50:32,432] Trial 238 finished with value: 0.2570837064243611 and parameters: {'alpha': 0.08143434863565424, 'l1_ratio': 0.57489300223107}. Best is trial 145 with value: 0.2568487370091133.
[I 2023-11-03 23:50:32,509] Trial 313 finished with value: 0.25700743854319685 and parameters: {'alpha': 0.02342624760881402, 'l1_ratio': 0.1825909101411499}. Best is trial 145 with value: 0.2568487370091133.
[I 2023-11-03 23:50:32,530] Trial 319 finished with value: 0.2570050434693784 and parameters: {'alpha': 0.08190371727417502, 'l1_ratio': 0.14513709062666882}. Best is trial 145 with value: 0.2568487370091133.
[I 2023-11-03 23:50:32,680] Trial 309 finished with value: 0.2570275328797496 and parameters: {'alpha': 0.028510428923144517, 'l1_ratio': 0.13798436597435892}. Best is trial 145 with value: 0.2568487370091133.
[I 2023-11-03 23:50:32,739] Trial 259 finished with value: 0.2570454517162016 and parameters: {'alpha': 0.08098842543467871, 'l1_ratio': 0.5828351452105326}. Best is trial 145 with value: 0.2568487370091133.
[I 2023-11-03 23:50:32,766] Trial 317 finished with value: 0.25700722407999316 and parameters: {'alpha': 0.02885051718595197, 'l1_ratio': 0.14654216153424748}. Best is trial 145 with value: 0.2568487370091133.
[I 2023-11-03 23:50:32,780] Trial 307 finished with value: 0.2570821703892527 and parameters: {'alpha': 0.07957307056435955, 'l1_ratio': 0.4301902508795567}. Best is trial 145 with value: 0.2568487370091133.
[I 2023-11-03 23:50:32,828] Trial 261 finished with value: 0.25701872474014076 and parameters: {'alpha': 0.09278235463494182, 'l1_ratio': 0.5096871648647295}. Best is trial 145 with value: 0.2568487370091133.
[I 2023-11-03 23:50:32,830] Trial 323 finished with value: 0.257040966298064 and parameters: {'alpha': 0.08207279848294854, 'l1_ratio': 0.4163535916937775}. Best is trial 145 with value: 0.2568487370091133.
[I 2023-11-03 23:50:32,867] Trial 290 finished with value: 0.25705653215912466 and parameters: {'alpha': 0.07815754188527634, 'l1_ratio': 0.1407022983612037}. Best is trial 145 with value: 0.2568487370091133.
[I 2023-11-03 23:50:32,899] Trial 264 finished with value: 0.25703746927548593 and parameters: {'alpha': 0.08185914002590199, 'l1_ratio': 0.5734429598851206}. Best is trial 145 with value: 0.2568487370091133.
[I 2023-11-03 23:50:32,902] Trial 255 finished with value: 0.25699772052917114 and parameters: {'alpha': 0.02495736175083955, 'l1_ratio': 0.7002492079174252}. Best is trial 145 with value: 0.2568487370091133.
[I 2023-11-03 23:50:32,919] Trial 275 finished with value: 0.25699926960671804 and parameters: {'alpha': 0.02338869644436281, 'l1_ratio': 0.34990011814631977}. Best is trial 145 with value: 0.2568487370091133.
[I 2023-11-03 23:50:32,952] Trial 322 finished with value: 0.25709226254526035 and parameters: {'alpha': 0.09989196024966927, 'l1_ratio': 0.5717312562957904}. Best is trial 145 with value: 0.2568487370091133.
[I 2023-11-03 23:50:32,955] Trial 251 finished with value: 0.25699652685008023 and parameters: {'alpha': 0.023770595415925445, 'l1_ratio': 0.2180537524562684}. Best is trial 145 with value: 0.2568487370091133.
[I 2023-11-03 23:50:32,958] Trial 274 finished with value: 0.25686589500709883 and parameters: {'alpha': 0.09475072333726732, 'l1_ratio': 0.17988707375055193}. Best is trial 145 with value: 0.2568487370091133.
[I 2023-11-03 23:50:33,007] Trial 286 finished with value: 0.2571210747751337 and parameters: {'alpha': 0.024115158968402, 'l1_ratio': 0.18604860094894995}. Best is trial 145 with value: 0.2568487370091133.
[I 2023-11-03 23:50:33,050] Trial 277 finished with value: 0.25700560749571516 and parameters: {'alpha': 0.024559282877767444, 'l1_ratio': 0.5737246040468201}. Best is trial 145 with value: 0.2568487370091133.
[I 2023-11-03 23:50:33,050] Trial 327 finished with value: 0.2569672348842282 and parameters: {'alpha': 0.09945651438756964, 'l1_ratio': 0.29831225375187576}. Best is trial 145 with value: 0.2568487370091133.
[I 2023-11-03 23:50:33,058] Trial 273 finished with value: 0.25701935881576593 and parameters: {'alpha': 0.08194271326806636, 'l1_ratio': 0.5735197109984931}. Best is trial 145 with value: 0.2568487370091133.
[I 2023-11-03 23:50:33,067] Trial 315 finished with value: 0.25710943545060566 and parameters: {'alpha': 0.03183179375010776, 'l1_ratio': 0.12438498633705394}. Best is trial 145 with value: 0.2568487370091133.
[I 2023-11-03 23:50:33,114] Trial 292 finished with value: 0.25702215211339313 and parameters: {'alpha': 0.07965732615752799, 'l1_ratio': 0.5762898500729314}. Best is trial 145 with value: 0.2568487370091133.
[I 2023-11-03 23:50:33,122] Trial 321 finished with value: 0.25701252186943363 and parameters: {'alpha': 0.09908675963250657, 'l1_ratio': 0.29714192573650566}. Best is trial 145 with value: 0.2568487370091133.
[I 2023-11-03 23:50:33,140] Trial 283 finished with value: 0.25706479930454246 and parameters: {'alpha': 0.02913005124361465, 'l1_ratio': 0.11503556425868078}. Best is trial 145 with value: 0.2568487370091133.
[I 2023-11-03 23:50:33,154] Trial 305 finished with value: 0.256983037787893 and parameters: {'alpha': 0.09933049323931956, 'l1_ratio': 0.12097291321422354}. Best is trial 145 with value: 0.2568487370091133.
[I 2023-11-03 23:50:33,155] Trial 325 finished with value: 0.25702869677861234 and parameters: {'alpha': 0.032168146365504385, 'l1_ratio': 0.3029822969490269}. Best is trial 145 with value: 0.2568487370091133.
[I 2023-11-03 23:50:33,195] Trial 236 finished with value: 0.2569985748285053 and parameters: {'alpha': 0.07974423433906731, 'l1_ratio': 0.5696725696671563}. Best is trial 145 with value: 0.2568487370091133.
[I 2023-11-03 23:50:33,202] Trial 298 finished with value: 0.2570823378592792 and parameters: {'alpha': 0.032039359263120494, 'l1_ratio': 0.11987012810481773}. Best is trial 145 with value: 0.2568487370091133.
[I 2023-11-03 23:50:33,261] Trial 326 finished with value: 0.25698307693738426 and parameters: {'alpha': 0.03181236162930787, 'l1_ratio': 0.11091839312349681}. Best is trial 145 with value: 0.2568487370091133.
[I 2023-11-03 23:50:33,374] Using an existing study with name 'KRR' instead of creating a new one.
[I 2023-11-03 23:52:17,273] Trial 245 finished with value: 0.25095798691182875 and parameters: {'alpha': 0.15690918026220219, 'gamma': 1.1424931231698681e-15, 'kernel': 'laplacian'}. Best is trial 46 with value: 0.24894111818082743.
[I 2023-11-03 23:52:18,417] Trial 240 finished with value: 0.2525770873739769 and parameters: {'alpha': 0.20628646950271784, 'gamma': 1.1658789246926609e-15, 'kernel': 'laplacian'}. Best is trial 46 with value: 0.24894111818082743.
[I 2023-11-03 23:52:25,988] Trial 260 finished with value: 0.25097530877190616 and parameters: {'alpha': 0.7130390311260544, 'gamma': 1.1638260766177418e-15, 'kernel': 'laplacian'}. Best is trial 46 with value: 0.24894111818082743.
[I 2023-11-03 23:52:26,195] Trial 256 finished with value: 0.2516724853546259 and parameters: {'alpha': 0.5076504930077701, 'gamma': 4.924770681719436e-15, 'kernel': 'laplacian'}. Best is trial 46 with value: 0.24894111818082743.
[I 2023-11-03 23:52:48,776] Trial 276 finished with value: 0.25114024130785867 and parameters: {'alpha': 0.15223432306575171, 'gamma': 4.8554454024567815e-15, 'kernel': 'laplacian'}. Best is trial 46 with value: 0.24894111818082743.
[I 2023-11-03 23:52:49,669] Trial 274 finished with value: 0.24998914719662635 and parameters: {'alpha': 0.21405631850289705, 'gamma': 1.5700077237046694e-15, 'kernel': 'laplacian'}. Best is trial 46 with value: 0.24894111818082743.
[I 2023-11-03 23:53:10,437] Trial 235 finished with value: 0.2514136769450069 and parameters: {'alpha': 0.5134902942549164, 'gamma': 5.338208657625123e-15, 'kernel': 'laplacian'}. Best is trial 46 with value: 0.24894111818082743.
