[I 2023-11-07 17:13:04,705] Trial 0 finished with value: 0.2846020229110214 and parameters: {'alpha': 0.5205491548177447, 'gamma': 4.215019060448603e-15, 'kernel': 'linear'}. Best is trial 0 with value: 0.2846020229110214.
[I 2023-11-07 17:13:04,711] A new study created in Journal with name: GB
[I 2023-11-07 17:13:05,959] Trial 0 finished with value: 0.2649217640348484 and parameters: {'n_estimators': 20, 'learning_rate': 0.5474301993440628, 'max_depth': 4}. Best is trial 0 with value: 0.2649217640348484.
[I 2023-11-07 17:13:05,966] A new study created in Journal with name: RF
[I 2023-11-07 17:13:08,498] Trial 0 finished with value: 0.2642060980637159 and parameters: {'n_estimators': 500, 'max_features': 'auto', 'max_depth': 2}. Best is trial 0 with value: 0.2642060980637159.
[I 2023-11-07 17:13:08,504] A new study created in Journal with name: ANN
[I 2023-11-07 17:13:09,453] Trial 0 finished with value: 2.49224961734267 and parameters: {'learning_rate_init': 0.004863402128055745, 'hidden_layer_sizes': [5, 5, 5]}. Best is trial 0 with value: 2.49224961734267.
[I 2023-11-07 17:13:09,458] A new study created in Journal with name: linear
[I 2023-11-07 17:13:09,490] Trial 0 finished with value: 0.1256588047315301 and parameters: {'alpha': 0.020266613118202277, 'l1_ratio': 0.28212212510325785}. Best is trial 0 with value: 0.1256588047315301.
[I 2023-11-07 17:13:09,494] A new study created in Journal with name: KRR
[I 2023-11-07 17:13:09,529] Trial 0 finished with value: 0.12615569502793386 and parameters: {'alpha': 0.5783707969042786, 'gamma': 6.481212694665385e-15, 'kernel': 'linear'}. Best is trial 0 with value: 0.12615569502793386.
[I 2023-11-07 17:13:09,533] A new study created in Journal with name: GB
[I 2023-11-07 17:13:10,422] Trial 0 finished with value: 0.14250964764089025 and parameters: {'n_estimators': 10, 'learning_rate': 0.3315669621603929, 'max_depth': 4}. Best is trial 0 with value: 0.14250964764089025.
[I 2023-11-07 17:13:10,428] A new study created in Journal with name: RF
[I 2023-11-07 17:13:12,541] Trial 0 finished with value: 0.13428748274185373 and parameters: {'n_estimators': 50, 'max_features': 'auto', 'max_depth': 2}. Best is trial 0 with value: 0.13428748274185373.
[I 2023-11-07 17:13:12,547] A new study created in Journal with name: ANN
[I 2023-11-07 17:13:13,536] Trial 0 finished with value: 3.3090363012368105 and parameters: {'learning_rate_init': 0.08972691060066294, 'hidden_layer_sizes': [5, 5, 5]}. Best is trial 0 with value: 3.3090363012368105.
[I 2023-11-07 17:13:13,541] A new study created in Journal with name: linear
[I 2023-11-07 17:13:13,575] Trial 0 finished with value: 0.25409762860855256 and parameters: {'alpha': 0.03475810871467846, 'l1_ratio': 0.6657602029833579}. Best is trial 0 with value: 0.25409762860855256.
[I 2023-11-07 17:13:13,580] A new study created in Journal with name: KRR
[I 2023-11-07 17:13:14,416] Trial 0 finished with value: 0.24991403801892834 and parameters: {'alpha': 0.4903821590647229, 'gamma': 3.1238461951248353e-16, 'kernel': 'linear'}. Best is trial 0 with value: 0.24991403801892834.
[I 2023-11-07 17:13:14,421] A new study created in Journal with name: GB
[I 2023-11-07 17:13:21,645] Trial 0 finished with value: 0.24672625219284874 and parameters: {'n_estimators': 200, 'learning_rate': 0.7660083851839258, 'max_depth': 2}. Best is trial 0 with value: 0.24672625219284874.
[I 2023-11-07 17:13:21,650] A new study created in Journal with name: RF
[I 2023-11-07 17:13:38,537] Trial 0 finished with value: 0.24633720031744843 and parameters: {'n_estimators': 10, 'max_features': 'sqrt', 'max_depth': 2}. Best is trial 0 with value: 0.24633720031744843.
[I 2023-11-07 17:13:38,545] A new study created in Journal with name: ANN
[I 2023-11-07 17:13:51,477] Trial 0 finished with value: 0.25923632429646043 and parameters: {'learning_rate_init': 0.013376060431261102, 'hidden_layer_sizes': [10, 10, 10]}. Best is trial 0 with value: 0.25923632429646043.
[I 2023-11-07 17:13:51,482] A new study created in Journal with name: linear
[I 2023-11-07 17:13:51,513] Trial 0 finished with value: 0.3069047936495366 and parameters: {'alpha': 0.0028559394331091055, 'l1_ratio': 0.14982609602742103}. Best is trial 0 with value: 0.3069047936495366.
[I 2023-11-07 17:13:51,518] A new study created in Journal with name: KRR
[I 2023-11-07 17:13:51,562] Trial 0 finished with value: 0.31400253574319087 and parameters: {'alpha': 0.1106705137021047, 'gamma': 9.717604275362472e-15, 'kernel': 'rbf'}. Best is trial 0 with value: 0.31400253574319087.
[I 2023-11-07 17:13:51,567] A new study created in Journal with name: GB
[I 2023-11-07 17:13:52,823] Trial 0 finished with value: 0.31942632473903604 and parameters: {'n_estimators': 200, 'learning_rate': 0.7786747451294574, 'max_depth': 4}. Best is trial 0 with value: 0.31942632473903604.
[I 2023-11-07 17:13:52,832] A new study created in Journal with name: RF
[I 2023-11-07 17:13:55,511] Trial 0 finished with value: 0.29394151500954263 and parameters: {'n_estimators': 500, 'max_features': 'auto', 'max_depth': 10}. Best is trial 0 with value: 0.29394151500954263.
[I 2023-11-07 17:13:55,517] A new study created in Journal with name: ANN
[I 2023-11-07 17:13:56,414] Trial 0 finished with value: 1.9652226724146955 and parameters: {'learning_rate_init': 0.0022378224522026737, 'hidden_layer_sizes': [5, 5, 5]}. Best is trial 0 with value: 1.9652226724146955.
[I 2023-11-07 17:13:56,420] Using an existing study with name 'linear' instead of creating a new one.
[I 2023-11-07 17:13:56,455] Trial 7 finished with value: 0.21061745454730288 and parameters: {'alpha': 0.015160654664600403, 'l1_ratio': 0.3847258173961091}. Best is trial 5 with value: 0.21049608409845244.
[I 2023-11-07 17:13:56,461] Using an existing study with name 'KRR' instead of creating a new one.
[I 2023-11-07 17:13:56,498] Trial 7 finished with value: 0.15612721471950594 and parameters: {'alpha': 0.22474151635757383, 'gamma': 2.3591312409218746e-15, 'kernel': 'rbf'}. Best is trial 3 with value: 0.14792048671299554.
[I 2023-11-07 17:13:56,505] Using an existing study with name 'GB' instead of creating a new one.
[I 2023-11-07 17:13:57,809] Trial 7 finished with value: 0.19003951105060932 and parameters: {'n_estimators': 200, 'learning_rate': 0.9823768410480833, 'max_depth': 4}. Best is trial 5 with value: 0.15790287215256196.
[I 2023-11-07 17:13:57,817] Using an existing study with name 'RF' instead of creating a new one.
[I 2023-11-07 17:14:00,764] Trial 7 finished with value: 0.17122230920289752 and parameters: {'n_estimators': 200, 'max_features': 'log2', 'max_depth': 2}. Best is trial 4 with value: 0.16261154785998602.
[I 2023-11-07 17:14:00,771] Using an existing study with name 'ANN' instead of creating a new one.
[I 2023-11-07 17:14:02,471] Trial 7 finished with value: 0.25394043238655023 and parameters: {'learning_rate_init': 0.050851135753964403, 'hidden_layer_sizes': [10]}. Best is trial 3 with value: 0.2218633477001349.
[I 2023-11-07 17:14:02,477] Using an existing study with name 'linear' instead of creating a new one.
[I 2023-11-07 17:14:02,582] Trial 7 finished with value: 0.25702140174770993 and parameters: {'alpha': 0.009587835329294582, 'l1_ratio': 0.905953499291603}. Best is trial 4 with value: 0.25691167822082345.
[I 2023-11-07 17:14:02,588] Using an existing study with name 'KRR' instead of creating a new one.
[I 2023-11-07 17:14:03,556] Trial 7 finished with value: 0.2513061102800583 and parameters: {'alpha': 0.026226321567364246, 'gamma': 4.034306813736791e-15, 'kernel': 'laplacian'}. Best is trial 6 with value: 0.2495241394316322.
[I 2023-11-07 17:14:03,562] Using an existing study with name 'GB' instead of creating a new one.
[I 2023-11-07 17:14:13,368] Trial 7 finished with value: 0.24371299521674664 and parameters: {'n_estimators': 200, 'learning_rate': 0.9816222198953195, 'max_depth': 3}. Best is trial 5 with value: 0.24268398989185572.
[I 2023-11-07 17:14:13,376] Using an existing study with name 'RF' instead of creating a new one.
[I 2023-11-07 17:14:54,402] Trial 7 finished with value: 0.2366325147403082 and parameters: {'n_estimators': 200, 'max_features': 'log2', 'max_depth': 4}. Best is trial 2 with value: 0.23643367289893102.
[I 2023-11-07 17:14:54,409] Using an existing study with name 'ANN' instead of creating a new one.
[I 2023-11-07 17:15:17,165] Trial 2 finished with value: 0.2931256765574181 and parameters: {'learning_rate_init': 0.051953878764671356, 'hidden_layer_sizes': [20, 20]}. Best is trial 0 with value: 0.28963630595478557.
[I 2023-11-07 17:15:17,170] Using an existing study with name 'linear' instead of creating a new one.
[I 2023-11-07 17:15:17,207] Trial 2 finished with value: 0.3173347320489192 and parameters: {'alpha': 0.016705755764067985, 'l1_ratio': 0.3958149980903056}. Best is trial 1 with value: 0.31725988138603584.
[I 2023-11-07 17:15:17,212] Using an existing study with name 'KRR' instead of creating a new one.
[I 2023-11-07 17:15:17,264] Trial 2 finished with value: 0.30598292225066076 and parameters: {'alpha': 0.12951896449515102, 'gamma': 2.8620110309626532e-15, 'kernel': 'rbf'}. Best is trial 1 with value: 0.2972821705184329.
[I 2023-11-07 17:15:17,269] Using an existing study with name 'GB' instead of creating a new one.
[I 2023-11-07 17:15:19,121] Trial 2 finished with value: 0.2759094214593831 and parameters: {'n_estimators': 50, 'learning_rate': 0.9310369000669255, 'max_depth': 5}. Best is trial 1 with value: 0.2673906455658081.
[I 2023-11-07 17:15:19,127] Using an existing study with name 'RF' instead of creating a new one.
[I 2023-11-07 17:15:23,345] Trial 2 finished with value: 0.2715595884941659 and parameters: {'n_estimators': 200, 'max_features': 'auto', 'max_depth': 5}. Best is trial 0 with value: 0.2677642292700792.
[I 2023-11-07 17:15:23,351] Using an existing study with name 'ANN' instead of creating a new one.
[I 2023-11-07 17:15:26,397] Trial 2 finished with value: 0.3290537974079164 and parameters: {'learning_rate_init': 0.0993819361183805, 'hidden_layer_sizes': [5]}. Best is trial 1 with value: 0.3121796326453741.
[I 2023-11-07 17:15:26,402] Using an existing study with name 'linear' instead of creating a new one.
[I 2023-11-07 17:15:26,436] Trial 2 finished with value: 0.2141942185958121 and parameters: {'alpha': 0.048890753847077195, 'l1_ratio': 0.32714377630650204}. Best is trial 1 with value: 0.21187289129156708.
[I 2023-11-07 17:15:26,441] Using an existing study with name 'KRR' instead of creating a new one.
[I 2023-11-07 17:15:26,482] Trial 2 finished with value: 0.13967776073074545 and parameters: {'alpha': 0.00927211531835612, 'gamma': 2.2195428839641586e-15, 'kernel': 'laplacian'}. Best is trial 2 with value: 0.13967776073074545.
[I 2023-11-07 17:15:26,487] Using an existing study with name 'GB' instead of creating a new one.
[I 2023-11-07 17:15:27,765] Trial 2 finished with value: 0.12612633967275041 and parameters: {'n_estimators': 500, 'learning_rate': 0.4966737444025495, 'max_depth': 1}. Best is trial 0 with value: 0.10324836117333373.
[I 2023-11-07 17:15:27,771] Using an existing study with name 'RF' instead of creating a new one.
[I 2023-11-07 17:15:30,677] Trial 2 finished with value: 0.1591532879393868 and parameters: {'n_estimators': 10, 'max_features': 'log2', 'max_depth': 4}. Best is trial 1 with value: 0.13033864323678376.
[I 2023-11-07 17:15:30,683] Using an existing study with name 'ANN' instead of creating a new one.
[I 2023-11-07 17:15:32,271] Trial 2 finished with value: 0.2717648863224549 and parameters: {'learning_rate_init': 0.011484411002926218, 'hidden_layer_sizes': [10, 10, 10]}. Best is trial 0 with value: 0.2465075969227216.
[I 2023-11-07 17:15:32,276] Using an existing study with name 'linear' instead of creating a new one.
[I 2023-11-07 17:15:32,331] Trial 2 finished with value: 0.24771682027273734 and parameters: {'alpha': 0.08485425127039885, 'l1_ratio': 0.19827937350097435}. Best is trial 1 with value: 0.24762813372321282.
[I 2023-11-07 17:15:32,336] Using an existing study with name 'KRR' instead of creating a new one.
[I 2023-11-07 17:15:33,301] Trial 2 finished with value: 0.23635248662471042 and parameters: {'alpha': 0.6831364912882693, 'gamma': 5.238561490904984e-15, 'kernel': 'rbf'}. Best is trial 0 with value: 0.23575721399277358.
[I 2023-11-07 17:15:33,307] Using an existing study with name 'GB' instead of creating a new one.
[I 2023-11-07 17:15:43,049] Trial 2 finished with value: 0.22577322957415455 and parameters: {'n_estimators': 200, 'learning_rate': 0.4636517286747276, 'max_depth': 2}. Best is trial 1 with value: 0.2253864094793028.
[I 2023-11-07 17:15:43,056] Using an existing study with name 'RF' instead of creating a new one.
[I 2023-11-07 17:16:23,421] Trial 2 finished with value: 0.21954058397393753 and parameters: {'n_estimators': 50, 'max_features': 'log2', 'max_depth': 10}. Best is trial 0 with value: 0.21890862037935035.
[I 2023-11-07 17:16:23,428] Using an existing study with name 'ANN' instead of creating a new one.
[I 2023-11-07 17:16:44,711] Trial 2 finished with value: 0.26790840024961743 and parameters: {'learning_rate_init': 0.050159059096054975, 'hidden_layer_sizes': [20, 20]}. Best is trial 2 with value: 0.26790840024961743.
[I 2023-11-07 17:16:44,716] Using an existing study with name 'linear' instead of creating a new one.
[I 2023-11-07 17:16:44,751] Trial 2 finished with value: 0.2799355358986259 and parameters: {'alpha': 0.08532427372368785, 'l1_ratio': 0.08830073762972879}. Best is trial 2 with value: 0.2799355358986259.
[I 2023-11-07 17:16:44,756] Using an existing study with name 'KRR' instead of creating a new one.
[I 2023-11-07 17:16:44,810] Trial 2 finished with value: 0.27296973093493354 and parameters: {'alpha': 0.7750216195771711, 'gamma': 7.525942377250969e-15, 'kernel': 'linear'}. Best is trial 2 with value: 0.27296973093493354.
[I 2023-11-07 17:16:44,815] Using an existing study with name 'GB' instead of creating a new one.
[I 2023-11-07 17:16:46,676] Trial 2 finished with value: 0.25982168419024126 and parameters: {'n_estimators': 10, 'learning_rate': 0.25672686893782765, 'max_depth': 5}. Best is trial 1 with value: 0.25579944588375864.
[I 2023-11-07 17:16:46,682] Using an existing study with name 'RF' instead of creating a new one.
[I 2023-11-07 17:16:50,597] Trial 2 finished with value: 0.2516419234024826 and parameters: {'n_estimators': 20, 'max_features': 'sqrt', 'max_depth': 3}. Best is trial 1 with value: 0.24721923389918024.
[I 2023-11-07 17:16:50,603] Using an existing study with name 'ANN' instead of creating a new one.
[I 2023-11-07 17:16:53,675] Trial 2 finished with value: 0.3318046156900154 and parameters: {'learning_rate_init': 0.02232355205808785, 'hidden_layer_sizes': [50, 50, 50]}. Best is trial 2 with value: 0.3318046156900154.
[I 2023-11-07 17:16:53,680] Using an existing study with name 'linear' instead of creating a new one.
[I 2023-11-07 17:16:53,713] Trial 2 finished with value: 0.1263750621900681 and parameters: {'alpha': 0.030278848448359583, 'l1_ratio': 0.39920293620898084}. Best is trial 2 with value: 0.1263750621900681.
[I 2023-11-07 17:16:53,718] Using an existing study with name 'KRR' instead of creating a new one.
[I 2023-11-07 17:16:53,758] Trial 2 finished with value: 0.12511874037691656 and parameters: {'alpha': 0.9471476065800032, 'gamma': 7.388611237549744e-15, 'kernel': 'rbf'}. Best is trial 2 with value: 0.12511874037691656.
[I 2023-11-07 17:16:53,763] Using an existing study with name 'GB' instead of creating a new one.
[I 2023-11-07 17:16:55,082] Trial 2 finished with value: 0.15095145961871437 and parameters: {'n_estimators': 10, 'learning_rate': 0.7611215461456278, 'max_depth': 5}. Best is trial 1 with value: 0.13605880775044277.
[I 2023-11-07 17:16:55,088] Using an existing study with name 'RF' instead of creating a new one.
[I 2023-11-07 17:16:58,042] Trial 2 finished with value: 0.13531530977608128 and parameters: {'n_estimators': 10, 'max_features': 'log2', 'max_depth': None}. Best is trial 0 with value: 0.13238265975279348.
[I 2023-11-07 17:16:58,048] Using an existing study with name 'ANN' instead of creating a new one.
[I 2023-11-07 17:16:59,601] Trial 2 finished with value: 0.2919678963714401 and parameters: {'learning_rate_init': 0.04724282965350443, 'hidden_layer_sizes': [10, 10, 10]}. Best is trial 1 with value: 0.24416734248193808.
[I 2023-11-07 17:16:59,606] Using an existing study with name 'linear' instead of creating a new one.
[I 2023-11-07 17:16:59,665] Trial 2 finished with value: 0.2564091206928858 and parameters: {'alpha': 0.06853321565439591, 'l1_ratio': 0.12693740855713664}. Best is trial 1 with value: 0.25624895264142994.
[I 2023-11-07 17:16:59,670] Using an existing study with name 'KRR' instead of creating a new one.
[I 2023-11-07 17:17:00,762] Trial 2 finished with value: 0.25054455696472694 and parameters: {'alpha': 0.9252857894299413, 'gamma': 2.4382472840489566e-15, 'kernel': 'linear'}. Best is trial 1 with value: 0.2500477655162643.
[I 2023-11-07 17:17:00,768] Using an existing study with name 'GB' instead of creating a new one.
[I 2023-11-07 17:17:10,798] Trial 2 finished with value: 0.24263214904367078 and parameters: {'n_estimators': 500, 'learning_rate': 0.2893157760840504, 'max_depth': 4}. Best is trial 0 with value: 0.2423317415188532.
[I 2023-11-07 17:17:10,805] Using an existing study with name 'RF' instead of creating a new one.
[I 2023-11-07 17:17:51,696] Trial 2 finished with value: 0.235784747381632 and parameters: {'n_estimators': 50, 'max_features': 'log2', 'max_depth': 2}. Best is trial 2 with value: 0.235784747381632.
[I 2023-11-07 17:17:51,702] Using an existing study with name 'ANN' instead of creating a new one.
[I 2023-11-07 17:18:14,466] Trial 2 finished with value: 0.2973109946293792 and parameters: {'learning_rate_init': 0.025011113801886545, 'hidden_layer_sizes': [20]}. Best is trial 1 with value: 0.2924621123347735.
[I 2023-11-07 17:18:14,477] Using an existing study with name 'linear' instead of creating a new one.
[I 2023-11-07 17:18:14,512] Trial 2 finished with value: 0.3123010278266924 and parameters: {'alpha': 0.08393140645110597, 'l1_ratio': 0.5243188603259078}. Best is trial 2 with value: 0.3123010278266924.
[I 2023-11-07 17:18:14,517] Using an existing study with name 'KRR' instead of creating a new one.
[I 2023-11-07 17:18:14,570] Trial 2 finished with value: 0.3595604308716273 and parameters: {'alpha': 0.6435131404104366, 'gamma': 4.761278591021556e-15, 'kernel': 'rbf'}. Best is trial 0 with value: 0.3490277183368873.
[I 2023-11-07 17:18:14,575] Using an existing study with name 'GB' instead of creating a new one.
[I 2023-11-07 17:18:16,438] Trial 2 finished with value: 0.29989704843340675 and parameters: {'n_estimators': 500, 'learning_rate': 0.38276223993283764, 'max_depth': 4}. Best is trial 1 with value: 0.28265874413547687.
[I 2023-11-07 17:18:16,448] Using an existing study with name 'RF' instead of creating a new one.
[I 2023-11-07 17:18:20,735] Trial 2 finished with value: 0.279566581392785 and parameters: {'n_estimators': 20, 'max_features': 'auto', 'max_depth': 3}. Best is trial 0 with value: 0.2761349382232521.
[I 2023-11-07 17:18:20,741] Using an existing study with name 'ANN' instead of creating a new one.
[I 2023-11-07 17:18:23,904] Trial 2 finished with value: 0.3190149049954781 and parameters: {'learning_rate_init': 0.01962755325619256, 'hidden_layer_sizes': [5, 5]}. Best is trial 2 with value: 0.3190149049954781.
[I 2023-11-07 17:18:23,909] Using an existing study with name 'linear' instead of creating a new one.
[I 2023-11-07 17:18:23,941] Trial 2 finished with value: 0.21611834234273689 and parameters: {'alpha': 0.017687613173125304, 'l1_ratio': 0.6333611743187618}. Best is trial 1 with value: 0.21201947379903233.
[I 2023-11-07 17:18:23,946] Using an existing study with name 'KRR' instead of creating a new one.
[I 2023-11-07 17:18:23,983] Trial 2 finished with value: 0.22383012676846092 and parameters: {'alpha': 0.8686024361298195, 'gamma': 5.860881345714592e-15, 'kernel': 'rbf'}. Best is trial 0 with value: 0.22161596581278975.
[I 2023-11-07 17:18:23,988] Using an existing study with name 'GB' instead of creating a new one.
[I 2023-11-07 17:18:24,881] Trial 2 finished with value: 0.12689456394233786 and parameters: {'n_estimators': 50, 'learning_rate': 0.0287892823604815, 'max_depth': 3}. Best is trial 2 with value: 0.12689456394233786.
[I 2023-11-07 17:18:24,887] Using an existing study with name 'RF' instead of creating a new one.
[I 2023-11-07 17:18:26,993] Trial 2 finished with value: 0.1368294480595562 and parameters: {'n_estimators': 200, 'max_features': 'log2', 'max_depth': 10}. Best is trial 2 with value: 0.1368294480595562.
[I 2023-11-07 17:18:27,001] Using an existing study with name 'ANN' instead of creating a new one.
[I 2023-11-07 17:18:27,858] Trial 2 finished with value: 4.226267461403045 and parameters: {'learning_rate_init': 0.01698671974741526, 'hidden_layer_sizes': [5, 5, 5]}. Best is trial 1 with value: 3.9561638962655734.
[I 2023-11-07 17:18:27,863] Using an existing study with name 'linear' instead of creating a new one.
[I 2023-11-07 17:18:27,899] Trial 1 finished with value: 0.25467759149475944 and parameters: {'alpha': 0.023503995576714936, 'l1_ratio': 0.46292188546344937}. Best is trial 1 with value: 0.25467759149475944.
[I 2023-11-07 17:18:27,904] Using an existing study with name 'KRR' instead of creating a new one.
[I 2023-11-07 17:18:28,775] Trial 1 finished with value: 0.2510711302626463 and parameters: {'alpha': 0.26491942978238114, 'gamma': 9.2876693808206e-15, 'kernel': 'linear'}. Best is trial 0 with value: 0.2507609665077765.
[I 2023-11-07 17:18:28,780] Using an existing study with name 'GB' instead of creating a new one.
