[I 2023-11-04 00:02:43,675] Trial 262 finished with value: 0.23912582557082174 and parameters: {'n_estimators': 500, 'max_features': 'log2', 'max_depth': 4}. Best is trial 264 with value: 0.23576587037781305.
[I 2023-11-04 00:02:44,402] Trial 230 finished with value: 0.2363075178502498 and parameters: {'n_estimators': 500, 'max_features': 'log2', 'max_depth': 4}. Best is trial 239 with value: 0.23569864036836555.
[I 2023-11-04 00:02:44,420] Trial 236 finished with value: 0.23783547362458482 and parameters: {'n_estimators': 500, 'max_features': 'log2', 'max_depth': 4}. Best is trial 239 with value: 0.23569864036836555.
[I 2023-11-04 00:02:44,467] Trial 284 finished with value: 0.23772823028703025 and parameters: {'n_estimators': 500, 'max_features': 'log2', 'max_depth': 4}. Best is trial 239 with value: 0.23569864036836555.
[I 2023-11-04 00:02:44,481] Trial 238 finished with value: 0.2369387202962621 and parameters: {'n_estimators': 500, 'max_features': 'log2', 'max_depth': 4}. Best is trial 239 with value: 0.23569864036836555.
[I 2023-11-04 00:02:44,626] Trial 269 finished with value: 0.23796734410440668 and parameters: {'n_estimators': 500, 'max_features': 'log2', 'max_depth': 4}. Best is trial 239 with value: 0.23569864036836555.
[I 2023-11-04 00:02:44,901] Trial 272 finished with value: 0.2380495504309359 and parameters: {'n_estimators': 500, 'max_features': 'log2', 'max_depth': 4}. Best is trial 239 with value: 0.23569864036836555.
[I 2023-11-04 00:02:45,092] Trial 256 finished with value: 0.23796055679981556 and parameters: {'n_estimators': 500, 'max_features': 'log2', 'max_depth': 4}. Best is trial 239 with value: 0.23569864036836555.
[I 2023-11-04 00:02:45,105] Trial 258 finished with value: 0.23740481320318552 and parameters: {'n_estimators': 500, 'max_features': 'log2', 'max_depth': 4}. Best is trial 239 with value: 0.23569864036836555.
[I 2023-11-04 00:02:45,195] Trial 233 finished with value: 0.23874950962124583 and parameters: {'n_estimators': 500, 'max_features': 'log2', 'max_depth': 4}. Best is trial 239 with value: 0.23569864036836555.
[I 2023-11-04 00:02:45,204] Trial 246 finished with value: 0.23825968737668843 and parameters: {'n_estimators': 500, 'max_features': 'log2', 'max_depth': 4}. Best is trial 239 with value: 0.23569864036836555.
[I 2023-11-04 00:02:45,210] Trial 286 finished with value: 0.23778677006551904 and parameters: {'n_estimators': 500, 'max_features': 'log2', 'max_depth': 4}. Best is trial 239 with value: 0.23569864036836555.
[I 2023-11-04 00:02:45,239] Trial 243 finished with value: 0.23724508105527722 and parameters: {'n_estimators': 500, 'max_features': 'log2', 'max_depth': 4}. Best is trial 239 with value: 0.23569864036836555.
[I 2023-11-04 00:02:45,260] Trial 264 finished with value: 0.23576587037781305 and parameters: {'n_estimators': 500, 'max_features': 'log2', 'max_depth': 4}. Best is trial 239 with value: 0.23569864036836555.
[I 2023-11-04 00:02:45,260] Trial 234 finished with value: 0.23778484117647636 and parameters: {'n_estimators': 500, 'max_features': 'log2', 'max_depth': 4}. Best is trial 239 with value: 0.23569864036836555.
[I 2023-11-04 00:02:45,261] Trial 231 finished with value: 0.2366508756893321 and parameters: {'n_estimators': 500, 'max_features': 'log2', 'max_depth': 4}. Best is trial 239 with value: 0.23569864036836555.
[I 2023-11-04 00:02:45,262] Trial 296 finished with value: 0.23631577908135562 and parameters: {'n_estimators': 500, 'max_features': 'log2', 'max_depth': 4}. Best is trial 239 with value: 0.23569864036836555.
[I 2023-11-04 00:02:45,266] Trial 248 finished with value: 0.23661767983146087 and parameters: {'n_estimators': 500, 'max_features': 'log2', 'max_depth': 4}. Best is trial 239 with value: 0.23569864036836555.
[I 2023-11-04 00:02:45,267] Trial 254 finished with value: 0.2386327435746732 and parameters: {'n_estimators': 500, 'max_features': 'log2', 'max_depth': 4}. Best is trial 239 with value: 0.23569864036836555.
[I 2023-11-04 00:02:45,277] Trial 293 finished with value: 0.2381423754703366 and parameters: {'n_estimators': 500, 'max_features': 'log2', 'max_depth': 4}. Best is trial 239 with value: 0.23569864036836555.
[I 2023-11-04 00:02:45,440] Trial 274 finished with value: 0.2377981127548259 and parameters: {'n_estimators': 500, 'max_features': 'log2', 'max_depth': 4}. Best is trial 239 with value: 0.23569864036836555.
[I 2023-11-04 00:02:45,468] Trial 281 finished with value: 0.23905599048887027 and parameters: {'n_estimators': 500, 'max_features': 'log2', 'max_depth': 4}. Best is trial 239 with value: 0.23569864036836555.
[I 2023-11-04 00:02:45,476] Trial 239 finished with value: 0.23569864036836555 and parameters: {'n_estimators': 500, 'max_features': 'log2', 'max_depth': 4}. Best is trial 239 with value: 0.23569864036836555.
[I 2023-11-04 00:02:45,481] Trial 244 finished with value: 0.23820456118934474 and parameters: {'n_estimators': 500, 'max_features': 'log2', 'max_depth': 4}. Best is trial 239 with value: 0.23569864036836555.
[I 2023-11-04 00:02:45,487] Trial 292 finished with value: 0.23601769898187852 and parameters: {'n_estimators': 500, 'max_features': 'log2', 'max_depth': 4}. Best is trial 239 with value: 0.23569864036836555.
[I 2023-11-04 00:02:45,503] Trial 285 finished with value: 0.23841103273926337 and parameters: {'n_estimators': 500, 'max_features': 'log2', 'max_depth': 4}. Best is trial 239 with value: 0.23569864036836555.
[I 2023-11-04 00:02:45,533] Trial 297 finished with value: 0.23720825657959907 and parameters: {'n_estimators': 500, 'max_features': 'log2', 'max_depth': 4}. Best is trial 239 with value: 0.23569864036836555.
[I 2023-11-04 00:02:45,553] Trial 279 finished with value: 0.2383213418919153 and parameters: {'n_estimators': 500, 'max_features': 'log2', 'max_depth': 4}. Best is trial 239 with value: 0.23569864036836555.
[I 2023-11-04 00:02:45,563] Trial 276 finished with value: 0.23880589164846436 and parameters: {'n_estimators': 500, 'max_features': 'log2', 'max_depth': 4}. Best is trial 239 with value: 0.23569864036836555.
[I 2023-11-04 00:02:45,736] Trial 226 finished with value: 0.23841228837797 and parameters: {'n_estimators': 500, 'max_features': 'log2', 'max_depth': 4}. Best is trial 239 with value: 0.23569864036836555.
[I 2023-11-04 00:02:45,855] Trial 270 finished with value: 0.23810292004990688 and parameters: {'n_estimators': 500, 'max_features': 'log2', 'max_depth': 4}. Best is trial 239 with value: 0.23569864036836555.
[I 2023-11-04 00:02:45,871] Trial 265 finished with value: 0.23772311004506796 and parameters: {'n_estimators': 500, 'max_features': 'log2', 'max_depth': 4}. Best is trial 239 with value: 0.23569864036836555.
[I 2023-11-04 00:02:46,065] Trial 304 finished with value: 0.23695486880944794 and parameters: {'n_estimators': 500, 'max_features': 'log2', 'max_depth': 4}. Best is trial 239 with value: 0.23569864036836555.
[I 2023-11-04 00:02:46,067] Trial 298 finished with value: 0.23594669975890323 and parameters: {'n_estimators': 500, 'max_features': 'log2', 'max_depth': 4}. Best is trial 239 with value: 0.23569864036836555.
[I 2023-11-04 00:02:46,157] Trial 289 finished with value: 0.23827681417957627 and parameters: {'n_estimators': 500, 'max_features': 'log2', 'max_depth': 4}. Best is trial 239 with value: 0.23569864036836555.
[I 2023-11-04 00:02:46,288] Trial 253 finished with value: 0.23773102122505962 and parameters: {'n_estimators': 500, 'max_features': 'log2', 'max_depth': 4}. Best is trial 239 with value: 0.23569864036836555.
[W 2023-11-04 00:02:46,290] Trial 247 failed with parameters: {} because of the following error: StorageInternalError('An exception is raised during the commit. This typically happens due to invalid data in the commit, e.g. exceeding max length. ').
Traceback (most recent call last):
  File "/home/it4i-majerl/.conda/envs/soc/lib/python3.11/site-packages/sqlalchemy/engine/base.py", line 1819, in _execute_context
    self.dialect.do_execute(
  File "/home/it4i-majerl/.conda/envs/soc/lib/python3.11/site-packages/sqlalchemy/engine/default.py", line 732, in do_execute
    cursor.execute(statement, parameters)
sqlite3.OperationalError: database is locked

The above exception was the direct cause of the following exception:

Traceback (most recent call last):
  File "/home/it4i-majerl/.local/lib/python3.11/site-packages/optuna/storages/_rdb/storage.py", line 74, in _create_scoped_session
    session.commit()
  File "/home/it4i-majerl/.conda/envs/soc/lib/python3.11/site-packages/sqlalchemy/orm/session.py", line 1451, in commit
    self._transaction.commit(_to_root=self.future)
  File "/home/it4i-majerl/.conda/envs/soc/lib/python3.11/site-packages/sqlalchemy/orm/session.py", line 829, in commit
    self._prepare_impl()
  File "/home/it4i-majerl/.conda/envs/soc/lib/python3.11/site-packages/sqlalchemy/orm/session.py", line 808, in _prepare_impl
    self.session.flush()
  File "/home/it4i-majerl/.conda/envs/soc/lib/python3.11/site-packages/sqlalchemy/orm/session.py", line 3383, in flush
    self._flush(objects)
  File "/home/it4i-majerl/.conda/envs/soc/lib/python3.11/site-packages/sqlalchemy/orm/session.py", line 3522, in _flush
    with util.safe_reraise():
  File "/home/it4i-majerl/.conda/envs/soc/lib/python3.11/site-packages/sqlalchemy/util/langhelpers.py", line 70, in __exit__
    compat.raise_(
  File "/home/it4i-majerl/.conda/envs/soc/lib/python3.11/site-packages/sqlalchemy/util/compat.py", line 208, in raise_
    raise exception
  File "/home/it4i-majerl/.conda/envs/soc/lib/python3.11/site-packages/sqlalchemy/orm/session.py", line 3483, in _flush
    flush_context.execute()
  File "/home/it4i-majerl/.conda/envs/soc/lib/python3.11/site-packages/sqlalchemy/orm/unitofwork.py", line 456, in execute
    rec.execute(self)
  File "/home/it4i-majerl/.conda/envs/soc/lib/python3.11/site-packages/sqlalchemy/orm/unitofwork.py", line 630, in execute
    util.preloaded.orm_persistence.save_obj(
  File "/home/it4i-majerl/.conda/envs/soc/lib/python3.11/site-packages/sqlalchemy/orm/persistence.py", line 245, in save_obj
    _emit_insert_statements(
  File "/home/it4i-majerl/.conda/envs/soc/lib/python3.11/site-packages/sqlalchemy/orm/persistence.py", line 1238, in _emit_insert_statements
    result = connection._execute_20(
             ^^^^^^^^^^^^^^^^^^^^^^^
  File "/home/it4i-majerl/.conda/envs/soc/lib/python3.11/site-packages/sqlalchemy/engine/base.py", line 1631, in _execute_20
    return meth(self, args_10style, kwargs_10style, execution_options)
           ^^^^^^^^^^^^^^^^^^^^^^^^^^^^^^^^^^^^^^^^^^^^^^^^^^^^^^^^^^^
  File "/home/it4i-majerl/.conda/envs/soc/lib/python3.11/site-packages/sqlalchemy/sql/elements.py", line 332, in _execute_on_connection
    return connection._execute_clauseelement(
           ^^^^^^^^^^^^^^^^^^^^^^^^^^^^^^^^^^
  File "/home/it4i-majerl/.conda/envs/soc/lib/python3.11/site-packages/sqlalchemy/engine/base.py", line 1498, in _execute_clauseelement
    ret = self._execute_context(
          ^^^^^^^^^^^^^^^^^^^^^^
  File "/home/it4i-majerl/.conda/envs/soc/lib/python3.11/site-packages/sqlalchemy/engine/base.py", line 1862, in _execute_context
    self._handle_dbapi_exception(
  File "/home/it4i-majerl/.conda/envs/soc/lib/python3.11/site-packages/sqlalchemy/engine/base.py", line 2043, in _handle_dbapi_exception
    util.raise_(
  File "/home/it4i-majerl/.conda/envs/soc/lib/python3.11/site-packages/sqlalchemy/util/compat.py", line 208, in raise_
    raise exception
  File "/home/it4i-majerl/.conda/envs/soc/lib/python3.11/site-packages/sqlalchemy/engine/base.py", line 1819, in _execute_context
    self.dialect.do_execute(
  File "/home/it4i-majerl/.conda/envs/soc/lib/python3.11/site-packages/sqlalchemy/engine/default.py", line 732, in do_execute
    cursor.execute(statement, parameters)
sqlalchemy.exc.OperationalError: (sqlite3.OperationalError) database is locked
[SQL: INSERT INTO trial_params (trial_id, param_name, param_value, distribution_json) VALUES (?, ?, ?, ?)]
[parameters: (248, 'n_estimators', 2.0, '{"name": "CategoricalDistribution", "attributes": {"choices": [10, 20, 50, 200, 500]}}')]
(Background on this error at: https://sqlalche.me/e/14/e3q8)

The above exception was the direct cause of the following exception:

Traceback (most recent call last):
  File "/home/it4i-majerl/.local/lib/python3.11/site-packages/optuna/study/_optimize.py", line 200, in _run_trial
    value_or_values = func(trial)
                      ^^^^^^^^^^^
  File "/home/it4i-majerl/Documents/datacytochromy/project_resources/it4i_resources.py", line 201, in objective
    parameters, model = self.sample_params(trial, self.model_identifier)
                        ^^^^^^^^^^^^^^^^^^^^^^^^^^^^^^^^^^^^^^^^^^^^^^^^
  File "/home/it4i-majerl/Documents/datacytochromy/project_resources/it4i_resources.py", line 104, in sample_params
    n_estimators = trial.suggest_categorical("n_estimators", [10, 20, 50, 200, 500])
                   ^^^^^^^^^^^^^^^^^^^^^^^^^^^^^^^^^^^^^^^^^^^^^^^^^^^^^^^^^^^^^^^^^
  File "/home/it4i-majerl/.local/lib/python3.11/site-packages/optuna/trial/_trial.py", line 405, in suggest_categorical
    return self._suggest(name, CategoricalDistribution(choices=choices))
           ^^^^^^^^^^^^^^^^^^^^^^^^^^^^^^^^^^^^^^^^^^^^^^^^^^^^^^^^^^^^^
  File "/home/it4i-majerl/.local/lib/python3.11/site-packages/optuna/trial/_trial.py", line 636, in _suggest
    storage.set_trial_param(trial_id, name, param_value_in_internal_repr, distribution)
  File "/home/it4i-majerl/.local/lib/python3.11/site-packages/optuna/storages/_cached_storage.py", line 171, in set_trial_param
    self._backend.set_trial_param(trial_id, param_name, param_value_internal, distribution)
  File "/home/it4i-majerl/.local/lib/python3.11/site-packages/optuna/storages/_rdb/storage.py", line 568, in set_trial_param
    with _create_scoped_session(self.scoped_session, True) as session:
  File "/home/it4i-majerl/.conda/envs/soc/lib/python3.11/contextlib.py", line 144, in __exit__
    next(self.gen)
  File "/home/it4i-majerl/.local/lib/python3.11/site-packages/optuna/storages/_rdb/storage.py", line 91, in _create_scoped_session
    raise optuna.exceptions.StorageInternalError(message) from e
optuna.exceptions.StorageInternalError: An exception is raised during the commit. This typically happens due to invalid data in the commit, e.g. exceeding max length. 
[I 2023-11-04 00:02:46,495] Trial 302 finished with value: 0.23640456712434196 and parameters: {'n_estimators': 500, 'max_features': 'log2', 'max_depth': 4}. Best is trial 239 with value: 0.23569864036836555.
[I 2023-11-04 00:02:46,508] Trial 232 finished with value: 0.23661129018679886 and parameters: {'n_estimators': 500, 'max_features': 'log2', 'max_depth': 4}. Best is trial 239 with value: 0.23569864036836555.
[I 2023-11-04 00:02:46,508] Trial 273 finished with value: 0.23725628755508352 and parameters: {'n_estimators': 500, 'max_features': 'log2', 'max_depth': 4}. Best is trial 239 with value: 0.23569864036836555.
[I 2023-11-04 00:02:46,528] Trial 290 finished with value: 0.23626213148260744 and parameters: {'n_estimators': 500, 'max_features': 'log2', 'max_depth': 4}. Best is trial 239 with value: 0.23569864036836555.
[I 2023-11-04 00:02:46,537] Trial 268 finished with value: 0.23671426741107862 and parameters: {'n_estimators': 500, 'max_features': 'log2', 'max_depth': 4}. Best is trial 239 with value: 0.23569864036836555.
[W 2023-11-04 00:02:46,551] Trial 247 failed with value None.
[I 2023-11-04 00:02:46,568] Trial 267 finished with value: 0.23763736105534863 and parameters: {'n_estimators': 500, 'max_features': 'log2', 'max_depth': 4}. Best is trial 239 with value: 0.23569864036836555.
[I 2023-11-04 00:02:46,570] Trial 260 finished with value: 0.23861144788660785 and parameters: {'n_estimators': 500, 'max_features': 'log2', 'max_depth': 4}. Best is trial 239 with value: 0.23569864036836555.
[I 2023-11-04 00:02:46,624] Trial 228 finished with value: 0.2373581090345959 and parameters: {'n_estimators': 500, 'max_features': 'log2', 'max_depth': 4}. Best is trial 239 with value: 0.23569864036836555.
[I 2023-11-04 00:02:46,924] Trial 312 finished with value: 0.2372975242020007 and parameters: {'n_estimators': 500, 'max_features': 'log2', 'max_depth': 4}. Best is trial 239 with value: 0.23569864036836555.
[I 2023-11-04 00:02:46,927] Trial 307 finished with value: 0.2371540881562811 and parameters: {'n_estimators': 500, 'max_features': 'log2', 'max_depth': 4}. Best is trial 239 with value: 0.23569864036836555.
[I 2023-11-04 00:02:46,933] Trial 240 finished with value: 0.2370495534146281 and parameters: {'n_estimators': 500, 'max_features': 'log2', 'max_depth': 4}. Best is trial 239 with value: 0.23569864036836555.
[I 2023-11-04 00:02:47,100] Trial 229 finished with value: 0.23737136393357228 and parameters: {'n_estimators': 500, 'max_features': 'log2', 'max_depth': 4}. Best is trial 239 with value: 0.23569864036836555.
[I 2023-11-04 00:02:47,147] Trial 299 finished with value: 0.23759597281876865 and parameters: {'n_estimators': 500, 'max_features': 'log2', 'max_depth': 4}. Best is trial 239 with value: 0.23569864036836555.
[I 2023-11-04 00:02:47,347] Trial 308 finished with value: 0.2384346307231194 and parameters: {'n_estimators': 500, 'max_features': 'log2', 'max_depth': 4}. Best is trial 239 with value: 0.23569864036836555.
[I 2023-11-04 00:02:47,503] Trial 235 finished with value: 0.23771992027649183 and parameters: {'n_estimators': 500, 'max_features': 'log2', 'max_depth': 4}. Best is trial 239 with value: 0.23569864036836555.
[I 2023-11-04 00:02:49,863] Trial 313 finished with value: 0.23691821006913624 and parameters: {'n_estimators': 500, 'max_features': 'log2', 'max_depth': 4}. Best is trial 239 with value: 0.23569864036836555.
[I 2023-11-04 00:02:49,883] Trial 237 finished with value: 0.2370752978215762 and parameters: {'n_estimators': 500, 'max_features': 'log2', 'max_depth': 4}. Best is trial 239 with value: 0.23569864036836555.
[I 2023-11-04 00:02:55,786] Trial 303 finished with value: 0.23756131376539627 and parameters: {'n_estimators': 500, 'max_features': 'log2', 'max_depth': 4}. Best is trial 239 with value: 0.23569864036836555.
[I 2023-11-04 00:02:59,193] Trial 252 finished with value: 0.23735182207847497 and parameters: {'n_estimators': 500, 'max_features': 'log2', 'max_depth': 4}. Best is trial 239 with value: 0.23569864036836555.
[I 2023-11-04 00:03:03,022] Trial 316 finished with value: 0.23733149845038193 and parameters: {'n_estimators': 500, 'max_features': 'log2', 'max_depth': 4}. Best is trial 239 with value: 0.23569864036836555.
[I 2023-11-04 00:03:05,793] Trial 257 finished with value: 0.23861857100150538 and parameters: {'n_estimators': 500, 'max_features': 'log2', 'max_depth': 4}. Best is trial 239 with value: 0.23569864036836555.
[I 2023-11-04 00:03:11,107] Trial 263 finished with value: 0.238875802437061 and parameters: {'n_estimators': 500, 'max_features': 'log2', 'max_depth': 4}. Best is trial 239 with value: 0.23569864036836555.
[I 2023-11-04 00:03:14,416] Trial 295 finished with value: 0.23774555605228767 and parameters: {'n_estimators': 500, 'max_features': 'log2', 'max_depth': 4}. Best is trial 239 with value: 0.23569864036836555.
[I 2023-11-04 00:03:17,720] Trial 277 finished with value: 0.23786864590960474 and parameters: {'n_estimators': 500, 'max_features': 'log2', 'max_depth': 4}. Best is trial 239 with value: 0.23569864036836555.
[I 2023-11-04 00:03:21,517] Trial 278 finished with value: 0.23751130509872856 and parameters: {'n_estimators': 500, 'max_features': 'log2', 'max_depth': 4}. Best is trial 239 with value: 0.23569864036836555.
[I 2023-11-04 00:03:25,402] Trial 280 finished with value: 0.23667253719891124 and parameters: {'n_estimators': 500, 'max_features': 'log2', 'max_depth': 4}. Best is trial 239 with value: 0.23569864036836555.
[I 2023-11-04 00:03:28,494] Trial 282 finished with value: 0.23682358314700594 and parameters: {'n_estimators': 500, 'max_features': 'log2', 'max_depth': 4}. Best is trial 239 with value: 0.23569864036836555.
[I 2023-11-04 00:03:33,089] Trial 314 finished with value: 0.23712788520096129 and parameters: {'n_estimators': 500, 'max_features': 'log2', 'max_depth': 4}. Best is trial 239 with value: 0.23569864036836555.
[I 2023-11-04 00:03:36,838] Trial 249 finished with value: 0.23778457836399394 and parameters: {'n_estimators': 500, 'max_features': 'log2', 'max_depth': 4}. Best is trial 239 with value: 0.23569864036836555.
[I 2023-11-04 00:03:39,207] Trial 250 finished with value: 0.23755991251347686 and parameters: {'n_estimators': 500, 'max_features': 'log2', 'max_depth': 4}. Best is trial 239 with value: 0.23569864036836555.
[I 2023-11-04 00:03:43,488] Trial 288 finished with value: 0.23628218144328636 and parameters: {'n_estimators': 500, 'max_features': 'log2', 'max_depth': 4}. Best is trial 239 with value: 0.23569864036836555.
[I 2023-11-04 00:03:46,611] Trial 306 finished with value: 0.23718442601773007 and parameters: {'n_estimators': 500, 'max_features': 'log2', 'max_depth': 4}. Best is trial 239 with value: 0.23569864036836555.
[I 2023-11-04 00:03:49,373] Trial 321 finished with value: 0.23765184840179454 and parameters: {'n_estimators': 500, 'max_features': 'log2', 'max_depth': 4}. Best is trial 239 with value: 0.23569864036836555.
[I 2023-11-04 00:03:52,582] Trial 266 finished with value: 0.2361599103163923 and parameters: {'n_estimators': 500, 'max_features': 'log2', 'max_depth': 4}. Best is trial 239 with value: 0.23569864036836555.
[I 2023-11-04 00:03:56,614] Trial 275 finished with value: 0.23690800438037854 and parameters: {'n_estimators': 500, 'max_features': 'log2', 'max_depth': 4}. Best is trial 239 with value: 0.23569864036836555.
[I 2023-11-04 00:03:58,445] Trial 300 finished with value: 0.2371037110385417 and parameters: {'n_estimators': 500, 'max_features': 'log2', 'max_depth': 4}. Best is trial 239 with value: 0.23569864036836555.
