[I 2023-11-04 00:04:02,045] Trial 310 finished with value: 0.23747269365586177 and parameters: {'n_estimators': 500, 'max_features': 'log2', 'max_depth': 4}. Best is trial 239 with value: 0.23569864036836555.
[I 2023-11-04 00:04:07,852] Trial 283 finished with value: 0.23864174133133295 and parameters: {'n_estimators': 500, 'max_features': 'log2', 'max_depth': 4}. Best is trial 239 with value: 0.23569864036836555.
[I 2023-11-04 00:04:10,887] Trial 315 finished with value: 0.23630737213417832 and parameters: {'n_estimators': 500, 'max_features': 'log2', 'max_depth': 4}. Best is trial 239 with value: 0.23569864036836555.
[I 2023-11-04 00:04:12,615] Trial 287 finished with value: 0.2379281268514589 and parameters: {'n_estimators': 500, 'max_features': 'log2', 'max_depth': 4}. Best is trial 239 with value: 0.23569864036836555.
[I 2023-11-04 00:04:15,143] Trial 255 finished with value: 0.23760942928276843 and parameters: {'n_estimators': 500, 'max_features': 'log2', 'max_depth': 4}. Best is trial 239 with value: 0.23569864036836555.
[I 2023-11-04 00:04:18,011] Trial 319 finished with value: 0.23705885901481993 and parameters: {'n_estimators': 500, 'max_features': 'log2', 'max_depth': 4}. Best is trial 239 with value: 0.23569864036836555.
[I 2023-11-04 00:04:20,252] Trial 320 finished with value: 0.23852954802929882 and parameters: {'n_estimators': 500, 'max_features': 'log2', 'max_depth': 4}. Best is trial 239 with value: 0.23569864036836555.
[I 2023-11-04 00:04:22,823] Trial 318 finished with value: 0.2375206678133038 and parameters: {'n_estimators': 500, 'max_features': 'log2', 'max_depth': 4}. Best is trial 239 with value: 0.23569864036836555.
[I 2023-11-04 00:04:25,108] Trial 309 finished with value: 0.23712975355125934 and parameters: {'n_estimators': 500, 'max_features': 'log2', 'max_depth': 4}. Best is trial 239 with value: 0.23569864036836555.
[I 2023-11-04 00:04:26,769] Trial 271 finished with value: 0.23827287843929426 and parameters: {'n_estimators': 500, 'max_features': 'log2', 'max_depth': 4}. Best is trial 239 with value: 0.23569864036836555.
[I 2023-11-04 00:04:28,406] Trial 294 finished with value: 0.2371043184951028 and parameters: {'n_estimators': 500, 'max_features': 'log2', 'max_depth': 4}. Best is trial 239 with value: 0.23569864036836555.
[I 2023-11-04 00:04:29,566] Trial 322 finished with value: 0.23777041172569643 and parameters: {'n_estimators': 500, 'max_features': 'log2', 'max_depth': 4}. Best is trial 239 with value: 0.23569864036836555.
[I 2023-11-04 00:04:29,581] Trial 311 finished with value: 0.2365238329546001 and parameters: {'n_estimators': 500, 'max_features': 'log2', 'max_depth': 4}. Best is trial 239 with value: 0.23569864036836555.
[I 2023-11-04 00:04:29,853] Trial 323 finished with value: 0.23710670020267757 and parameters: {'n_estimators': 500, 'max_features': 'log2', 'max_depth': 4}. Best is trial 239 with value: 0.23569864036836555.
[I 2023-11-04 00:04:30,363] Trial 301 finished with value: 0.23720474385499743 and parameters: {'n_estimators': 500, 'max_features': 'log2', 'max_depth': 4}. Best is trial 239 with value: 0.23569864036836555.
[I 2023-11-04 00:04:30,668] Trial 305 finished with value: 0.23649894422731207 and parameters: {'n_estimators': 500, 'max_features': 'log2', 'max_depth': 4}. Best is trial 239 with value: 0.23569864036836555.
[I 2023-11-04 00:04:31,479] Trial 261 finished with value: 0.2374920198623867 and parameters: {'n_estimators': 500, 'max_features': 'log2', 'max_depth': 4}. Best is trial 239 with value: 0.23569864036836555.
[I 2023-11-04 00:04:31,508] Trial 259 finished with value: 0.2367212587549052 and parameters: {'n_estimators': 500, 'max_features': 'log2', 'max_depth': 4}. Best is trial 239 with value: 0.23569864036836555.
[I 2023-11-04 00:04:32,690] Trial 317 finished with value: 0.23738425352791878 and parameters: {'n_estimators': 50, 'max_features': 'sqrt', 'max_depth': 4}. Best is trial 239 with value: 0.23569864036836555.
[I 2023-11-04 00:04:32,947] Trial 325 finished with value: 0.2372862663104949 and parameters: {'n_estimators': 50, 'max_features': 'sqrt', 'max_depth': 3}. Best is trial 239 with value: 0.23569864036836555.
[I 2023-11-04 00:04:33,058] Trial 324 finished with value: 0.2380977838744417 and parameters: {'n_estimators': 50, 'max_features': 'log2', 'max_depth': 3}. Best is trial 239 with value: 0.23569864036836555.
[I 2023-11-04 00:04:33,223] Trial 241 finished with value: 0.2367572790749789 and parameters: {'n_estimators': 50, 'max_features': 'sqrt', 'max_depth': 4}. Best is trial 239 with value: 0.23569864036836555.
[I 2023-11-04 00:04:33,353] Using an existing study with name 'ANN' instead of creating a new one.
slurmstepd: error: *** JOB 281625 ON cn451 CANCELLED AT 2023-11-04T20:10:54 DUE TO TIME LIMIT ***
