[I 2023-11-03 20:10:58,465] Using an existing study with name 'linear' instead of creating a new one.
[I 2023-11-03 20:11:05,475] Trial 344 finished with value: 0.21383534685097616 and parameters: {'alpha': 0.04111589146433165, 'l1_ratio': 0.06192252863004932}. Best is trial 275 with value: 0.19854481238349922.
[I 2023-11-03 20:11:06,062] Trial 309 finished with value: 0.2144882645950608 and parameters: {'alpha': 0.04126975013112021, 'l1_ratio': 0.711789926319002}. Best is trial 275 with value: 0.19854481238349922.
[I 2023-11-03 20:11:06,385] Trial 317 finished with value: 0.21660379805383498 and parameters: {'alpha': 0.04062318486178838, 'l1_ratio': 0.6783120030509612}. Best is trial 275 with value: 0.19854481238349922.
[I 2023-11-03 20:11:06,470] Trial 316 finished with value: 0.21157961890267007 and parameters: {'alpha': 0.05675180932034215, 'l1_ratio': 0.6948860529026024}. Best is trial 275 with value: 0.19854481238349922.
[I 2023-11-03 20:11:06,670] Trial 321 finished with value: 0.21691298910831033 and parameters: {'alpha': 0.027011038244657393, 'l1_ratio': 0.05442986117555848}. Best is trial 275 with value: 0.19854481238349922.
[I 2023-11-03 20:11:06,830] Trial 324 finished with value: 0.2100011826312255 and parameters: {'alpha': 0.02717952792138468, 'l1_ratio': 0.7040492432694129}. Best is trial 275 with value: 0.19854481238349922.
[I 2023-11-03 20:11:07,443] Trial 335 finished with value: 0.2131082377078236 and parameters: {'alpha': 0.026798165651093477, 'l1_ratio': 0.3536857427928448}. Best is trial 275 with value: 0.19854481238349922.
[I 2023-11-03 20:11:07,842] Trial 383 finished with value: 0.21428733801688005 and parameters: {'alpha': 0.026580440973919907, 'l1_ratio': 0.3242235876521819}. Best is trial 275 with value: 0.19854481238349922.
[I 2023-11-03 20:11:08,081] Trial 386 finished with value: 0.21688553835184865 and parameters: {'alpha': 0.022379159714465514, 'l1_ratio': 0.6974747219018634}. Best is trial 275 with value: 0.19854481238349922.
[I 2023-11-03 20:11:08,238] Trial 385 finished with value: 0.21546769700102866 and parameters: {'alpha': 0.027796294514403463, 'l1_ratio': 0.3404131683004611}. Best is trial 275 with value: 0.19854481238349922.
[I 2023-11-03 20:11:08,531] Trial 310 finished with value: 0.21353643724531912 and parameters: {'alpha': 0.058573855530496016, 'l1_ratio': 0.4030545374969029}. Best is trial 275 with value: 0.19854481238349922.
[I 2023-11-03 20:11:08,539] Trial 359 finished with value: 0.21832175694203515 and parameters: {'alpha': 0.02610329934851462, 'l1_ratio': 0.388654127555962}. Best is trial 275 with value: 0.19854481238349922.
[I 2023-11-03 20:11:08,556] Trial 325 finished with value: 0.21735405157681834 and parameters: {'alpha': 0.026938738796811437, 'l1_ratio': 0.5632727328115004}. Best is trial 275 with value: 0.19854481238349922.
[I 2023-11-03 20:11:08,885] Trial 319 finished with value: 0.21347321190639926 and parameters: {'alpha': 0.02715905322141704, 'l1_ratio': 0.6901157456688969}. Best is trial 275 with value: 0.19854481238349922.
[I 2023-11-03 20:11:08,885] Trial 364 finished with value: 0.21395429014461875 and parameters: {'alpha': 0.02755431545852745, 'l1_ratio': 0.7034644138479506}. Best is trial 275 with value: 0.19854481238349922.
[I 2023-11-03 20:11:08,984] Trial 370 finished with value: 0.21569983745239354 and parameters: {'alpha': 0.02664343121193655, 'l1_ratio': 0.2791386289908215}. Best is trial 275 with value: 0.19854481238349922.
[I 2023-11-03 20:11:09,182] Trial 323 finished with value: 0.2047377451236219 and parameters: {'alpha': 0.05726762362034829, 'l1_ratio': 0.7160909528386613}. Best is trial 275 with value: 0.19854481238349922.
[I 2023-11-03 20:11:09,183] Trial 311 finished with value: 0.21289098910713775 and parameters: {'alpha': 0.024245849623846502, 'l1_ratio': 0.6844628047143898}. Best is trial 275 with value: 0.19854481238349922.
[I 2023-11-03 20:11:09,217] Trial 392 finished with value: 0.20861922926750145 and parameters: {'alpha': 0.06452339364807358, 'l1_ratio': 0.35451970471060673}. Best is trial 275 with value: 0.19854481238349922.
[I 2023-11-03 20:11:09,221] Trial 330 finished with value: 0.21785213696930072 and parameters: {'alpha': 0.027784917228058592, 'l1_ratio': 0.4001209338037933}. Best is trial 275 with value: 0.19854481238349922.
[I 2023-11-03 20:11:09,236] Trial 336 finished with value: 0.21419709466157222 and parameters: {'alpha': 0.026766500030245954, 'l1_ratio': 0.7085373277660116}. Best is trial 275 with value: 0.19854481238349922.
[I 2023-11-03 20:11:09,237] Trial 376 finished with value: 0.21712748617765795 and parameters: {'alpha': 0.04094020592901621, 'l1_ratio': 0.34747419766588694}. Best is trial 275 with value: 0.19854481238349922.
[I 2023-11-03 20:11:09,258] Trial 337 finished with value: 0.20124811346074936 and parameters: {'alpha': 0.02702277879584901, 'l1_ratio': 0.7009317442332853}. Best is trial 275 with value: 0.19854481238349922.
[I 2023-11-03 20:11:09,265] Trial 340 finished with value: 0.21016506974779667 and parameters: {'alpha': 0.02328272312857352, 'l1_ratio': 0.4042225189753367}. Best is trial 275 with value: 0.19854481238349922.
[I 2023-11-03 20:11:09,266] Trial 380 finished with value: 0.20740060930564663 and parameters: {'alpha': 0.022850696014807832, 'l1_ratio': 0.3344042978045271}. Best is trial 275 with value: 0.19854481238349922.
[I 2023-11-03 20:11:09,280] Trial 369 finished with value: 0.21135321851297081 and parameters: {'alpha': 0.02269387509614517, 'l1_ratio': 0.05704490436192146}. Best is trial 275 with value: 0.19854481238349922.
[I 2023-11-03 20:11:09,282] Trial 371 finished with value: 0.21410106315632274 and parameters: {'alpha': 0.027180115471930732, 'l1_ratio': 0.023749113903399177}. Best is trial 275 with value: 0.19854481238349922.
[I 2023-11-03 20:11:09,283] Trial 329 finished with value: 0.21239930745449762 and parameters: {'alpha': 0.022627319231648374, 'l1_ratio': 0.5918933258511438}. Best is trial 275 with value: 0.19854481238349922.
[I 2023-11-03 20:11:09,457] Trial 382 finished with value: 0.21213635212151047 and parameters: {'alpha': 0.0271810992712339, 'l1_ratio': 0.004771906552879873}. Best is trial 275 with value: 0.19854481238349922.
[I 2023-11-03 20:11:09,490] Trial 343 finished with value: 0.22133570663179256 and parameters: {'alpha': 0.057214669733273056, 'l1_ratio': 0.00706238168942086}. Best is trial 275 with value: 0.19854481238349922.
[I 2023-11-03 20:11:09,518] Trial 348 finished with value: 0.21381811281057397 and parameters: {'alpha': 0.01471838736935288, 'l1_ratio': 0.8106865482339508}. Best is trial 275 with value: 0.19854481238349922.
[I 2023-11-03 20:11:09,523] Trial 346 finished with value: 0.21220395598531108 and parameters: {'alpha': 0.02799957919992589, 'l1_ratio': 0.6963977452670042}. Best is trial 275 with value: 0.19854481238349922.
[I 2023-11-03 20:11:09,526] Trial 341 finished with value: 0.21608233835003768 and parameters: {'alpha': 0.014529743817009229, 'l1_ratio': 0.5818700768354833}. Best is trial 275 with value: 0.19854481238349922.
[I 2023-11-03 20:11:09,532] Trial 394 finished with value: 0.21577733901333426 and parameters: {'alpha': 0.012433700425531515, 'l1_ratio': 0.7765230691806175}. Best is trial 275 with value: 0.19854481238349922.
[I 2023-11-03 20:11:09,533] Trial 366 finished with value: 0.21566043018610304 and parameters: {'alpha': 0.05635983197670337, 'l1_ratio': 0.7196751422303578}. Best is trial 275 with value: 0.19854481238349922.
[I 2023-11-03 20:11:09,718] Trial 354 finished with value: 0.21639516108518467 and parameters: {'alpha': 0.026012840951520434, 'l1_ratio': 0.49712198391614454}. Best is trial 275 with value: 0.19854481238349922.
[I 2023-11-03 20:11:09,732] Trial 351 finished with value: 0.21568879892559426 and parameters: {'alpha': 0.011143097116209293, 'l1_ratio': 0.49405773941229125}. Best is trial 275 with value: 0.19854481238349922.
[I 2023-11-03 20:11:09,733] Trial 308 finished with value: 0.2142277498649554 and parameters: {'alpha': 0.011934690467723377, 'l1_ratio': 0.7527116767666094}. Best is trial 275 with value: 0.19854481238349922.
[I 2023-11-03 20:11:09,739] Trial 387 finished with value: 0.20761666808140825 and parameters: {'alpha': 0.027730976256907645, 'l1_ratio': 0.7739707204115611}. Best is trial 275 with value: 0.19854481238349922.
[I 2023-11-03 20:11:09,770] Trial 388 finished with value: 0.20489357929967975 and parameters: {'alpha': 0.004020773870189828, 'l1_ratio': 0.386600205449778}. Best is trial 275 with value: 0.19854481238349922.
[I 2023-11-03 20:11:09,898] Trial 362 finished with value: 0.21163561194987465 and parameters: {'alpha': 0.059941790110663196, 'l1_ratio': 0.7740210054223432}. Best is trial 275 with value: 0.19854481238349922.
[I 2023-11-03 20:11:09,905] Trial 355 finished with value: 0.21011949063991733 and parameters: {'alpha': 0.0013901197213579686, 'l1_ratio': 0.822024718343527}. Best is trial 275 with value: 0.19854481238349922.
[I 2023-11-03 20:11:09,928] Trial 318 finished with value: 0.20531986286495477 and parameters: {'alpha': 0.030285709913228216, 'l1_ratio': 0.7528083765475329}. Best is trial 275 with value: 0.19854481238349922.
[I 2023-11-03 20:11:09,931] Trial 356 finished with value: 0.21274366130028452 and parameters: {'alpha': 0.04124503685335053, 'l1_ratio': 0.6991686794587034}. Best is trial 275 with value: 0.19854481238349922.
[I 2023-11-03 20:11:09,943] Trial 313 finished with value: 0.21278743406856718 and parameters: {'alpha': 0.041065581151752385, 'l1_ratio': 0.6352706876448375}. Best is trial 275 with value: 0.19854481238349922.
[I 2023-11-03 20:11:09,987] Trial 363 finished with value: 0.2203078243879094 and parameters: {'alpha': 0.015054435994800462, 'l1_ratio': 0.5153458365132375}. Best is trial 275 with value: 0.19854481238349922.
[I 2023-11-03 20:11:09,988] Trial 322 finished with value: 0.21347021816664472 and parameters: {'alpha': 0.0617661118713026, 'l1_ratio': 0.775884902815236}. Best is trial 275 with value: 0.19854481238349922.
[I 2023-11-03 20:11:09,999] Trial 357 finished with value: 0.21239797700535512 and parameters: {'alpha': 0.0571252106119841, 'l1_ratio': 0.05303333254572719}. Best is trial 275 with value: 0.19854481238349922.
[I 2023-11-03 20:11:10,024] Trial 358 finished with value: 0.2145488270083551 and parameters: {'alpha': 0.02815124520898785, 'l1_ratio': 0.38850530613267}. Best is trial 275 with value: 0.19854481238349922.
[I 2023-11-03 20:11:10,024] Trial 312 finished with value: 0.2134396992056028 and parameters: {'alpha': 0.027343132611108097, 'l1_ratio': 0.7759146926821441}. Best is trial 275 with value: 0.19854481238349922.
[I 2023-11-03 20:11:10,353] Trial 320 finished with value: 0.21279763129819096 and parameters: {'alpha': 0.02753121798281176, 'l1_ratio': 0.7436953082747504}. Best is trial 275 with value: 0.19854481238349922.
[I 2023-11-03 20:11:10,416] Trial 373 finished with value: 0.2090120066381648 and parameters: {'alpha': 0.03012622589893415, 'l1_ratio': 0.7688219878497922}. Best is trial 275 with value: 0.19854481238349922.
[I 2023-11-03 20:11:10,420] Trial 393 finished with value: 0.20961682017444416 and parameters: {'alpha': 0.015311485085991606, 'l1_ratio': 0.7612202643093031}. Best is trial 275 with value: 0.19854481238349922.
[I 2023-11-03 20:11:10,448] Trial 326 finished with value: 0.21599671250566901 and parameters: {'alpha': 0.062232647486106435, 'l1_ratio': 0.020836670107004962}. Best is trial 275 with value: 0.19854481238349922.
[I 2023-11-03 20:11:10,454] Trial 338 finished with value: 0.21289324790211608 and parameters: {'alpha': 0.011697672245039351, 'l1_ratio': 0.80429758848724}. Best is trial 275 with value: 0.19854481238349922.
[I 2023-11-03 20:11:10,455] Trial 365 finished with value: 0.20508868719335607 and parameters: {'alpha': 0.031189838349746625, 'l1_ratio': 0.7721626448569054}. Best is trial 275 with value: 0.19854481238349922.
[I 2023-11-03 20:11:10,456] Trial 381 finished with value: 0.220282495558942 and parameters: {'alpha': 0.05290669330148032, 'l1_ratio': 0.7355281786052588}. Best is trial 275 with value: 0.19854481238349922.
[I 2023-11-03 20:11:10,487] Trial 379 finished with value: 0.2127105690847795 and parameters: {'alpha': 0.053455853528564815, 'l1_ratio': 0.7679499925273379}. Best is trial 275 with value: 0.19854481238349922.
[I 2023-11-03 20:11:10,488] Trial 331 finished with value: 0.21668258753609324 and parameters: {'alpha': 0.015344941349920873, 'l1_ratio': 0.5394546784026182}. Best is trial 275 with value: 0.19854481238349922.
[I 2023-11-03 20:11:10,504] Trial 395 finished with value: 0.21987397783635013 and parameters: {'alpha': 0.05475610147715398, 'l1_ratio': 0.8152612490357197}. Best is trial 275 with value: 0.19854481238349922.
[I 2023-11-03 20:11:10,520] Trial 374 finished with value: 0.21141427659110776 and parameters: {'alpha': 0.014834576995953114, 'l1_ratio': 0.8077006168890172}. Best is trial 275 with value: 0.19854481238349922.
[I 2023-11-03 20:11:10,520] Trial 401 finished with value: 0.21164541178158788 and parameters: {'alpha': 0.03100912480890336, 'l1_ratio': 0.5021556607692413}. Best is trial 275 with value: 0.19854481238349922.
[I 2023-11-03 20:11:10,786] Trial 350 finished with value: 0.20854915050295905 and parameters: {'alpha': 0.01468032779960898, 'l1_ratio': 0.7784039162861845}. Best is trial 275 with value: 0.19854481238349922.
[I 2023-11-03 20:11:10,816] Trial 353 finished with value: 0.2167114004245159 and parameters: {'alpha': 0.031193388818397137, 'l1_ratio': 0.7479650217056437}. Best is trial 275 with value: 0.19854481238349922.
[I 2023-11-03 20:11:10,841] Trial 398 finished with value: 0.21560309535172384 and parameters: {'alpha': 0.0027891292415875707, 'l1_ratio': 0.7443951797651384}. Best is trial 275 with value: 0.19854481238349922.
[I 2023-11-03 20:11:10,868] Trial 361 finished with value: 0.20822991102186247 and parameters: {'alpha': 0.0525666949098227, 'l1_ratio': 0.7741759548569761}. Best is trial 275 with value: 0.19854481238349922.
[I 2023-11-03 20:11:10,877] Trial 390 finished with value: 0.21611677560849027 and parameters: {'alpha': 0.030652268031238716, 'l1_ratio': 0.5025967913920724}. Best is trial 275 with value: 0.19854481238349922.
[I 2023-11-03 20:11:10,898] Trial 368 finished with value: 0.22029426760986956 and parameters: {'alpha': 0.05385944332656861, 'l1_ratio': 0.7581581747954756}. Best is trial 275 with value: 0.19854481238349922.
[I 2023-11-03 20:11:10,924] Trial 339 finished with value: 0.21625989473922072 and parameters: {'alpha': 0.029994252728658997, 'l1_ratio': 0.7656412513248775}. Best is trial 275 with value: 0.19854481238349922.
[I 2023-11-03 20:11:10,936] Trial 360 finished with value: 0.21190270584276807 and parameters: {'alpha': 0.028462708419969396, 'l1_ratio': 0.022243963423997815}. Best is trial 275 with value: 0.19854481238349922.
[I 2023-11-03 20:11:10,950] Trial 328 finished with value: 0.21927723063282858 and parameters: {'alpha': 0.011681782285822184, 'l1_ratio': 0.7835459400410051}. Best is trial 275 with value: 0.19854481238349922.
[I 2023-11-03 20:11:10,955] Trial 389 finished with value: 0.21334485288451446 and parameters: {'alpha': 0.01209994388399832, 'l1_ratio': 0.815538823572688}. Best is trial 275 with value: 0.19854481238349922.
[I 2023-11-03 20:11:10,978] Trial 349 finished with value: 0.21228894893213746 and parameters: {'alpha': 0.02825341492029442, 'l1_ratio': 0.5598602991763473}. Best is trial 275 with value: 0.19854481238349922.
[I 2023-11-03 20:11:10,979] Trial 403 finished with value: 0.20598949472784964 and parameters: {'alpha': 0.05294608633635743, 'l1_ratio': 0.2663460441671539}. Best is trial 275 with value: 0.19854481238349922.
[I 2023-11-03 20:11:10,981] Trial 333 finished with value: 0.21450774494224023 and parameters: {'alpha': 0.030529737365394306, 'l1_ratio': 0.7668918548531259}. Best is trial 275 with value: 0.19854481238349922.
[I 2023-11-03 20:11:10,990] Trial 402 finished with value: 0.215901934949432 and parameters: {'alpha': 0.03126756626961344, 'l1_ratio': 0.7450202821574896}. Best is trial 275 with value: 0.19854481238349922.
[I 2023-11-03 20:11:10,998] Trial 378 finished with value: 0.21926254188892103 and parameters: {'alpha': 0.029846976305815627, 'l1_ratio': 0.7427121701409484}. Best is trial 275 with value: 0.19854481238349922.
[I 2023-11-03 20:11:11,019] Trial 315 finished with value: 0.21942548668481854 and parameters: {'alpha': 0.0019052575552798772, 'l1_ratio': 0.5485316357373696}. Best is trial 275 with value: 0.19854481238349922.
[I 2023-11-03 20:11:11,071] Trial 367 finished with value: 0.21361653121998558 and parameters: {'alpha': 0.035948125874989564, 'l1_ratio': 0.298079305756505}. Best is trial 275 with value: 0.19854481238349922.
[I 2023-11-03 20:11:11,086] Trial 404 finished with value: 0.2126891078279826 and parameters: {'alpha': 0.0053528523062903455, 'l1_ratio': 0.3044039992191283}. Best is trial 275 with value: 0.19854481238349922.
[I 2023-11-03 20:11:11,109] Trial 400 finished with value: 0.20920277026559927 and parameters: {'alpha': 0.031052679410789867, 'l1_ratio': 0.29548157400102437}. Best is trial 275 with value: 0.19854481238349922.
[I 2023-11-03 20:11:11,137] Trial 334 finished with value: 0.21306240274693825 and parameters: {'alpha': 0.011724487331302273, 'l1_ratio': 0.8144847546535114}. Best is trial 275 with value: 0.19854481238349922.
[I 2023-11-03 20:11:11,181] Trial 342 finished with value: 0.20965119852565264 and parameters: {'alpha': 0.022360367417454174, 'l1_ratio': 0.7779220449087231}. Best is trial 275 with value: 0.19854481238349922.
[I 2023-11-03 20:11:11,237] Trial 397 finished with value: 0.21400766240533534 and parameters: {'alpha': 0.05338149359525345, 'l1_ratio': 0.4599114330689452}. Best is trial 275 with value: 0.19854481238349922.
[I 2023-11-03 20:11:11,259] Trial 372 finished with value: 0.2084638724367451 and parameters: {'alpha': 0.008961077694775582, 'l1_ratio': 0.7487753522428215}. Best is trial 275 with value: 0.19854481238349922.
[I 2023-11-03 20:11:11,288] Trial 345 finished with value: 0.2090475048105588 and parameters: {'alpha': 0.005365544001598158, 'l1_ratio': 0.43466374432334565}. Best is trial 275 with value: 0.19854481238349922.
[I 2023-11-03 20:11:11,313] Trial 406 finished with value: 0.21493822134535293 and parameters: {'alpha': 0.035129290408098916, 'l1_ratio': 0.3023047766138583}. Best is trial 275 with value: 0.19854481238349922.
[I 2023-11-03 20:11:11,329] Trial 391 finished with value: 0.21442843609714335 and parameters: {'alpha': 0.030880054659910873, 'l1_ratio': 0.8328709245240876}. Best is trial 275 with value: 0.19854481238349922.
[I 2023-11-03 20:11:11,346] Trial 375 finished with value: 0.21092987948756362 and parameters: {'alpha': 0.035808501277123234, 'l1_ratio': 0.7246151699521653}. Best is trial 275 with value: 0.19854481238349922.
[I 2023-11-03 20:11:11,373] Trial 384 finished with value: 0.2134384238652178 and parameters: {'alpha': 0.03128582293874323, 'l1_ratio': 0.7420786518573318}. Best is trial 275 with value: 0.19854481238349922.
[I 2023-11-03 20:11:11,375] Trial 332 finished with value: 0.20978469239543504 and parameters: {'alpha': 0.005901823261245941, 'l1_ratio': 0.7950969566147817}. Best is trial 275 with value: 0.19854481238349922.
[I 2023-11-03 20:11:11,379] Trial 405 finished with value: 0.21731390561914735 and parameters: {'alpha': 0.003738413998404409, 'l1_ratio': 0.28748751855982385}. Best is trial 275 with value: 0.19854481238349922.
[I 2023-11-03 20:11:11,388] Trial 396 finished with value: 0.21152494698856564 and parameters: {'alpha': 0.009126732177602067, 'l1_ratio': 0.8313634338775966}. Best is trial 275 with value: 0.19854481238349922.
[I 2023-11-03 20:11:11,424] Trial 352 finished with value: 0.21945774621018646 and parameters: {'alpha': 0.004993135986929784, 'l1_ratio': 0.20594692549206764}. Best is trial 275 with value: 0.19854481238349922.
[I 2023-11-03 20:11:11,442] Trial 377 finished with value: 0.20935405401910942 and parameters: {'alpha': 0.0036736457363867603, 'l1_ratio': 0.278334354760438}. Best is trial 275 with value: 0.19854481238349922.
[I 2023-11-03 20:11:11,458] Trial 399 finished with value: 0.21280408100298986 and parameters: {'alpha': 0.008614856641046616, 'l1_ratio': 0.44127404834790346}. Best is trial 275 with value: 0.19854481238349922.
[I 2023-11-03 20:11:11,480] Trial 347 finished with value: 0.21604242669530835 and parameters: {'alpha': 0.007378153844924024, 'l1_ratio': 0.43219590852728956}. Best is trial 275 with value: 0.19854481238349922.
[I 2023-11-03 20:11:11,495] Trial 327 finished with value: 0.21145951698602902 and parameters: {'alpha': 0.015251831318769648, 'l1_ratio': 0.813657294271643}. Best is trial 275 with value: 0.19854481238349922.
[I 2023-11-03 20:11:11,495] Trial 314 finished with value: 0.2132141000443765 and parameters: {'alpha': 0.009309055098051666, 'l1_ratio': 0.2722043520194709}. Best is trial 275 with value: 0.19854481238349922.
[I 2023-11-03 20:11:11,536] Trial 407 finished with value: 0.2140036330416537 and parameters: {'alpha': 0.0003860192380052371, 'l1_ratio': 0.2589168615741455}. Best is trial 275 with value: 0.19854481238349922.
[I 2023-11-03 20:11:11,667] Using an existing study with name 'KRR' instead of creating a new one.
[I 2023-11-03 20:11:23,996] Trial 338 finished with value: 0.15412607971838668 and parameters: {'alpha': 0.2608142515177091, 'gamma': 6.899319068738511e-15, 'kernel': 'linear'}. Best is trial 308 with value: 0.14715496668535533.
[I 2023-11-03 20:11:24,014] Trial 346 finished with value: 0.1566193483146664 and parameters: {'alpha': 0.2719449979364275, 'gamma': 8.010691542472641e-15, 'kernel': 'linear'}. Best is trial 308 with value: 0.14715496668535533.
[I 2023-11-03 20:11:24,888] Trial 310 finished with value: 0.15957405687903417 and parameters: {'alpha': 0.25214170198856267, 'gamma': 7.915985845079265e-15, 'kernel': 'linear'}. Best is trial 308 with value: 0.14715496668535533.
