[I 2023-11-07 17:23:44,272] Trial 3 finished with value: 0.1379506776774223 and parameters: {'n_estimators': 200, 'learning_rate': 0.103276318928162, 'max_depth': 5}. Best is trial 1 with value: 0.13605880775044277.
[I 2023-11-07 17:23:44,278] Using an existing study with name 'RF' instead of creating a new one.
[I 2023-11-07 17:23:47,237] Trial 3 finished with value: 0.12743251657173568 and parameters: {'n_estimators': 200, 'max_features': 'log2', 'max_depth': 5}. Best is trial 3 with value: 0.12743251657173568.
[I 2023-11-07 17:23:47,244] Using an existing study with name 'ANN' instead of creating a new one.
[I 2023-11-07 17:23:48,893] Trial 3 finished with value: 0.25137713598912 and parameters: {'learning_rate_init': 0.08051144203495014, 'hidden_layer_sizes': [5]}. Best is trial 1 with value: 0.24416734248193808.
[I 2023-11-07 17:23:48,899] Using an existing study with name 'linear' instead of creating a new one.
[I 2023-11-07 17:23:48,952] Trial 3 finished with value: 0.2563254933592111 and parameters: {'alpha': 0.06450198467004659, 'l1_ratio': 0.36393243325776903}. Best is trial 1 with value: 0.25624895264142994.
[I 2023-11-07 17:23:48,958] Using an existing study with name 'KRR' instead of creating a new one.
[I 2023-11-07 17:23:49,887] Trial 3 finished with value: 0.24972683136737803 and parameters: {'alpha': 0.7604539465070824, 'gamma': 9.553781156884615e-15, 'kernel': 'laplacian'}. Best is trial 3 with value: 0.24972683136737803.
[I 2023-11-07 17:23:49,893] Using an existing study with name 'GB' instead of creating a new one.
[I 2023-11-07 17:23:59,657] Trial 3 finished with value: 0.24150834049494632 and parameters: {'n_estimators': 500, 'learning_rate': 0.6872092411056809, 'max_depth': 3}. Best is trial 3 with value: 0.24150834049494632.
[I 2023-11-07 17:23:59,664] Using an existing study with name 'RF' instead of creating a new one.
[I 2023-11-07 17:24:40,543] Trial 3 finished with value: 0.2379314923176887 and parameters: {'n_estimators': 20, 'max_features': 'log2', 'max_depth': 5}. Best is trial 2 with value: 0.235784747381632.
[I 2023-11-07 17:24:40,549] Using an existing study with name 'ANN' instead of creating a new one.
[I 2023-11-07 17:25:02,124] Trial 3 finished with value: 0.2943252087924609 and parameters: {'learning_rate_init': 0.09165672357485917, 'hidden_layer_sizes': [20]}. Best is trial 1 with value: 0.2924621123347735.
[I 2023-11-07 17:25:02,129] Using an existing study with name 'linear' instead of creating a new one.
[I 2023-11-07 17:25:02,164] Trial 3 finished with value: 0.3125972375263178 and parameters: {'alpha': 0.05840291436919084, 'l1_ratio': 0.21226107710884556}. Best is trial 2 with value: 0.3123010278266924.
[I 2023-11-07 17:25:02,169] Using an existing study with name 'KRR' instead of creating a new one.
[I 2023-11-07 17:25:02,222] Trial 3 finished with value: 0.34279261400939265 and parameters: {'alpha': 0.029576678731260946, 'gamma': 7.740877337734852e-15, 'kernel': 'laplacian'}. Best is trial 3 with value: 0.34279261400939265.
[I 2023-11-07 17:25:02,227] Using an existing study with name 'GB' instead of creating a new one.
[I 2023-11-07 17:25:04,089] Trial 3 finished with value: 0.2791749969975384 and parameters: {'n_estimators': 200, 'learning_rate': 0.21475691571084815, 'max_depth': 5}. Best is trial 3 with value: 0.2791749969975384.
[I 2023-11-07 17:25:04,096] Using an existing study with name 'RF' instead of creating a new one.
[I 2023-11-07 17:25:08,402] Trial 3 finished with value: 0.2817971283957954 and parameters: {'n_estimators': 20, 'max_features': 'auto', 'max_depth': 10}. Best is trial 0 with value: 0.2761349382232521.
[I 2023-11-07 17:25:08,408] Using an existing study with name 'ANN' instead of creating a new one.
[I 2023-11-07 17:25:11,663] Trial 3 finished with value: 0.337747707804619 and parameters: {'learning_rate_init': 0.03246566337420127, 'hidden_layer_sizes': [10, 10]}. Best is trial 2 with value: 0.3190149049954781.
[I 2023-11-07 17:25:11,669] Using an existing study with name 'linear' instead of creating a new one.
[I 2023-11-07 17:25:11,702] Trial 3 finished with value: 0.2109055857294363 and parameters: {'alpha': 0.0020923412059401523, 'l1_ratio': 0.1622480477206485}. Best is trial 3 with value: 0.2109055857294363.
[I 2023-11-07 17:25:11,707] Using an existing study with name 'KRR' instead of creating a new one.
[I 2023-11-07 17:25:11,743] Trial 3 finished with value: 0.22537095117352612 and parameters: {'alpha': 0.041170844793178236, 'gamma': 7.396881065056474e-15, 'kernel': 'rbf'}. Best is trial 0 with value: 0.22161596581278975.
[I 2023-11-07 17:25:11,748] Using an existing study with name 'GB' instead of creating a new one.
[I 2023-11-07 17:25:12,639] Trial 3 finished with value: 0.12436507346202648 and parameters: {'n_estimators': 20, 'learning_rate': 0.6970787942422865, 'max_depth': 2}. Best is trial 3 with value: 0.12436507346202648.
[I 2023-11-07 17:25:12,646] Using an existing study with name 'RF' instead of creating a new one.
[I 2023-11-07 17:25:14,742] Trial 3 finished with value: 0.15807346197006575 and parameters: {'n_estimators': 200, 'max_features': 'log2', 'max_depth': None}. Best is trial 2 with value: 0.1368294480595562.
[I 2023-11-07 17:25:14,748] Using an existing study with name 'ANN' instead of creating a new one.
[I 2023-11-07 17:25:15,548] Trial 3 finished with value: 3.5108689877220614 and parameters: {'learning_rate_init': 0.04789916701470101, 'hidden_layer_sizes': [20]}. Best is trial 3 with value: 3.5108689877220614.
[I 2023-11-07 17:25:15,554] Using an existing study with name 'linear' instead of creating a new one.
[I 2023-11-07 17:25:15,591] Trial 2 finished with value: 0.2549552013473186 and parameters: {'alpha': 0.05068669087064376, 'l1_ratio': 0.4235563156109209}. Best is trial 1 with value: 0.25467759149475944.
[I 2023-11-07 17:25:15,597] Using an existing study with name 'KRR' instead of creating a new one.
[I 2023-11-07 17:25:16,498] Trial 2 finished with value: 0.25109242178769203 and parameters: {'alpha': 0.8781287244916588, 'gamma': 1.930322793923681e-15, 'kernel': 'rbf'}. Best is trial 0 with value: 0.2507609665077765.
[I 2023-11-07 17:25:16,505] Using an existing study with name 'GB' instead of creating a new one.
[I 2023-11-07 17:25:23,702] Trial 2 finished with value: 0.2480989688034654 and parameters: {'n_estimators': 20, 'learning_rate': 0.9344593157515144, 'max_depth': 5}. Best is trial 0 with value: 0.24631789092936593.
[I 2023-11-07 17:25:23,709] Using an existing study with name 'RF' instead of creating a new one.
[I 2023-11-07 17:25:40,739] Trial 2 finished with value: 0.24721546132265226 and parameters: {'n_estimators': 10, 'max_features': 'log2', 'max_depth': 2}. Best is trial 1 with value: 0.2445509531198717.
[I 2023-11-07 17:25:40,745] Using an existing study with name 'ANN' instead of creating a new one.
[I 2023-11-07 17:25:53,379] Trial 2 finished with value: 0.256484572110143 and parameters: {'learning_rate_init': 0.054996888617268945, 'hidden_layer_sizes': [10, 10, 10]}. Best is trial 2 with value: 0.256484572110143.
[I 2023-11-07 17:25:53,385] Using an existing study with name 'linear' instead of creating a new one.
[I 2023-11-07 17:25:53,417] Trial 2 finished with value: 0.30944971661079856 and parameters: {'alpha': 0.07547428046985118, 'l1_ratio': 0.8868682760328718}. Best is trial 1 with value: 0.30783185529211.
[I 2023-11-07 17:25:53,423] Using an existing study with name 'KRR' instead of creating a new one.
[I 2023-11-07 17:25:53,468] Trial 2 finished with value: 0.31957325149618504 and parameters: {'alpha': 0.5693730899386199, 'gamma': 5.607698821622879e-15, 'kernel': 'rbf'}. Best is trial 1 with value: 0.3187320810627488.
[I 2023-11-07 17:25:53,473] Using an existing study with name 'GB' instead of creating a new one.
[I 2023-11-07 17:25:54,726] Trial 2 finished with value: 0.309660024546424 and parameters: {'n_estimators': 500, 'learning_rate': 0.5439734049262454, 'max_depth': 4}. Best is trial 2 with value: 0.309660024546424.
[I 2023-11-07 17:25:54,732] Using an existing study with name 'RF' instead of creating a new one.
[I 2023-11-07 17:25:57,383] Trial 2 finished with value: 0.2948505881546421 and parameters: {'n_estimators': 50, 'max_features': 'auto', 'max_depth': 10}. Best is trial 1 with value: 0.29294834929574587.
[I 2023-11-07 17:25:57,389] Using an existing study with name 'ANN' instead of creating a new one.
[I 2023-11-07 17:25:58,719] Trial 2 finished with value: 1.7380743162995156 and parameters: {'learning_rate_init': 0.07196262677479875, 'hidden_layer_sizes': [20, 20]}. Best is trial 2 with value: 1.7380743162995156.
[I 2023-11-07 17:25:58,725] Using an existing study with name 'linear' instead of creating a new one.
[I 2023-11-07 17:25:58,757] Trial 2 finished with value: 0.21483203556520095 and parameters: {'alpha': 0.09030947034997444, 'l1_ratio': 0.013383509608830613}. Best is trial 1 with value: 0.2109852727987428.
[I 2023-11-07 17:25:58,762] Using an existing study with name 'KRR' instead of creating a new one.
[I 2023-11-07 17:25:58,798] Trial 2 finished with value: 0.2188281652160634 and parameters: {'alpha': 0.5015298096476055, 'gamma': 3.0826991662375026e-15, 'kernel': 'laplacian'}. Best is trial 1 with value: 0.21366867701019673.
[I 2023-11-07 17:25:58,802] Using an existing study with name 'GB' instead of creating a new one.
[I 2023-11-07 17:25:59,692] Trial 2 finished with value: 0.13677205671927883 and parameters: {'n_estimators': 10, 'learning_rate': 0.888211806047968, 'max_depth': 3}. Best is trial 0 with value: 0.11603163221557662.
[I 2023-11-07 17:25:59,699] Using an existing study with name 'RF' instead of creating a new one.
[I 2023-11-07 17:26:01,828] Trial 2 finished with value: 0.12796977358527464 and parameters: {'n_estimators': 200, 'max_features': 'sqrt', 'max_depth': 2}. Best is trial 2 with value: 0.12796977358527464.
[I 2023-11-07 17:26:01,835] Using an existing study with name 'ANN' instead of creating a new one.
[I 2023-11-07 17:26:02,679] Trial 2 finished with value: 3.7484785679196198 and parameters: {'learning_rate_init': 0.03728825439083147, 'hidden_layer_sizes': [5, 5, 5]}. Best is trial 1 with value: 3.224885790358211.
[I 2023-11-07 17:26:02,685] Using an existing study with name 'linear' instead of creating a new one.
[I 2023-11-07 17:26:02,724] Trial 2 finished with value: 0.24676476394458202 and parameters: {'alpha': 0.05422724705112948, 'l1_ratio': 0.4522504297867146}. Best is trial 1 with value: 0.24668778803111657.
[I 2023-11-07 17:26:02,730] Using an existing study with name 'KRR' instead of creating a new one.
[I 2023-11-07 17:26:03,625] Trial 2 finished with value: 0.23924402135226486 and parameters: {'alpha': 0.4697990223956659, 'gamma': 6.663282182891718e-15, 'kernel': 'rbf'}. Best is trial 2 with value: 0.23924402135226486.
[I 2023-11-07 17:26:03,631] Using an existing study with name 'GB' instead of creating a new one.
[I 2023-11-07 17:26:10,802] Trial 2 finished with value: 0.23416174431692263 and parameters: {'n_estimators': 500, 'learning_rate': 0.8301965761927522, 'max_depth': 5}. Best is trial 2 with value: 0.23416174431692263.
[I 2023-11-07 17:26:10,810] Using an existing study with name 'RF' instead of creating a new one.
[I 2023-11-07 17:26:27,284] Trial 2 finished with value: 0.2307371956202666 and parameters: {'n_estimators': 20, 'max_features': 'auto', 'max_depth': 5}. Best is trial 2 with value: 0.2307371956202666.
[I 2023-11-07 17:26:27,292] Using an existing study with name 'ANN' instead of creating a new one.
[I 2023-11-07 17:26:39,517] Trial 2 finished with value: 0.24328057856179033 and parameters: {'learning_rate_init': 0.02547761823900306, 'hidden_layer_sizes': [20]}. Best is trial 2 with value: 0.24328057856179033.
[I 2023-11-07 17:26:39,523] Using an existing study with name 'linear' instead of creating a new one.
[I 2023-11-07 17:26:39,556] Trial 2 finished with value: 0.2719044931371943 and parameters: {'alpha': 0.06816651856847575, 'l1_ratio': 0.7544507450868265}. Best is trial 2 with value: 0.2719044931371943.
[I 2023-11-07 17:26:39,561] Using an existing study with name 'KRR' instead of creating a new one.
[I 2023-11-07 17:26:39,606] Trial 2 finished with value: 0.2842591652798105 and parameters: {'alpha': 0.6018604142332976, 'gamma': 3.901692847953123e-15, 'kernel': 'linear'}. Best is trial 2 with value: 0.2842591652798105.
[I 2023-11-07 17:26:39,612] Using an existing study with name 'GB' instead of creating a new one.
[I 2023-11-07 17:26:40,880] Trial 2 finished with value: 0.2658011958114949 and parameters: {'n_estimators': 50, 'learning_rate': 0.8502571991596889, 'max_depth': 4}. Best is trial 0 with value: 0.2649217640348484.
[I 2023-11-07 17:26:40,887] Using an existing study with name 'RF' instead of creating a new one.
[I 2023-11-07 17:26:43,442] Trial 2 finished with value: 0.255378300724355 and parameters: {'n_estimators': 20, 'max_features': 'log2', 'max_depth': 4}. Best is trial 2 with value: 0.255378300724355.
[I 2023-11-07 17:26:43,448] Using an existing study with name 'ANN' instead of creating a new one.
[I 2023-11-07 17:26:44,353] Trial 2 finished with value: 2.4017917405157045 and parameters: {'learning_rate_init': 0.044743515658819843, 'hidden_layer_sizes': [20, 20]}. Best is trial 1 with value: 1.8319872272029258.
[I 2023-11-07 17:26:44,359] Using an existing study with name 'linear' instead of creating a new one.
[I 2023-11-07 17:26:44,394] Trial 2 finished with value: 0.12599654780695166 and parameters: {'alpha': 0.0672019478821568, 'l1_ratio': 0.7329557851410814}. Best is trial 0 with value: 0.1256588047315301.
[I 2023-11-07 17:26:44,400] Using an existing study with name 'KRR' instead of creating a new one.
[I 2023-11-07 17:26:44,441] Trial 2 finished with value: 0.12647447384769736 and parameters: {'alpha': 0.11581073353662395, 'gamma': 3.0912898350191774e-15, 'kernel': 'linear'}. Best is trial 0 with value: 0.12615569502793386.
[I 2023-11-07 17:26:44,447] Using an existing study with name 'GB' instead of creating a new one.
[I 2023-11-07 17:26:45,350] Trial 2 finished with value: 0.1341859578008293 and parameters: {'n_estimators': 500, 'learning_rate': 0.9027097821706986, 'max_depth': 2}. Best is trial 2 with value: 0.1341859578008293.
[I 2023-11-07 17:26:45,358] Using an existing study with name 'RF' instead of creating a new one.
[I 2023-11-07 17:26:47,503] Trial 2 finished with value: 0.12788525672164364 and parameters: {'n_estimators': 20, 'max_features': 'auto', 'max_depth': 3}. Best is trial 2 with value: 0.12788525672164364.
[I 2023-11-07 17:26:47,510] Using an existing study with name 'ANN' instead of creating a new one.
[I 2023-11-07 17:26:48,440] Trial 2 finished with value: 5.047635967988825 and parameters: {'learning_rate_init': 0.015626465267408008, 'hidden_layer_sizes': [10, 10]}. Best is trial 1 with value: 3.0110506383483333.
[I 2023-11-07 17:26:48,446] Using an existing study with name 'linear' instead of creating a new one.
[I 2023-11-07 17:26:48,481] Trial 2 finished with value: 0.25403816429663606 and parameters: {'alpha': 0.07813036226912909, 'l1_ratio': 0.007795919047932087}. Best is trial 2 with value: 0.25403816429663606.
[I 2023-11-07 17:26:48,487] Using an existing study with name 'KRR' instead of creating a new one.
[I 2023-11-07 17:26:49,349] Trial 2 finished with value: 0.25015149365447426 and parameters: {'alpha': 0.33253571277231586, 'gamma': 4.29188624612981e-15, 'kernel': 'laplacian'}. Best is trial 0 with value: 0.24991403801892834.
[I 2023-11-07 17:26:49,355] Using an existing study with name 'GB' instead of creating a new one.
[I 2023-11-07 17:26:56,554] Trial 2 finished with value: 0.2474531746381172 and parameters: {'n_estimators': 200, 'learning_rate': 0.9541977913550788, 'max_depth': 4}. Best is trial 0 with value: 0.24672625219284874.
[I 2023-11-07 17:26:56,561] Using an existing study with name 'RF' instead of creating a new one.
[I 2023-11-07 17:27:13,441] Trial 2 finished with value: 0.2448503886733512 and parameters: {'n_estimators': 10, 'max_features': 'log2', 'max_depth': 3}. Best is trial 2 with value: 0.2448503886733512.
[I 2023-11-07 17:27:13,448] Using an existing study with name 'ANN' instead of creating a new one.
[I 2023-11-07 17:27:26,945] Trial 2 finished with value: 0.2606811587256888 and parameters: {'learning_rate_init': 0.06637591263804488, 'hidden_layer_sizes': [50, 50, 50]}. Best is trial 0 with value: 0.25923632429646043.
[I 2023-11-07 17:27:26,951] Using an existing study with name 'linear' instead of creating a new one.
[I 2023-11-07 17:27:26,984] Trial 2 finished with value: 0.30743025567346605 and parameters: {'alpha': 0.08427631044709506, 'l1_ratio': 0.8767073161656561}. Best is trial 0 with value: 0.3069047936495366.
[I 2023-11-07 17:27:26,989] Using an existing study with name 'KRR' instead of creating a new one.
[I 2023-11-07 17:27:27,034] Trial 2 finished with value: 0.31081813887420157 and parameters: {'alpha': 0.5940649226898713, 'gamma': 3.041756008807317e-15, 'kernel': 'linear'}. Best is trial 2 with value: 0.31081813887420157.
[I 2023-11-07 17:27:27,040] Using an existing study with name 'GB' instead of creating a new one.
[I 2023-11-07 17:27:28,295] Trial 2 finished with value: 0.32069714246314307 and parameters: {'n_estimators': 20, 'learning_rate': 0.2870940260320847, 'max_depth': 3}. Best is trial 1 with value: 0.31702193814557766.
[I 2023-11-07 17:27:28,301] Using an existing study with name 'RF' instead of creating a new one.
[I 2023-11-07 17:27:30,966] Trial 2 finished with value: 0.29036943204607796 and parameters: {'n_estimators': 200, 'max_features': 'sqrt', 'max_depth': 3}. Best is trial 2 with value: 0.29036943204607796.
[I 2023-11-07 17:27:30,972] Using an existing study with name 'ANN' instead of creating a new one.
[I 2023-11-07 17:27:32,256] Trial 2 finished with value: 2.3456383347835206 and parameters: {'learning_rate_init': 0.0380403542614305, 'hidden_layer_sizes': [20]}. Best is trial 1 with value: 1.639642688866486.
[I 2023-11-07 17:27:32,262] Using an existing study with name 'linear' instead of creating a new one.
[I 2023-11-07 17:27:32,323] Trial 9 finished with value: 0.21853137214690296 and parameters: {'alpha': 0.015111426707178027, 'l1_ratio': 0.004437130892484764}. Best is trial 5 with value: 0.21049608409845244.
[I 2023-11-07 17:27:32,329] Using an existing study with name 'KRR' instead of creating a new one.
[I 2023-11-07 17:27:32,399] Trial 9 finished with value: 0.16619900581434527 and parameters: {'alpha': 0.005968157541237294, 'gamma': 7.816263289054134e-15, 'kernel': 'rbf'}. Best is trial 3 with value: 0.14792048671299554.
[I 2023-11-07 17:27:32,405] Using an existing study with name 'GB' instead of creating a new one.
[I 2023-11-07 17:27:33,743] Trial 9 finished with value: 0.1715427111245976 and parameters: {'n_estimators': 10, 'learning_rate': 0.6457947456501746, 'max_depth': 1}. Best is trial 5 with value: 0.15790287215256196.
[I 2023-11-07 17:27:33,751] Using an existing study with name 'RF' instead of creating a new one.
[I 2023-11-07 17:27:36,707] Trial 9 finished with value: 0.1800484989961424 and parameters: {'n_estimators': 500, 'max_features': 'log2', 'max_depth': 2}. Best is trial 8 with value: 0.15512200448801797.
[I 2023-11-07 17:27:36,714] Using an existing study with name 'ANN' instead of creating a new one.
[I 2023-11-07 17:27:38,368] Trial 9 finished with value: 0.2576631518462226 and parameters: {'learning_rate_init': 0.06410220273116844, 'hidden_layer_sizes': [5, 5, 5]}. Best is trial 3 with value: 0.2218633477001349.
[I 2023-11-07 17:27:38,374] Using an existing study with name 'linear' instead of creating a new one.
[I 2023-11-07 17:27:38,429] Trial 9 finished with value: 0.256976882606041 and parameters: {'alpha': 0.011031411925434586, 'l1_ratio': 0.23329430752419522}. Best is trial 4 with value: 0.25691167822082345.
[I 2023-11-07 17:27:38,435] Using an existing study with name 'KRR' instead of creating a new one.
[I 2023-11-07 17:27:39,388] Trial 9 finished with value: 0.2510525277240572 and parameters: {'alpha': 0.16724642813786772, 'gamma': 7.076526300697528e-15, 'kernel': 'linear'}. Best is trial 6 with value: 0.2495241394316322.
[I 2023-11-07 17:27:39,394] Using an existing study with name 'GB' instead of creating a new one.
[I 2023-11-07 17:27:49,256] Trial 9 finished with value: 0.24136690874115585 and parameters: {'n_estimators': 200, 'learning_rate': 0.951098992189018, 'max_depth': 5}. Best is trial 9 with value: 0.24136690874115585.
[I 2023-11-07 17:27:49,264] Using an existing study with name 'RF' instead of creating a new one.
[I 2023-11-07 17:28:30,280] Trial 9 finished with value: 0.236473355256171 and parameters: {'n_estimators': 20, 'max_features': 'sqrt', 'max_depth': 10}. Best is trial 8 with value: 0.2362615796115605.
[I 2023-11-07 17:28:30,287] Using an existing study with name 'ANN' instead of creating a new one.
[I 2023-11-07 17:28:54,203] Trial 4 finished with value: 0.2943920081995693 and parameters: {'learning_rate_init': 0.07045059893723951, 'hidden_layer_sizes': [10]}. Best is trial 0 with value: 0.28963630595478557.
[I 2023-11-07 17:28:54,211] Using an existing study with name 'linear' instead of creating a new one.
[I 2023-11-07 17:28:54,246] Trial 4 finished with value: 0.31652472416870187 and parameters: {'alpha': 0.00501474991443742, 'l1_ratio': 0.5240346624470515}. Best is trial 4 with value: 0.31652472416870187.
[I 2023-11-07 17:28:54,253] Using an existing study with name 'KRR' instead of creating a new one.
[I 2023-11-07 17:28:54,316] Trial 4 finished with value: 0.2937206064288087 and parameters: {'alpha': 0.7497691157090122, 'gamma': 5.553737844598385e-15, 'kernel': 'laplacian'}. Best is trial 4 with value: 0.2937206064288087.
[I 2023-11-07 17:28:54,323] Using an existing study with name 'GB' instead of creating a new one.
