[I 2023-11-07 17:18:35,969] Trial 1 finished with value: 0.24735492737859097 and parameters: {'n_estimators': 500, 'learning_rate': 0.9681628533353072, 'max_depth': 2}. Best is trial 0 with value: 0.24631789092936593.
[I 2023-11-07 17:18:35,976] Using an existing study with name 'RF' instead of creating a new one.
[I 2023-11-07 17:18:53,071] Trial 1 finished with value: 0.2445509531198717 and parameters: {'n_estimators': 10, 'max_features': 'log2', 'max_depth': 4}. Best is trial 1 with value: 0.2445509531198717.
[I 2023-11-07 17:18:53,077] Using an existing study with name 'ANN' instead of creating a new one.
[I 2023-11-07 17:19:04,504] Trial 1 finished with value: 0.2674931870713224 and parameters: {'learning_rate_init': 0.0510159007960355, 'hidden_layer_sizes': [50, 50, 50]}. Best is trial 0 with value: 0.2644675508221352.
[I 2023-11-07 17:19:04,509] Using an existing study with name 'linear' instead of creating a new one.
[I 2023-11-07 17:19:04,542] Trial 1 finished with value: 0.30783185529211 and parameters: {'alpha': 0.0820958620627756, 'l1_ratio': 0.34039746924413505}. Best is trial 1 with value: 0.30783185529211.
[I 2023-11-07 17:19:04,547] Using an existing study with name 'KRR' instead of creating a new one.
[I 2023-11-07 17:19:04,591] Trial 1 finished with value: 0.3187320810627488 and parameters: {'alpha': 0.13963565725179944, 'gamma': 2.550459444877071e-15, 'kernel': 'rbf'}. Best is trial 1 with value: 0.3187320810627488.
[I 2023-11-07 17:19:04,596] Using an existing study with name 'GB' instead of creating a new one.
[I 2023-11-07 17:19:05,839] Trial 1 finished with value: 0.32300502195910946 and parameters: {'n_estimators': 200, 'learning_rate': 0.4669208421515074, 'max_depth': 3}. Best is trial 0 with value: 0.3169929810497198.
[I 2023-11-07 17:19:05,846] Using an existing study with name 'RF' instead of creating a new one.
[I 2023-11-07 17:19:08,468] Trial 1 finished with value: 0.29294834929574587 and parameters: {'n_estimators': 50, 'max_features': 'sqrt', 'max_depth': 4}. Best is trial 1 with value: 0.29294834929574587.
[I 2023-11-07 17:19:08,474] Using an existing study with name 'ANN' instead of creating a new one.
[I 2023-11-07 17:19:09,693] Trial 1 finished with value: 1.8815188902624185 and parameters: {'learning_rate_init': 0.07027965462967402, 'hidden_layer_sizes': [20]}. Best is trial 1 with value: 1.8815188902624185.
[I 2023-11-07 17:19:09,699] Using an existing study with name 'linear' instead of creating a new one.
[I 2023-11-07 17:19:09,733] Trial 1 finished with value: 0.2109852727987428 and parameters: {'alpha': 0.04401414941785595, 'l1_ratio': 0.2907339073706877}. Best is trial 1 with value: 0.2109852727987428.
[I 2023-11-07 17:19:09,737] Using an existing study with name 'KRR' instead of creating a new one.
[I 2023-11-07 17:19:09,775] Trial 1 finished with value: 0.21366867701019673 and parameters: {'alpha': 0.3318736691969781, 'gamma': 1.3629203401962453e-15, 'kernel': 'linear'}. Best is trial 1 with value: 0.21366867701019673.
[I 2023-11-07 17:19:09,779] Using an existing study with name 'GB' instead of creating a new one.
[I 2023-11-07 17:19:10,670] Trial 1 finished with value: 0.13987108448077834 and parameters: {'n_estimators': 10, 'learning_rate': 0.8250983160233463, 'max_depth': 3}. Best is trial 0 with value: 0.11603163221557662.
[I 2023-11-07 17:19:10,677] Using an existing study with name 'RF' instead of creating a new one.
[I 2023-11-07 17:19:12,779] Trial 1 finished with value: 0.15728733949029228 and parameters: {'n_estimators': 500, 'max_features': 'sqrt', 'max_depth': None}. Best is trial 0 with value: 0.13688549824105645.
[I 2023-11-07 17:19:12,784] Using an existing study with name 'ANN' instead of creating a new one.
[I 2023-11-07 17:19:13,635] Trial 1 finished with value: 3.224885790358211 and parameters: {'learning_rate_init': 0.03913783263260356, 'hidden_layer_sizes': [5, 5]}. Best is trial 1 with value: 3.224885790358211.
[I 2023-11-07 17:19:13,640] Using an existing study with name 'linear' instead of creating a new one.
[I 2023-11-07 17:19:13,675] Trial 1 finished with value: 0.24668778803111657 and parameters: {'alpha': 0.03960147856782637, 'l1_ratio': 0.7918801080585901}. Best is trial 1 with value: 0.24668778803111657.
[I 2023-11-07 17:19:13,679] Using an existing study with name 'KRR' instead of creating a new one.
[I 2023-11-07 17:19:14,534] Trial 1 finished with value: 0.23938490568729842 and parameters: {'alpha': 0.3695299657040467, 'gamma': 8.972493000392623e-16, 'kernel': 'laplacian'}. Best is trial 1 with value: 0.23938490568729842.
[I 2023-11-07 17:19:14,539] Using an existing study with name 'GB' instead of creating a new one.
[I 2023-11-07 17:19:21,716] Trial 1 finished with value: 0.23425116610472582 and parameters: {'n_estimators': 500, 'learning_rate': 0.9543862491901232, 'max_depth': 2}. Best is trial 1 with value: 0.23425116610472582.
[I 2023-11-07 17:19:21,722] Using an existing study with name 'RF' instead of creating a new one.
[I 2023-11-07 17:19:38,308] Trial 1 finished with value: 0.2313550731384131 and parameters: {'n_estimators': 10, 'max_features': 'auto', 'max_depth': 4}. Best is trial 0 with value: 0.23119801221647754.
[I 2023-11-07 17:19:38,314] Using an existing study with name 'ANN' instead of creating a new one.
[I 2023-11-07 17:19:50,044] Trial 1 finished with value: 0.25151842762876203 and parameters: {'learning_rate_init': 0.060908382304767014, 'hidden_layer_sizes': [10]}. Best is trial 1 with value: 0.25151842762876203.
[I 2023-11-07 17:19:50,049] Using an existing study with name 'linear' instead of creating a new one.
[I 2023-11-07 17:19:50,081] Trial 1 finished with value: 0.27245125301385187 and parameters: {'alpha': 0.038224654878455416, 'l1_ratio': 0.6025916051487967}. Best is trial 1 with value: 0.27245125301385187.
[I 2023-11-07 17:19:50,085] Using an existing study with name 'KRR' instead of creating a new one.
[I 2023-11-07 17:19:50,130] Trial 1 finished with value: 0.2854201908520014 and parameters: {'alpha': 0.03314848021093012, 'gamma': 1.834373316003798e-15, 'kernel': 'linear'}. Best is trial 0 with value: 0.2846020229110214.
[I 2023-11-07 17:19:50,135] Using an existing study with name 'GB' instead of creating a new one.
[I 2023-11-07 17:19:51,380] Trial 1 finished with value: 0.2788877107358625 and parameters: {'n_estimators': 50, 'learning_rate': 0.14158215254700135, 'max_depth': 4}. Best is trial 0 with value: 0.2649217640348484.
[I 2023-11-07 17:19:51,387] Using an existing study with name 'RF' instead of creating a new one.
[I 2023-11-07 17:19:53,930] Trial 1 finished with value: 0.25769169366344286 and parameters: {'n_estimators': 500, 'max_features': 'auto', 'max_depth': 3}. Best is trial 1 with value: 0.25769169366344286.
[I 2023-11-07 17:19:53,936] Using an existing study with name 'ANN' instead of creating a new one.
[I 2023-11-07 17:19:55,159] Trial 1 finished with value: 1.8319872272029258 and parameters: {'learning_rate_init': 0.08612875522165955, 'hidden_layer_sizes': [20]}. Best is trial 1 with value: 1.8319872272029258.
[I 2023-11-07 17:19:55,163] Using an existing study with name 'linear' instead of creating a new one.
[I 2023-11-07 17:19:55,210] Trial 1 finished with value: 0.1259228107709839 and parameters: {'alpha': 0.09207219116050044, 'l1_ratio': 0.8778660727078519}. Best is trial 0 with value: 0.1256588047315301.
[I 2023-11-07 17:19:55,215] Using an existing study with name 'KRR' instead of creating a new one.
[I 2023-11-07 17:19:55,280] Trial 1 finished with value: 0.1275965418769797 and parameters: {'alpha': 0.9650755178707234, 'gamma': 9.484670679164959e-15, 'kernel': 'linear'}. Best is trial 0 with value: 0.12615569502793386.
[I 2023-11-07 17:19:55,285] Using an existing study with name 'GB' instead of creating a new one.
[I 2023-11-07 17:19:56,228] Trial 1 finished with value: 0.13850647819036657 and parameters: {'n_estimators': 20, 'learning_rate': 0.7423493801249397, 'max_depth': 5}. Best is trial 1 with value: 0.13850647819036657.
[I 2023-11-07 17:19:56,234] Using an existing study with name 'RF' instead of creating a new one.
[I 2023-11-07 17:19:58,360] Trial 1 finished with value: 0.13174026857100374 and parameters: {'n_estimators': 200, 'max_features': 'log2', 'max_depth': 2}. Best is trial 1 with value: 0.13174026857100374.
[I 2023-11-07 17:19:58,365] Using an existing study with name 'ANN' instead of creating a new one.
[I 2023-11-07 17:19:59,135] Trial 1 finished with value: 3.0110506383483333 and parameters: {'learning_rate_init': 0.07001152361681061, 'hidden_layer_sizes': [20, 20]}. Best is trial 1 with value: 3.0110506383483333.
[I 2023-11-07 17:19:59,140] Using an existing study with name 'linear' instead of creating a new one.
[I 2023-11-07 17:19:59,175] Trial 1 finished with value: 0.2542608769681404 and parameters: {'alpha': 0.048765125335318016, 'l1_ratio': 0.43796972152932967}. Best is trial 0 with value: 0.25409762860855256.
[I 2023-11-07 17:19:59,179] Using an existing study with name 'KRR' instead of creating a new one.
[I 2023-11-07 17:20:00,027] Trial 1 finished with value: 0.2501594990875768 and parameters: {'alpha': 0.5495141186336086, 'gamma': 1.5186774917822509e-15, 'kernel': 'linear'}. Best is trial 0 with value: 0.24991403801892834.
[I 2023-11-07 17:20:00,032] Using an existing study with name 'GB' instead of creating a new one.
[I 2023-11-07 17:20:07,278] Trial 1 finished with value: 0.2472876120573936 and parameters: {'n_estimators': 500, 'learning_rate': 0.5665454316153853, 'max_depth': 4}. Best is trial 0 with value: 0.24672625219284874.
[I 2023-11-07 17:20:07,285] Using an existing study with name 'RF' instead of creating a new one.
[I 2023-11-07 17:20:24,161] Trial 1 finished with value: 0.24656328567240463 and parameters: {'n_estimators': 50, 'max_features': 'auto', 'max_depth': 10}. Best is trial 0 with value: 0.24633720031744843.
[I 2023-11-07 17:20:24,167] Using an existing study with name 'ANN' instead of creating a new one.
[I 2023-11-07 17:20:37,115] Trial 1 finished with value: 0.26215355921092215 and parameters: {'learning_rate_init': 0.036551584005610434, 'hidden_layer_sizes': [5]}. Best is trial 0 with value: 0.25923632429646043.
[I 2023-11-07 17:20:37,120] Using an existing study with name 'linear' instead of creating a new one.
[I 2023-11-07 17:20:37,157] Trial 1 finished with value: 0.3074872570942636 and parameters: {'alpha': 0.013433991380932625, 'l1_ratio': 0.10770453265657365}. Best is trial 0 with value: 0.3069047936495366.
[I 2023-11-07 17:20:37,161] Using an existing study with name 'KRR' instead of creating a new one.
[I 2023-11-07 17:20:37,211] Trial 1 finished with value: 0.31332218527644823 and parameters: {'alpha': 0.5495772753617841, 'gamma': 1.706033677562393e-15, 'kernel': 'linear'}. Best is trial 1 with value: 0.31332218527644823.
[I 2023-11-07 17:20:37,216] Using an existing study with name 'GB' instead of creating a new one.
[I 2023-11-07 17:20:38,470] Trial 1 finished with value: 0.31702193814557766 and parameters: {'n_estimators': 10, 'learning_rate': 0.5167371350565503, 'max_depth': 5}. Best is trial 1 with value: 0.31702193814557766.
[I 2023-11-07 17:20:38,477] Using an existing study with name 'RF' instead of creating a new one.
[I 2023-11-07 17:20:41,130] Trial 1 finished with value: 0.29491253509311866 and parameters: {'n_estimators': 200, 'max_features': 'auto', 'max_depth': 4}. Best is trial 0 with value: 0.29394151500954263.
[I 2023-11-07 17:20:41,135] Using an existing study with name 'ANN' instead of creating a new one.
[I 2023-11-07 17:20:42,329] Trial 1 finished with value: 1.639642688866486 and parameters: {'learning_rate_init': 0.008966401955787143, 'hidden_layer_sizes': [5, 5]}. Best is trial 1 with value: 1.639642688866486.
[I 2023-11-07 17:20:42,334] Using an existing study with name 'linear' instead of creating a new one.
[I 2023-11-07 17:20:42,367] Trial 8 finished with value: 0.21367651026983644 and parameters: {'alpha': 0.030757274495679644, 'l1_ratio': 0.1636826366101618}. Best is trial 5 with value: 0.21049608409845244.
[I 2023-11-07 17:20:42,373] Using an existing study with name 'KRR' instead of creating a new one.
[I 2023-11-07 17:20:42,411] Trial 8 finished with value: 0.1563849799984656 and parameters: {'alpha': 0.24034005752406398, 'gamma': 9.508692151348445e-15, 'kernel': 'linear'}. Best is trial 3 with value: 0.14792048671299554.
[I 2023-11-07 17:20:42,417] Using an existing study with name 'GB' instead of creating a new one.
[I 2023-11-07 17:20:43,719] Trial 8 finished with value: 0.19631377362537894 and parameters: {'n_estimators': 500, 'learning_rate': 0.059942902320551134, 'max_depth': 2}. Best is trial 5 with value: 0.15790287215256196.
[I 2023-11-07 17:20:43,728] Using an existing study with name 'RF' instead of creating a new one.
[I 2023-11-07 17:20:46,697] Trial 8 finished with value: 0.15512200448801797 and parameters: {'n_estimators': 50, 'max_features': 'sqrt', 'max_depth': 10}. Best is trial 8 with value: 0.15512200448801797.
[I 2023-11-07 17:20:46,704] Using an existing study with name 'ANN' instead of creating a new one.
[I 2023-11-07 17:20:48,161] Trial 8 finished with value: 0.2441936908083492 and parameters: {'learning_rate_init': 0.05717802518442135, 'hidden_layer_sizes': [5, 5, 5]}. Best is trial 3 with value: 0.2218633477001349.
[I 2023-11-07 17:20:48,168] Using an existing study with name 'linear' instead of creating a new one.
[I 2023-11-07 17:20:48,223] Trial 8 finished with value: 0.25701498466225 and parameters: {'alpha': 0.06631634335802718, 'l1_ratio': 0.494630745955853}. Best is trial 4 with value: 0.25691167822082345.
[I 2023-11-07 17:20:48,230] Using an existing study with name 'KRR' instead of creating a new one.
[I 2023-11-07 17:20:49,263] Trial 8 finished with value: 0.25067868000303 and parameters: {'alpha': 0.8422270835100318, 'gamma': 3.692406149456366e-15, 'kernel': 'linear'}. Best is trial 6 with value: 0.2495241394316322.
[I 2023-11-07 17:20:49,273] Using an existing study with name 'GB' instead of creating a new one.
[I 2023-11-07 17:20:59,081] Trial 8 finished with value: 0.24394933720728387 and parameters: {'n_estimators': 500, 'learning_rate': 0.47734672232916586, 'max_depth': 2}. Best is trial 5 with value: 0.24268398989185572.
[I 2023-11-07 17:20:59,089] Using an existing study with name 'RF' instead of creating a new one.
[I 2023-11-07 17:21:40,093] Trial 8 finished with value: 0.2362615796115605 and parameters: {'n_estimators': 200, 'max_features': 'sqrt', 'max_depth': None}. Best is trial 8 with value: 0.2362615796115605.
[I 2023-11-07 17:21:40,099] Using an existing study with name 'ANN' instead of creating a new one.
[I 2023-11-07 17:22:03,397] Trial 3 finished with value: 0.2927437231109287 and parameters: {'learning_rate_init': 0.039559542803567195, 'hidden_layer_sizes': [20]}. Best is trial 0 with value: 0.28963630595478557.
[I 2023-11-07 17:22:03,403] Using an existing study with name 'linear' instead of creating a new one.
[I 2023-11-07 17:22:03,438] Trial 3 finished with value: 0.3169590804164358 and parameters: {'alpha': 0.09548497963501394, 'l1_ratio': 0.6241458949031262}. Best is trial 3 with value: 0.3169590804164358.
[I 2023-11-07 17:22:03,446] Using an existing study with name 'KRR' instead of creating a new one.
[I 2023-11-07 17:22:03,503] Trial 3 finished with value: 0.3191570831976529 and parameters: {'alpha': 0.44541974209978885, 'gamma': 6.124605165135666e-16, 'kernel': 'rbf'}. Best is trial 1 with value: 0.2972821705184329.
[I 2023-11-07 17:22:03,509] Using an existing study with name 'GB' instead of creating a new one.
[I 2023-11-07 17:22:05,368] Trial 3 finished with value: 0.2803529956581113 and parameters: {'n_estimators': 10, 'learning_rate': 0.28419362172932267, 'max_depth': 4}. Best is trial 1 with value: 0.2673906455658081.
[I 2023-11-07 17:22:05,375] Using an existing study with name 'RF' instead of creating a new one.
[I 2023-11-07 17:22:09,602] Trial 3 finished with value: 0.27569302595932627 and parameters: {'n_estimators': 200, 'max_features': 'auto', 'max_depth': 2}. Best is trial 0 with value: 0.2677642292700792.
[I 2023-11-07 17:22:09,609] Using an existing study with name 'ANN' instead of creating a new one.
[I 2023-11-07 17:22:13,661] Trial 3 finished with value: 0.30921506461333975 and parameters: {'learning_rate_init': 0.03865275041868066, 'hidden_layer_sizes': [10]}. Best is trial 3 with value: 0.30921506461333975.
[I 2023-11-07 17:22:13,667] Using an existing study with name 'linear' instead of creating a new one.
[I 2023-11-07 17:22:13,707] Trial 3 finished with value: 0.21357779308933156 and parameters: {'alpha': 0.0714225337942749, 'l1_ratio': 0.0050353378603426036}. Best is trial 1 with value: 0.21187289129156708.
[I 2023-11-07 17:22:13,712] Using an existing study with name 'KRR' instead of creating a new one.
[I 2023-11-07 17:22:13,758] Trial 3 finished with value: 0.1499490663807542 and parameters: {'alpha': 0.5227010265440184, 'gamma': 5.1992037533728796e-15, 'kernel': 'rbf'}. Best is trial 2 with value: 0.13967776073074545.
[I 2023-11-07 17:22:13,763] Using an existing study with name 'GB' instead of creating a new one.
[I 2023-11-07 17:22:15,048] Trial 3 finished with value: 0.11390374404191177 and parameters: {'n_estimators': 20, 'learning_rate': 0.5972433366982403, 'max_depth': 2}. Best is trial 0 with value: 0.10324836117333373.
[I 2023-11-07 17:22:15,055] Using an existing study with name 'RF' instead of creating a new one.
[I 2023-11-07 17:22:18,006] Trial 3 finished with value: 0.13878426983142023 and parameters: {'n_estimators': 200, 'max_features': 'auto', 'max_depth': 3}. Best is trial 1 with value: 0.13033864323678376.
[I 2023-11-07 17:22:18,012] Using an existing study with name 'ANN' instead of creating a new one.
[I 2023-11-07 17:22:19,866] Trial 3 finished with value: 0.26714979546455897 and parameters: {'learning_rate_init': 0.08876864822649215, 'hidden_layer_sizes': [5]}. Best is trial 0 with value: 0.2465075969227216.
[I 2023-11-07 17:22:19,871] Using an existing study with name 'linear' instead of creating a new one.
[I 2023-11-07 17:22:19,925] Trial 3 finished with value: 0.2474879832963269 and parameters: {'alpha': 0.024313083493599764, 'l1_ratio': 0.44883625945029526}. Best is trial 3 with value: 0.2474879832963269.
[I 2023-11-07 17:22:19,930] Using an existing study with name 'KRR' instead of creating a new one.
[I 2023-11-07 17:22:20,874] Trial 3 finished with value: 0.236574120133208 and parameters: {'alpha': 0.8552298171546997, 'gamma': 4.372778116024003e-15, 'kernel': 'linear'}. Best is trial 0 with value: 0.23575721399277358.
[I 2023-11-07 17:22:20,880] Using an existing study with name 'GB' instead of creating a new one.
[I 2023-11-07 17:22:30,643] Trial 3 finished with value: 0.22742705983884107 and parameters: {'n_estimators': 50, 'learning_rate': 0.2599196986593448, 'max_depth': 5}. Best is trial 1 with value: 0.2253864094793028.
[I 2023-11-07 17:22:30,650] Using an existing study with name 'RF' instead of creating a new one.
[I 2023-11-07 17:23:11,054] Trial 3 finished with value: 0.21942831164023935 and parameters: {'n_estimators': 20, 'max_features': 'auto', 'max_depth': 2}. Best is trial 0 with value: 0.21890862037935035.
[I 2023-11-07 17:23:11,061] Using an existing study with name 'ANN' instead of creating a new one.
[I 2023-11-07 17:23:33,578] Trial 3 finished with value: 0.2661063158818584 and parameters: {'learning_rate_init': 0.09293240219516832, 'hidden_layer_sizes': [10]}. Best is trial 3 with value: 0.2661063158818584.
[I 2023-11-07 17:23:33,583] Using an existing study with name 'linear' instead of creating a new one.
[I 2023-11-07 17:23:33,621] Trial 3 finished with value: 0.27962687896211086 and parameters: {'alpha': 0.07451827686439559, 'l1_ratio': 0.025924145973790447}. Best is trial 3 with value: 0.27962687896211086.
[I 2023-11-07 17:23:33,627] Using an existing study with name 'KRR' instead of creating a new one.
[I 2023-11-07 17:23:33,680] Trial 3 finished with value: 0.28415434903976616 and parameters: {'alpha': 0.21813759133766236, 'gamma': 8.121770888026869e-15, 'kernel': 'linear'}. Best is trial 2 with value: 0.27296973093493354.
[I 2023-11-07 17:23:33,686] Using an existing study with name 'GB' instead of creating a new one.
[I 2023-11-07 17:23:35,553] Trial 3 finished with value: 0.26325822567375023 and parameters: {'n_estimators': 50, 'learning_rate': 0.4226322099024508, 'max_depth': 2}. Best is trial 1 with value: 0.25579944588375864.
[I 2023-11-07 17:23:35,560] Using an existing study with name 'RF' instead of creating a new one.
[I 2023-11-07 17:23:39,493] Trial 3 finished with value: 0.24485431040551975 and parameters: {'n_estimators': 500, 'max_features': 'auto', 'max_depth': 10}. Best is trial 3 with value: 0.24485431040551975.
[I 2023-11-07 17:23:39,499] Using an existing study with name 'ANN' instead of creating a new one.
[I 2023-11-07 17:23:42,833] Trial 3 finished with value: 0.32697045599980434 and parameters: {'learning_rate_init': 0.0755363495867927, 'hidden_layer_sizes': [5]}. Best is trial 3 with value: 0.32697045599980434.
[I 2023-11-07 17:23:42,838] Using an existing study with name 'linear' instead of creating a new one.
[I 2023-11-07 17:23:42,871] Trial 3 finished with value: 0.12693272622886986 and parameters: {'alpha': 0.01737919651129798, 'l1_ratio': 0.9479438383085839}. Best is trial 2 with value: 0.1263750621900681.
[I 2023-11-07 17:23:42,876] Using an existing study with name 'KRR' instead of creating a new one.
[I 2023-11-07 17:23:42,916] Trial 3 finished with value: 0.1279567463927581 and parameters: {'alpha': 0.6020469556459649, 'gamma': 1.780850489548257e-15, 'kernel': 'rbf'}. Best is trial 2 with value: 0.12511874037691656.
[I 2023-11-07 17:23:42,921] Using an existing study with name 'GB' instead of creating a new one.
