[I 2023-11-07 17:33:45,406] Trial 3 finished with value: 0.246420959556766 and parameters: {'n_estimators': 200, 'learning_rate': 0.05683047247985523, 'max_depth': 2}. Best is trial 3 with value: 0.246420959556766.
[I 2023-11-07 17:33:45,413] Using an existing study with name 'RF' instead of creating a new one.
[I 2023-11-07 17:34:02,360] Trial 3 finished with value: 0.24644204316052057 and parameters: {'n_estimators': 20, 'max_features': 'auto', 'max_depth': 2}. Best is trial 2 with value: 0.2448503886733512.
[I 2023-11-07 17:34:02,368] Using an existing study with name 'ANN' instead of creating a new one.
[I 2023-11-07 17:34:14,845] Trial 3 finished with value: 0.2623131893389352 and parameters: {'learning_rate_init': 0.03392026077777218, 'hidden_layer_sizes': [50, 50]}. Best is trial 0 with value: 0.25923632429646043.
[I 2023-11-07 17:34:14,850] Using an existing study with name 'linear' instead of creating a new one.
[I 2023-11-07 17:34:14,884] Trial 3 finished with value: 0.3073494666108683 and parameters: {'alpha': 0.06705708988699799, 'l1_ratio': 0.4580442582785542}. Best is trial 0 with value: 0.3069047936495366.
[I 2023-11-07 17:34:14,890] Using an existing study with name 'KRR' instead of creating a new one.
[I 2023-11-07 17:34:14,935] Trial 3 finished with value: 0.31446177189011554 and parameters: {'alpha': 0.7768047436190378, 'gamma': 8.164249509533099e-15, 'kernel': 'rbf'}. Best is trial 2 with value: 0.31081813887420157.
[I 2023-11-07 17:34:14,941] Using an existing study with name 'GB' instead of creating a new one.
[I 2023-11-07 17:34:16,190] Trial 3 finished with value: 0.3049753040434926 and parameters: {'n_estimators': 200, 'learning_rate': 0.9941188327427596, 'max_depth': 3}. Best is trial 3 with value: 0.3049753040434926.
[I 2023-11-07 17:34:16,198] Using an existing study with name 'RF' instead of creating a new one.
[I 2023-11-07 17:34:18,842] Trial 3 finished with value: 0.2995547421566076 and parameters: {'n_estimators': 10, 'max_features': 'sqrt', 'max_depth': 2}. Best is trial 2 with value: 0.29036943204607796.
[I 2023-11-07 17:34:18,849] Using an existing study with name 'ANN' instead of creating a new one.
[I 2023-11-07 17:34:19,997] Trial 3 finished with value: 1.579185543938225 and parameters: {'learning_rate_init': 0.04386478293414348, 'hidden_layer_sizes': [5]}. Best is trial 3 with value: 1.579185543938225.
[I 2023-11-07 17:34:20,003] Using an existing study with name 'linear' instead of creating a new one.
[I 2023-11-07 17:34:20,046] Trial 10 finished with value: 0.2072958440522067 and parameters: {'alpha': 0.06264656704193015, 'l1_ratio': 0.6627785878364576}. Best is trial 10 with value: 0.2072958440522067.
[I 2023-11-07 17:34:20,052] Using an existing study with name 'KRR' instead of creating a new one.
[I 2023-11-07 17:34:20,109] Trial 10 finished with value: 0.17783395732896992 and parameters: {'alpha': 0.4919513915094392, 'gamma': 5.797604886357513e-15, 'kernel': 'linear'}. Best is trial 3 with value: 0.14792048671299554.
[I 2023-11-07 17:34:20,115] Using an existing study with name 'GB' instead of creating a new one.
[I 2023-11-07 17:34:21,449] Trial 10 finished with value: 0.16167028007731002 and parameters: {'n_estimators': 20, 'learning_rate': 0.22536956844470674, 'max_depth': 3}. Best is trial 5 with value: 0.15790287215256196.
[I 2023-11-07 17:34:21,457] Using an existing study with name 'RF' instead of creating a new one.
[I 2023-11-07 17:34:24,400] Trial 10 finished with value: 0.21317385308876377 and parameters: {'n_estimators': 500, 'max_features': 'sqrt', 'max_depth': 10}. Best is trial 8 with value: 0.15512200448801797.
[I 2023-11-07 17:34:24,407] Using an existing study with name 'ANN' instead of creating a new one.
[I 2023-11-07 17:34:25,934] Trial 10 finished with value: 0.23909302831190501 and parameters: {'learning_rate_init': 0.02155299569905691, 'hidden_layer_sizes': [20, 20]}. Best is trial 3 with value: 0.2218633477001349.
[I 2023-11-07 17:34:25,940] Using an existing study with name 'linear' instead of creating a new one.
[I 2023-11-07 17:34:26,005] Trial 10 finished with value: 0.25712503365775446 and parameters: {'alpha': 0.0546066978443691, 'l1_ratio': 0.01224231068648085}. Best is trial 4 with value: 0.25691167822082345.
[I 2023-11-07 17:34:26,011] Using an existing study with name 'KRR' instead of creating a new one.
[I 2023-11-07 17:34:27,064] Trial 10 finished with value: 0.2511275472141119 and parameters: {'alpha': 0.49229630206145497, 'gamma': 6.03201308922029e-16, 'kernel': 'laplacian'}. Best is trial 6 with value: 0.2495241394316322.
[I 2023-11-07 17:34:27,072] Using an existing study with name 'GB' instead of creating a new one.
[I 2023-11-07 17:34:36,887] Trial 10 finished with value: 0.2435010007267988 and parameters: {'n_estimators': 200, 'learning_rate': 0.0074630087755235275, 'max_depth': 5}. Best is trial 9 with value: 0.24136690874115585.
[I 2023-11-07 17:34:36,896] Using an existing study with name 'RF' instead of creating a new one.
[I 2023-11-07 17:35:17,908] Trial 10 finished with value: 0.2375242520242257 and parameters: {'n_estimators': 200, 'max_features': 'sqrt', 'max_depth': None}. Best is trial 8 with value: 0.2362615796115605.
[I 2023-11-07 17:35:17,915] Using an existing study with name 'ANN' instead of creating a new one.
[I 2023-11-07 17:35:40,370] Trial 5 finished with value: 0.29205447439228055 and parameters: {'learning_rate_init': 0.005111061149395555, 'hidden_layer_sizes': [50, 50]}. Best is trial 0 with value: 0.28963630595478557.
[I 2023-11-07 17:35:40,377] Using an existing study with name 'linear' instead of creating a new one.
[I 2023-11-07 17:35:40,415] Trial 5 finished with value: 0.3177136239185554 and parameters: {'alpha': 0.015562264739569573, 'l1_ratio': 0.07103229607317674}. Best is trial 4 with value: 0.31652472416870187.
[I 2023-11-07 17:35:40,421] Using an existing study with name 'KRR' instead of creating a new one.
[I 2023-11-07 17:35:40,477] Trial 5 finished with value: 0.3031149772286392 and parameters: {'alpha': 0.5210098702596871, 'gamma': 5.474986384025643e-15, 'kernel': 'laplacian'}. Best is trial 4 with value: 0.2937206064288087.
[I 2023-11-07 17:35:40,483] Using an existing study with name 'GB' instead of creating a new one.
[I 2023-11-07 17:35:42,346] Trial 5 finished with value: 0.2889584058217514 and parameters: {'n_estimators': 20, 'learning_rate': 0.6479564348943481, 'max_depth': 1}. Best is trial 1 with value: 0.2673906455658081.
[I 2023-11-07 17:35:42,354] Using an existing study with name 'RF' instead of creating a new one.
[I 2023-11-07 17:35:46,588] Trial 5 finished with value: 0.2736395084656644 and parameters: {'n_estimators': 200, 'max_features': 'log2', 'max_depth': None}. Best is trial 0 with value: 0.2677642292700792.
[I 2023-11-07 17:35:46,595] Using an existing study with name 'ANN' instead of creating a new one.
[I 2023-11-07 17:35:49,996] Trial 5 finished with value: 0.31037599810064037 and parameters: {'learning_rate_init': 0.09631353894363298, 'hidden_layer_sizes': [5, 5]}. Best is trial 3 with value: 0.30921506461333975.
[I 2023-11-07 17:35:50,002] Using an existing study with name 'linear' instead of creating a new one.
[I 2023-11-07 17:35:50,035] Trial 5 finished with value: 0.2115237764076703 and parameters: {'alpha': 0.0445104783199412, 'l1_ratio': 0.37577661054196754}. Best is trial 5 with value: 0.2115237764076703.
[I 2023-11-07 17:35:50,040] Using an existing study with name 'KRR' instead of creating a new one.
[I 2023-11-07 17:35:50,079] Trial 5 finished with value: 0.1459018563744187 and parameters: {'alpha': 0.04933029279116332, 'gamma': 4.889452358614591e-15, 'kernel': 'laplacian'}. Best is trial 2 with value: 0.13967776073074545.
[I 2023-11-07 17:35:50,084] Using an existing study with name 'GB' instead of creating a new one.
[I 2023-11-07 17:35:51,367] Trial 5 finished with value: 0.14765887618466939 and parameters: {'n_estimators': 50, 'learning_rate': 0.07887944416179489, 'max_depth': 4}. Best is trial 0 with value: 0.10324836117333373.
[I 2023-11-07 17:35:51,374] Using an existing study with name 'RF' instead of creating a new one.
[I 2023-11-07 17:35:54,263] Trial 5 finished with value: 0.14343183594051157 and parameters: {'n_estimators': 500, 'max_features': 'sqrt', 'max_depth': 4}. Best is trial 1 with value: 0.13033864323678376.
[I 2023-11-07 17:35:54,270] Using an existing study with name 'ANN' instead of creating a new one.
[I 2023-11-07 17:35:55,814] Trial 5 finished with value: 0.2574223147193054 and parameters: {'learning_rate_init': 0.058074709991788306, 'hidden_layer_sizes': [5, 5]}. Best is trial 0 with value: 0.2465075969227216.
[I 2023-11-07 17:35:55,820] Using an existing study with name 'linear' instead of creating a new one.
[I 2023-11-07 17:35:55,881] Trial 5 finished with value: 0.24771687940570664 and parameters: {'alpha': 0.017629415373945183, 'l1_ratio': 0.3454078631093386}. Best is trial 3 with value: 0.2474879832963269.
[I 2023-11-07 17:35:55,888] Using an existing study with name 'KRR' instead of creating a new one.
[I 2023-11-07 17:35:56,855] Trial 5 finished with value: 0.2364737839696971 and parameters: {'alpha': 0.6021440310621472, 'gamma': 6.376333543172965e-15, 'kernel': 'rbf'}. Best is trial 0 with value: 0.23575721399277358.
[I 2023-11-07 17:35:56,863] Using an existing study with name 'GB' instead of creating a new one.
[I 2023-11-07 17:36:06,606] Trial 5 finished with value: 0.22459276557970628 and parameters: {'n_estimators': 500, 'learning_rate': 0.711351840685779, 'max_depth': 3}. Best is trial 5 with value: 0.22459276557970628.
[I 2023-11-07 17:36:06,614] Using an existing study with name 'RF' instead of creating a new one.
[I 2023-11-07 17:36:46,986] Trial 5 finished with value: 0.22078085867502506 and parameters: {'n_estimators': 20, 'max_features': 'sqrt', 'max_depth': 2}. Best is trial 0 with value: 0.21890862037935035.
[I 2023-11-07 17:36:46,993] Using an existing study with name 'ANN' instead of creating a new one.
slurmstepd: error: *** JOB 335876 ON cn105 CANCELLED AT 2023-11-07T17:37:03 DUE TO TIME LIMIT ***
