[I 2023-11-03 23:26:11,398] Trial 229 finished with value: 0.2515292927143619 and parameters: {'learning_rate_init': 0.06265325642879992, 'hidden_layer_sizes': [20]}. Best is trial 14 with value: 0.22186978015941017.
[I 2023-11-03 23:28:52,482] Trial 253 finished with value: 0.27638834924505634 and parameters: {'learning_rate_init': 0.06339807160517659, 'hidden_layer_sizes': [20]}. Best is trial 14 with value: 0.22186978015941017.
[I 2023-11-03 23:30:11,295] Trial 267 finished with value: 0.2712089752943886 and parameters: {'learning_rate_init': 0.048216106482676664, 'hidden_layer_sizes': [20]}. Best is trial 14 with value: 0.22186978015941017.
[I 2023-11-03 23:31:17,813] Trial 297 finished with value: 0.24840828682951618 and parameters: {'learning_rate_init': 0.06242573047973427, 'hidden_layer_sizes': [20]}. Best is trial 14 with value: 0.22186978015941017.
[I 2023-11-03 23:33:48,916] Trial 240 finished with value: 0.2525507405377964 and parameters: {'learning_rate_init': 0.07765338068901097, 'hidden_layer_sizes': [20]}. Best is trial 14 with value: 0.22186978015941017.
[I 2023-11-03 23:36:23,181] Trial 263 finished with value: 0.2852521074537107 and parameters: {'learning_rate_init': 0.06294525240115584, 'hidden_layer_sizes': [20]}. Best is trial 14 with value: 0.22186978015941017.
[I 2023-11-03 23:36:49,577] Trial 233 finished with value: 0.25233233439757696 and parameters: {'learning_rate_init': 0.07726105586118849, 'hidden_layer_sizes': [20]}. Best is trial 14 with value: 0.22186978015941017.
[I 2023-11-03 23:36:55,397] Trial 266 finished with value: 0.2579767598223083 and parameters: {'learning_rate_init': 0.07656473029328774, 'hidden_layer_sizes': [20]}. Best is trial 14 with value: 0.22186978015941017.
[I 2023-11-03 23:37:04,458] Trial 296 finished with value: 0.2583191366048887 and parameters: {'learning_rate_init': 0.06346338628559756, 'hidden_layer_sizes': [20]}. Best is trial 14 with value: 0.22186978015941017.
[I 2023-11-03 23:37:50,242] Trial 294 finished with value: 0.24935363113345796 and parameters: {'learning_rate_init': 0.07600428587470442, 'hidden_layer_sizes': [20]}. Best is trial 14 with value: 0.22186978015941017.
[I 2023-11-03 23:38:32,082] Trial 237 finished with value: 0.26013936623855655 and parameters: {'learning_rate_init': 0.06326360254130743, 'hidden_layer_sizes': [20]}. Best is trial 14 with value: 0.22186978015941017.
[I 2023-11-03 23:38:43,625] Trial 264 finished with value: 0.29334915004876955 and parameters: {'learning_rate_init': 0.07624359301188813, 'hidden_layer_sizes': [20]}. Best is trial 14 with value: 0.22186978015941017.
[I 2023-11-03 23:39:51,874] Trial 286 finished with value: 0.2521291421040187 and parameters: {'learning_rate_init': 0.06366499058834835, 'hidden_layer_sizes': [20]}. Best is trial 14 with value: 0.22186978015941017.
[I 2023-11-03 23:40:48,828] Trial 295 finished with value: 0.23974354982587057 and parameters: {'learning_rate_init': 0.0629822163535472, 'hidden_layer_sizes': [20]}. Best is trial 14 with value: 0.22186978015941017.
[I 2023-11-03 23:41:20,855] Trial 232 finished with value: 0.2522653146173447 and parameters: {'learning_rate_init': 0.06380631755772957, 'hidden_layer_sizes': [20]}. Best is trial 14 with value: 0.22186978015941017.
[I 2023-11-03 23:41:32,524] Trial 261 finished with value: 0.2524839212320728 and parameters: {'learning_rate_init': 0.06379441769344743, 'hidden_layer_sizes': [20]}. Best is trial 14 with value: 0.22186978015941017.
[I 2023-11-03 23:41:41,705] Trial 228 finished with value: 0.26914870807691543 and parameters: {'learning_rate_init': 0.0637444774858824, 'hidden_layer_sizes': [20]}. Best is trial 14 with value: 0.22186978015941017.
[I 2023-11-03 23:41:47,599] Trial 260 finished with value: 0.24584283431048873 and parameters: {'learning_rate_init': 0.06289127836349363, 'hidden_layer_sizes': [20]}. Best is trial 14 with value: 0.22186978015941017.
[I 2023-11-03 23:42:34,153] Trial 316 finished with value: 0.2549780974437918 and parameters: {'learning_rate_init': 0.06322902522234522, 'hidden_layer_sizes': [20]}. Best is trial 14 with value: 0.22186978015941017.
[I 2023-11-03 23:42:35,063] Trial 309 finished with value: 0.2738129246855814 and parameters: {'learning_rate_init': 0.07677063204725189, 'hidden_layer_sizes': [20]}. Best is trial 14 with value: 0.22186978015941017.
[I 2023-11-03 23:42:48,160] Trial 284 finished with value: 0.2400338551702705 and parameters: {'learning_rate_init': 0.061615757246717466, 'hidden_layer_sizes': [20]}. Best is trial 14 with value: 0.22186978015941017.
[I 2023-11-03 23:43:10,140] Trial 303 finished with value: 0.2180862362954229 and parameters: {'learning_rate_init': 0.06242803565915612, 'hidden_layer_sizes': [20]}. Best is trial 303 with value: 0.2180862362954229.
[I 2023-11-03 23:43:18,691] Trial 236 finished with value: 0.24811673260540637 and parameters: {'learning_rate_init': 0.06267733430925065, 'hidden_layer_sizes': [20]}. Best is trial 303 with value: 0.2180862362954229.
[I 2023-11-03 23:43:35,146] Trial 251 finished with value: 0.24779280604440124 and parameters: {'learning_rate_init': 0.06333094068947785, 'hidden_layer_sizes': [20]}. Best is trial 303 with value: 0.2180862362954229.
[I 2023-11-03 23:43:59,026] Trial 304 finished with value: 0.2619069781293161 and parameters: {'learning_rate_init': 0.06337395646169892, 'hidden_layer_sizes': [20]}. Best is trial 303 with value: 0.2180862362954229.
[I 2023-11-03 23:44:19,018] Trial 257 finished with value: 0.24532636554696607 and parameters: {'learning_rate_init': 0.07595837632599488, 'hidden_layer_sizes': [20]}. Best is trial 303 with value: 0.2180862362954229.
[I 2023-11-03 23:44:30,631] Trial 230 finished with value: 0.2601039151603781 and parameters: {'learning_rate_init': 0.07721171374890812, 'hidden_layer_sizes': [20]}. Best is trial 303 with value: 0.2180862362954229.
[I 2023-11-03 23:44:43,856] Trial 278 finished with value: 0.2881403996935838 and parameters: {'learning_rate_init': 0.06274881486156679, 'hidden_layer_sizes': [20]}. Best is trial 303 with value: 0.2180862362954229.
[I 2023-11-03 23:44:45,141] Trial 250 finished with value: 0.2555578821756017 and parameters: {'learning_rate_init': 0.06292141045568904, 'hidden_layer_sizes': [20]}. Best is trial 303 with value: 0.2180862362954229.
[I 2023-11-03 23:44:49,728] Trial 238 finished with value: 0.2661927904031575 and parameters: {'learning_rate_init': 0.06350402535718719, 'hidden_layer_sizes': [20]}. Best is trial 303 with value: 0.2180862362954229.
[I 2023-11-03 23:44:52,328] Trial 287 finished with value: 0.287825615412963 and parameters: {'learning_rate_init': 0.06285080519912298, 'hidden_layer_sizes': [20]}. Best is trial 303 with value: 0.2180862362954229.
[I 2023-11-03 23:44:54,616] Trial 312 finished with value: 0.2620774886425094 and parameters: {'learning_rate_init': 0.0632042768632984, 'hidden_layer_sizes': [20]}. Best is trial 303 with value: 0.2180862362954229.
[I 2023-11-03 23:45:18,102] Trial 270 finished with value: 0.27716715296645067 and parameters: {'learning_rate_init': 0.06319233703354626, 'hidden_layer_sizes': [20]}. Best is trial 303 with value: 0.2180862362954229.
[I 2023-11-03 23:45:26,034] Trial 234 finished with value: 0.2676140953203144 and parameters: {'learning_rate_init': 0.06180097640246057, 'hidden_layer_sizes': [20]}. Best is trial 303 with value: 0.2180862362954229.
[I 2023-11-03 23:45:32,322] Trial 323 finished with value: 0.23182468308279705 and parameters: {'learning_rate_init': 0.06176984763262953, 'hidden_layer_sizes': [20]}. Best is trial 303 with value: 0.2180862362954229.
[I 2023-11-03 23:45:47,758] Trial 317 finished with value: 0.28593362611739703 and parameters: {'learning_rate_init': 0.0767459055412555, 'hidden_layer_sizes': [20]}. Best is trial 303 with value: 0.2180862362954229.
[I 2023-11-03 23:45:57,116] Trial 299 finished with value: 0.23528761028710887 and parameters: {'learning_rate_init': 0.06324546277437447, 'hidden_layer_sizes': [20]}. Best is trial 303 with value: 0.2180862362954229.
[I 2023-11-03 23:46:00,471] Trial 277 finished with value: 0.24935584390632248 and parameters: {'learning_rate_init': 0.06284921842242953, 'hidden_layer_sizes': [20]}. Best is trial 303 with value: 0.2180862362954229.
[I 2023-11-03 23:46:26,281] Trial 248 finished with value: 0.26190130727884947 and parameters: {'learning_rate_init': 0.06107258941210027, 'hidden_layer_sizes': [20]}. Best is trial 303 with value: 0.2180862362954229.
[I 2023-11-03 23:46:29,005] Trial 252 finished with value: 0.2688588917139576 and parameters: {'learning_rate_init': 0.06365217665545943, 'hidden_layer_sizes': [20]}. Best is trial 303 with value: 0.2180862362954229.
[I 2023-11-03 23:46:32,562] Trial 256 finished with value: 0.26325854330980386 and parameters: {'learning_rate_init': 0.0758489679749993, 'hidden_layer_sizes': [20]}. Best is trial 303 with value: 0.2180862362954229.
[I 2023-11-03 23:46:42,376] Trial 279 finished with value: 0.24908860359714532 and parameters: {'learning_rate_init': 0.07630148378842486, 'hidden_layer_sizes': [20]}. Best is trial 303 with value: 0.2180862362954229.
[I 2023-11-03 23:46:45,507] Trial 293 finished with value: 0.25214914949766787 and parameters: {'learning_rate_init': 0.06371012153982901, 'hidden_layer_sizes': [20]}. Best is trial 303 with value: 0.2180862362954229.
[I 2023-11-03 23:46:48,159] Trial 246 finished with value: 0.2805183316277342 and parameters: {'learning_rate_init': 0.07663344595133448, 'hidden_layer_sizes': [20]}. Best is trial 303 with value: 0.2180862362954229.
[I 2023-11-03 23:46:55,480] Trial 281 finished with value: 0.24079869813021929 and parameters: {'learning_rate_init': 0.06113201227289716, 'hidden_layer_sizes': [20]}. Best is trial 303 with value: 0.2180862362954229.
[I 2023-11-03 23:47:02,413] Trial 319 finished with value: 0.2531886530395364 and parameters: {'learning_rate_init': 0.0634260395722882, 'hidden_layer_sizes': [10]}. Best is trial 303 with value: 0.2180862362954229.
[I 2023-11-03 23:47:31,032] Trial 308 finished with value: 0.2350545666005536 and parameters: {'learning_rate_init': 0.07711224968787331, 'hidden_layer_sizes': [20]}. Best is trial 303 with value: 0.2180862362954229.
[I 2023-11-03 23:47:34,305] Trial 271 finished with value: 0.26214808074432056 and parameters: {'learning_rate_init': 0.07594185426656352, 'hidden_layer_sizes': [20]}. Best is trial 303 with value: 0.2180862362954229.
[I 2023-11-03 23:47:39,100] Trial 276 finished with value: 0.23796172934710969 and parameters: {'learning_rate_init': 0.04870073721540147, 'hidden_layer_sizes': [20]}. Best is trial 303 with value: 0.2180862362954229.
[I 2023-11-03 23:47:46,125] Trial 255 finished with value: 0.24092976905466026 and parameters: {'learning_rate_init': 0.0631142243762885, 'hidden_layer_sizes': [20]}. Best is trial 303 with value: 0.2180862362954229.
[I 2023-11-03 23:47:50,555] Trial 231 finished with value: 0.2656981358783771 and parameters: {'learning_rate_init': 0.06319388774276868, 'hidden_layer_sizes': [20]}. Best is trial 303 with value: 0.2180862362954229.
[I 2023-11-03 23:48:07,015] Trial 245 finished with value: 0.2668318162213525 and parameters: {'learning_rate_init': 0.06235848928888259, 'hidden_layer_sizes': [20]}. Best is trial 303 with value: 0.2180862362954229.
[I 2023-11-03 23:48:12,197] Trial 249 finished with value: 0.21826950651082208 and parameters: {'learning_rate_init': 0.06335574668640614, 'hidden_layer_sizes': [20]}. Best is trial 303 with value: 0.2180862362954229.
[I 2023-11-03 23:48:14,939] Trial 259 finished with value: 0.26375077885932646 and parameters: {'learning_rate_init': 0.0770980251466851, 'hidden_layer_sizes': [20]}. Best is trial 303 with value: 0.2180862362954229.
[I 2023-11-03 23:48:24,625] Trial 265 finished with value: 0.23215701781741885 and parameters: {'learning_rate_init': 0.06405004496131404, 'hidden_layer_sizes': [20]}. Best is trial 303 with value: 0.2180862362954229.
[I 2023-11-03 23:48:26,418] Trial 274 finished with value: 0.23939541917058813 and parameters: {'learning_rate_init': 0.07671592543962513, 'hidden_layer_sizes': [20]}. Best is trial 303 with value: 0.2180862362954229.
[I 2023-11-03 23:48:34,943] Trial 310 finished with value: 0.266694703696497 and parameters: {'learning_rate_init': 0.06412892634535382, 'hidden_layer_sizes': [20]}. Best is trial 303 with value: 0.2180862362954229.
[I 2023-11-03 23:48:35,818] Trial 325 finished with value: 0.2479649844864027 and parameters: {'learning_rate_init': 0.06378050663024508, 'hidden_layer_sizes': [20]}. Best is trial 303 with value: 0.2180862362954229.
[I 2023-11-03 23:48:47,810] Trial 243 finished with value: 0.2643396662088572 and parameters: {'learning_rate_init': 0.0636007365469182, 'hidden_layer_sizes': [20]}. Best is trial 303 with value: 0.2180862362954229.
[I 2023-11-03 23:48:53,500] Trial 314 finished with value: 0.2586260998191001 and parameters: {'learning_rate_init': 0.07742277969632146, 'hidden_layer_sizes': [20]}. Best is trial 303 with value: 0.2180862362954229.
[I 2023-11-03 23:49:04,678] Trial 324 finished with value: 0.2623838888086806 and parameters: {'learning_rate_init': 0.06292996907282725, 'hidden_layer_sizes': [20]}. Best is trial 303 with value: 0.2180862362954229.
[I 2023-11-03 23:49:11,739] Trial 262 finished with value: 0.240905486376181 and parameters: {'learning_rate_init': 0.06402656281925642, 'hidden_layer_sizes': [20]}. Best is trial 303 with value: 0.2180862362954229.
[I 2023-11-03 23:49:15,787] Trial 313 finished with value: 0.27281295254916044 and parameters: {'learning_rate_init': 0.06147915373070171, 'hidden_layer_sizes': [20]}. Best is trial 303 with value: 0.2180862362954229.
[I 2023-11-03 23:49:17,391] Trial 318 finished with value: 0.2707825052184684 and parameters: {'learning_rate_init': 0.06167347655281399, 'hidden_layer_sizes': [20]}. Best is trial 303 with value: 0.2180862362954229.
[I 2023-11-03 23:49:26,455] Trial 258 finished with value: 0.2721497629991381 and parameters: {'learning_rate_init': 0.06366222047380839, 'hidden_layer_sizes': [20]}. Best is trial 303 with value: 0.2180862362954229.
[I 2023-11-03 23:49:29,081] Trial 242 finished with value: 0.2131628459257875 and parameters: {'learning_rate_init': 0.06386144188206898, 'hidden_layer_sizes': [20]}. Best is trial 242 with value: 0.2131628459257875.
[I 2023-11-03 23:49:30,270] Trial 327 finished with value: 0.2484464809132135 and parameters: {'learning_rate_init': 0.062127444289085954, 'hidden_layer_sizes': [20]}. Best is trial 242 with value: 0.2131628459257875.
[I 2023-11-03 23:49:37,281] Trial 269 finished with value: 0.2618401161550707 and parameters: {'learning_rate_init': 0.07703171278073623, 'hidden_layer_sizes': [20]}. Best is trial 242 with value: 0.2131628459257875.
[I 2023-11-03 23:49:39,327] Trial 254 finished with value: 0.2706066546794728 and parameters: {'learning_rate_init': 0.07757824721402028, 'hidden_layer_sizes': [20]}. Best is trial 242 with value: 0.2131628459257875.
[I 2023-11-03 23:49:43,342] Trial 268 finished with value: 0.26918196339976036 and parameters: {'learning_rate_init': 0.06286669545190579, 'hidden_layer_sizes': [20]}. Best is trial 242 with value: 0.2131628459257875.
[I 2023-11-03 23:49:52,419] Trial 283 finished with value: 0.2391806850545902 and parameters: {'learning_rate_init': 0.06270083746162855, 'hidden_layer_sizes': [20]}. Best is trial 242 with value: 0.2131628459257875.
[I 2023-11-03 23:50:02,707] Trial 241 finished with value: 0.23900524699644934 and parameters: {'learning_rate_init': 0.06309032481078511, 'hidden_layer_sizes': [20]}. Best is trial 242 with value: 0.2131628459257875.
[I 2023-11-03 23:50:02,962] Trial 322 finished with value: 0.24090696240823525 and parameters: {'learning_rate_init': 0.06369010930517557, 'hidden_layer_sizes': [10]}. Best is trial 242 with value: 0.2131628459257875.
[I 2023-11-03 23:50:05,369] Trial 273 finished with value: 0.2668512467887239 and parameters: {'learning_rate_init': 0.06363515235713645, 'hidden_layer_sizes': [20]}. Best is trial 242 with value: 0.2131628459257875.
[I 2023-11-03 23:50:07,943] Trial 291 finished with value: 0.2697076492101054 and parameters: {'learning_rate_init': 0.06293916761418149, 'hidden_layer_sizes': [20]}. Best is trial 242 with value: 0.2131628459257875.
[I 2023-11-03 23:50:12,634] Trial 326 finished with value: 0.28110814019727604 and parameters: {'learning_rate_init': 0.06375390792797057, 'hidden_layer_sizes': [10]}. Best is trial 242 with value: 0.2131628459257875.
[I 2023-11-03 23:50:15,663] Trial 298 finished with value: 0.2664135948881586 and parameters: {'learning_rate_init': 0.06321552364919386, 'hidden_layer_sizes': [20]}. Best is trial 242 with value: 0.2131628459257875.
[I 2023-11-03 23:50:15,935] Trial 244 finished with value: 0.2942155267094306 and parameters: {'learning_rate_init': 0.06345984971133815, 'hidden_layer_sizes': [20]}. Best is trial 242 with value: 0.2131628459257875.
[I 2023-11-03 23:50:16,704] Trial 307 finished with value: 0.2851146990917792 and parameters: {'learning_rate_init': 0.06224567442231731, 'hidden_layer_sizes': [20]}. Best is trial 242 with value: 0.2131628459257875.
[I 2023-11-03 23:50:16,721] Trial 280 finished with value: 0.29246652133658757 and parameters: {'learning_rate_init': 0.06816216835485092, 'hidden_layer_sizes': [20]}. Best is trial 242 with value: 0.2131628459257875.
[I 2023-11-03 23:50:16,835] Trial 282 finished with value: 0.29260100702662056 and parameters: {'learning_rate_init': 0.07689715210071145, 'hidden_layer_sizes': [20]}. Best is trial 242 with value: 0.2131628459257875.
[I 2023-11-03 23:50:17,875] Trial 320 finished with value: 0.24109950187491072 and parameters: {'learning_rate_init': 0.07596449657871437, 'hidden_layer_sizes': [20]}. Best is trial 242 with value: 0.2131628459257875.
[I 2023-11-03 23:50:18,168] Trial 288 finished with value: 0.27854070932871083 and parameters: {'learning_rate_init': 0.062377127516841324, 'hidden_layer_sizes': [20]}. Best is trial 242 with value: 0.2131628459257875.
[I 2023-11-03 23:50:18,460] Trial 306 finished with value: 0.25250586655056556 and parameters: {'learning_rate_init': 0.06334328823109163, 'hidden_layer_sizes': [20]}. Best is trial 242 with value: 0.2131628459257875.
[I 2023-11-03 23:50:18,614] Trial 289 finished with value: 0.2684754638453371 and parameters: {'learning_rate_init': 0.06229094899092836, 'hidden_layer_sizes': [20]}. Best is trial 242 with value: 0.2131628459257875.
[I 2023-11-03 23:50:18,670] Trial 239 finished with value: 0.24918906967691434 and parameters: {'learning_rate_init': 0.06353744718962444, 'hidden_layer_sizes': [20]}. Best is trial 242 with value: 0.2131628459257875.
[I 2023-11-03 23:50:18,803] Trial 315 finished with value: 0.25124926216465593 and parameters: {'learning_rate_init': 0.07726186760898661, 'hidden_layer_sizes': [20]}. Best is trial 242 with value: 0.2131628459257875.
[I 2023-11-03 23:50:19,310] Trial 300 finished with value: 0.25953090457704125 and parameters: {'learning_rate_init': 0.06291827315215702, 'hidden_layer_sizes': [20]}. Best is trial 242 with value: 0.2131628459257875.
[I 2023-11-03 23:50:19,344] Trial 301 finished with value: 0.22317777834912014 and parameters: {'learning_rate_init': 0.06357816550791583, 'hidden_layer_sizes': [20]}. Best is trial 242 with value: 0.2131628459257875.
[I 2023-11-03 23:50:19,354] Trial 311 finished with value: 0.26127476242166947 and parameters: {'learning_rate_init': 0.07611922599029597, 'hidden_layer_sizes': [20]}. Best is trial 242 with value: 0.2131628459257875.
[I 2023-11-03 23:50:19,358] Trial 321 finished with value: 0.2680172020824083 and parameters: {'learning_rate_init': 0.0636426898542952, 'hidden_layer_sizes': [20]}. Best is trial 242 with value: 0.2131628459257875.
[I 2023-11-03 23:50:19,361] Trial 305 finished with value: 0.24463573950324027 and parameters: {'learning_rate_init': 0.07599498870063841, 'hidden_layer_sizes': [20]}. Best is trial 242 with value: 0.2131628459257875.
[I 2023-11-03 23:50:19,392] Trial 292 finished with value: 0.25301324864188407 and parameters: {'learning_rate_init': 0.06284083428301798, 'hidden_layer_sizes': [20]}. Best is trial 242 with value: 0.2131628459257875.
[I 2023-11-03 23:50:19,449] Trial 247 finished with value: 0.2571572023856119 and parameters: {'learning_rate_init': 0.06291855892456837, 'hidden_layer_sizes': [20]}. Best is trial 242 with value: 0.2131628459257875.
[I 2023-11-03 23:50:19,540] Trial 302 finished with value: 0.27143472223332316 and parameters: {'learning_rate_init': 0.06349703860478671, 'hidden_layer_sizes': [20]}. Best is trial 242 with value: 0.2131628459257875.
[I 2023-11-03 23:50:19,595] Trial 272 finished with value: 0.23319864933910642 and parameters: {'learning_rate_init': 0.06369631083144843, 'hidden_layer_sizes': [20]}. Best is trial 242 with value: 0.2131628459257875.
[I 2023-11-03 23:50:19,623] Trial 290 finished with value: 0.29613190036431836 and parameters: {'learning_rate_init': 0.0773529256483277, 'hidden_layer_sizes': [20]}. Best is trial 242 with value: 0.2131628459257875.
[I 2023-11-03 23:50:19,780] Using an existing study with name 'linear' instead of creating a new one.
[I 2023-11-03 23:50:27,216] Trial 270 finished with value: 0.2570017533858113 and parameters: {'alpha': 0.08074974812824204, 'l1_ratio': 0.1990841583798744}. Best is trial 145 with value: 0.2568487370091133.
[I 2023-11-03 23:50:27,240] Trial 263 finished with value: 0.2569035862403109 and parameters: {'alpha': 0.023939501556027823, 'l1_ratio': 0.24505246733606378}. Best is trial 145 with value: 0.2568487370091133.
[I 2023-11-03 23:50:27,538] Trial 233 finished with value: 0.2569792867927092 and parameters: {'alpha': 0.09038932708905727, 'l1_ratio': 0.46915667032725566}. Best is trial 145 with value: 0.2568487370091133.
