[I 2023-11-03 23:56:20,637] Trial 228 finished with value: 0.24236075328131543 and parameters: {'n_estimators': 20, 'learning_rate': 0.8519189269677387, 'max_depth': 3}. Best is trial 133 with value: 0.24134805988183708.
[I 2023-11-03 23:56:20,643] Trial 249 finished with value: 0.24393220995328677 and parameters: {'n_estimators': 20, 'learning_rate': 0.8521632188496173, 'max_depth': 3}. Best is trial 133 with value: 0.24134805988183708.
[I 2023-11-03 23:56:20,648] Trial 262 finished with value: 0.2438946196306457 and parameters: {'n_estimators': 20, 'learning_rate': 0.8322455938906659, 'max_depth': 1}. Best is trial 133 with value: 0.24134805988183708.
[I 2023-11-03 23:56:20,652] Trial 260 finished with value: 0.2432838167761295 and parameters: {'n_estimators': 20, 'learning_rate': 0.6502230812455101, 'max_depth': 3}. Best is trial 133 with value: 0.24134805988183708.
[I 2023-11-03 23:56:20,656] Trial 252 finished with value: 0.24387834395420613 and parameters: {'n_estimators': 20, 'learning_rate': 0.6220224003503863, 'max_depth': 3}. Best is trial 133 with value: 0.24134805988183708.
[I 2023-11-03 23:56:20,658] Trial 271 finished with value: 0.24289240415160415 and parameters: {'n_estimators': 20, 'learning_rate': 0.8496407607749072, 'max_depth': 3}. Best is trial 133 with value: 0.24134805988183708.
[I 2023-11-03 23:56:20,660] Trial 251 finished with value: 0.24301716933792727 and parameters: {'n_estimators': 20, 'learning_rate': 0.8447620899713812, 'max_depth': 3}. Best is trial 133 with value: 0.24134805988183708.
[I 2023-11-03 23:56:21,340] Trial 256 finished with value: 0.24302922669047108 and parameters: {'n_estimators': 20, 'learning_rate': 0.5630081150494519, 'max_depth': 3}. Best is trial 133 with value: 0.24134805988183708.
[I 2023-11-03 23:56:22,383] Trial 275 finished with value: 0.24448552381376568 and parameters: {'n_estimators': 20, 'learning_rate': 0.8465088624695274, 'max_depth': 2}. Best is trial 133 with value: 0.24134805988183708.
[I 2023-11-03 23:56:23,107] Trial 292 finished with value: 0.24325155602766976 and parameters: {'n_estimators': 20, 'learning_rate': 0.8265622328805744, 'max_depth': 3}. Best is trial 133 with value: 0.24134805988183708.
[I 2023-11-03 23:56:24,836] Trial 243 finished with value: 0.2429688323689175 and parameters: {'n_estimators': 20, 'learning_rate': 0.6412386281276212, 'max_depth': 3}. Best is trial 133 with value: 0.24134805988183708.
[I 2023-11-03 23:56:31,821] Trial 295 finished with value: 0.24286165992377176 and parameters: {'n_estimators': 20, 'learning_rate': 0.8453063896614055, 'max_depth': 3}. Best is trial 133 with value: 0.24134805988183708.
[I 2023-11-03 23:56:37,581] Trial 297 finished with value: 0.24321260597778072 and parameters: {'n_estimators': 20, 'learning_rate': 0.5601308636539561, 'max_depth': 3}. Best is trial 133 with value: 0.24134805988183708.
[I 2023-11-03 23:56:43,581] Trial 265 finished with value: 0.24347284106839087 and parameters: {'n_estimators': 20, 'learning_rate': 0.5660016158998602, 'max_depth': 3}. Best is trial 133 with value: 0.24134805988183708.
[I 2023-11-03 23:56:44,663] Trial 264 finished with value: 0.24315591120938532 and parameters: {'n_estimators': 20, 'learning_rate': 0.836646039422543, 'max_depth': 3}. Best is trial 133 with value: 0.24134805988183708.
[I 2023-11-03 23:56:46,203] Trial 245 finished with value: 0.24370282473480973 and parameters: {'n_estimators': 20, 'learning_rate': 0.5910069900972493, 'max_depth': 3}. Best is trial 133 with value: 0.24134805988183708.
[I 2023-11-03 23:56:46,573] Trial 267 finished with value: 0.24200466406922164 and parameters: {'n_estimators': 20, 'learning_rate': 0.8363915110245657, 'max_depth': 3}. Best is trial 133 with value: 0.24134805988183708.
[I 2023-11-03 23:56:46,596] Trial 278 finished with value: 0.24331558526212438 and parameters: {'n_estimators': 20, 'learning_rate': 0.8403724829903061, 'max_depth': 3}. Best is trial 133 with value: 0.24134805988183708.
[I 2023-11-03 23:56:47,235] Trial 229 finished with value: 0.24284861225999751 and parameters: {'n_estimators': 20, 'learning_rate': 0.8540562437502042, 'max_depth': 3}. Best is trial 133 with value: 0.24134805988183708.
[I 2023-11-03 23:56:47,243] Trial 269 finished with value: 0.24313361222602914 and parameters: {'n_estimators': 20, 'learning_rate': 0.8474286327431996, 'max_depth': 3}. Best is trial 133 with value: 0.24134805988183708.
[I 2023-11-03 23:56:47,317] Trial 286 finished with value: 0.2428628590495118 and parameters: {'n_estimators': 20, 'learning_rate': 0.6328850260477681, 'max_depth': 3}. Best is trial 133 with value: 0.24134805988183708.
[I 2023-11-03 23:56:47,983] Trial 246 finished with value: 0.24372901248355575 and parameters: {'n_estimators': 20, 'learning_rate': 0.5620209874325504, 'max_depth': 3}. Best is trial 133 with value: 0.24134805988183708.
[I 2023-11-03 23:56:47,990] Trial 289 finished with value: 0.24403073269943035 and parameters: {'n_estimators': 20, 'learning_rate': 0.6225408986891137, 'max_depth': 3}. Best is trial 133 with value: 0.24134805988183708.
[I 2023-11-03 23:56:48,002] Trial 291 finished with value: 0.24214449723801357 and parameters: {'n_estimators': 20, 'learning_rate': 0.8492427573794168, 'max_depth': 3}. Best is trial 133 with value: 0.24134805988183708.
[I 2023-11-03 23:56:48,019] Trial 241 finished with value: 0.24245729204717237 and parameters: {'n_estimators': 20, 'learning_rate': 0.8492992144591576, 'max_depth': 3}. Best is trial 133 with value: 0.24134805988183708.
[I 2023-11-03 23:56:49,874] Trial 284 finished with value: 0.24225644482560174 and parameters: {'n_estimators': 20, 'learning_rate': 0.8532371262486789, 'max_depth': 3}. Best is trial 133 with value: 0.24134805988183708.
[I 2023-11-03 23:56:50,290] Trial 305 finished with value: 0.24323166496409232 and parameters: {'n_estimators': 20, 'learning_rate': 0.8352782746238139, 'max_depth': 3}. Best is trial 133 with value: 0.24134805988183708.
[I 2023-11-03 23:56:51,915] Trial 254 finished with value: 0.2441859322030702 and parameters: {'n_estimators': 20, 'learning_rate': 0.8500435008188694, 'max_depth': 3}. Best is trial 133 with value: 0.24134805988183708.
[I 2023-11-03 23:56:52,569] Trial 255 finished with value: 0.2445734924253271 and parameters: {'n_estimators': 20, 'learning_rate': 0.6460817395222755, 'max_depth': 3}. Best is trial 133 with value: 0.24134805988183708.
[I 2023-11-03 23:56:53,685] Trial 258 finished with value: 0.24430538431307447 and parameters: {'n_estimators': 20, 'learning_rate': 0.6255522069948296, 'max_depth': 3}. Best is trial 133 with value: 0.24134805988183708.
[I 2023-11-03 23:56:56,117] Trial 263 finished with value: 0.242789814411976 and parameters: {'n_estimators': 20, 'learning_rate': 0.5573095527594318, 'max_depth': 3}. Best is trial 133 with value: 0.24134805988183708.
[I 2023-11-03 23:56:58,878] Trial 306 finished with value: 0.2442356932548745 and parameters: {'n_estimators': 20, 'learning_rate': 0.8388557317890841, 'max_depth': 3}. Best is trial 133 with value: 0.24134805988183708.
[I 2023-11-03 23:56:58,940] Trial 273 finished with value: 0.24356729359345997 and parameters: {'n_estimators': 20, 'learning_rate': 0.8391934884102941, 'max_depth': 3}. Best is trial 133 with value: 0.24134805988183708.
[I 2023-11-03 23:56:58,949] Trial 244 finished with value: 0.24473093117608444 and parameters: {'n_estimators': 20, 'learning_rate': 0.6414941484571024, 'max_depth': 3}. Best is trial 133 with value: 0.24134805988183708.
[I 2023-11-03 23:57:00,577] Trial 270 finished with value: 0.24372845274210486 and parameters: {'n_estimators': 20, 'learning_rate': 0.8405029482137123, 'max_depth': 3}. Best is trial 133 with value: 0.24134805988183708.
[I 2023-11-03 23:57:02,189] Trial 237 finished with value: 0.2437449797135025 and parameters: {'n_estimators': 20, 'learning_rate': 0.646622663187955, 'max_depth': 2}. Best is trial 133 with value: 0.24134805988183708.
[I 2023-11-03 23:57:02,785] Trial 274 finished with value: 0.24225758297532385 and parameters: {'n_estimators': 20, 'learning_rate': 0.8525801522534009, 'max_depth': 3}. Best is trial 133 with value: 0.24134805988183708.
[I 2023-11-03 23:57:04,038] Trial 230 finished with value: 0.24271477637821015 and parameters: {'n_estimators': 20, 'learning_rate': 0.8472752623573083, 'max_depth': 3}. Best is trial 133 with value: 0.24134805988183708.
[I 2023-11-03 23:57:04,045] Trial 248 finished with value: 0.2446304094061633 and parameters: {'n_estimators': 20, 'learning_rate': 0.8397108937846407, 'max_depth': 3}. Best is trial 133 with value: 0.24134805988183708.
[I 2023-11-03 23:57:04,603] Trial 282 finished with value: 0.24244557436383088 and parameters: {'n_estimators': 20, 'learning_rate': 0.6057162173003392, 'max_depth': 3}. Best is trial 133 with value: 0.24134805988183708.
[I 2023-11-03 23:57:07,434] Trial 259 finished with value: 0.242968581676499 and parameters: {'n_estimators': 20, 'learning_rate': 0.5395066214997124, 'max_depth': 3}. Best is trial 133 with value: 0.24134805988183708.
[I 2023-11-03 23:57:08,016] Trial 280 finished with value: 0.24321274692603356 and parameters: {'n_estimators': 20, 'learning_rate': 0.8492961413703409, 'max_depth': 2}. Best is trial 133 with value: 0.24134805988183708.
[I 2023-11-03 23:57:08,029] Trial 277 finished with value: 0.2424935094339106 and parameters: {'n_estimators': 20, 'learning_rate': 0.8512727309164336, 'max_depth': 3}. Best is trial 133 with value: 0.24134805988183708.
[I 2023-11-03 23:57:08,905] Trial 240 finished with value: 0.24213076016303733 and parameters: {'n_estimators': 20, 'learning_rate': 0.8492205865063517, 'max_depth': 3}. Best is trial 133 with value: 0.24134805988183708.
[I 2023-11-03 23:57:09,263] Trial 288 finished with value: 0.24478601223436677 and parameters: {'n_estimators': 20, 'learning_rate': 0.4533006451659079, 'max_depth': 4}. Best is trial 133 with value: 0.24134805988183708.
[I 2023-11-03 23:57:09,747] Trial 287 finished with value: 0.24378973767560083 and parameters: {'n_estimators': 20, 'learning_rate': 0.7437107633428571, 'max_depth': 3}. Best is trial 133 with value: 0.24134805988183708.
[I 2023-11-03 23:57:09,763] Trial 299 finished with value: 0.24307568241690145 and parameters: {'n_estimators': 20, 'learning_rate': 0.6351900047485819, 'max_depth': 3}. Best is trial 133 with value: 0.24134805988183708.
[I 2023-11-03 23:57:10,556] Trial 234 finished with value: 0.24395073596691833 and parameters: {'n_estimators': 20, 'learning_rate': 0.8741867424216891, 'max_depth': 4}. Best is trial 133 with value: 0.24134805988183708.
[I 2023-11-03 23:57:11,554] Trial 283 finished with value: 0.24341884422915017 and parameters: {'n_estimators': 20, 'learning_rate': 0.882291984566716, 'max_depth': 4}. Best is trial 133 with value: 0.24134805988183708.
[I 2023-11-03 23:57:11,801] Trial 293 finished with value: 0.24352028865433653 and parameters: {'n_estimators': 20, 'learning_rate': 0.9193215799347626, 'max_depth': 4}. Best is trial 133 with value: 0.24134805988183708.
[I 2023-11-03 23:57:11,809] Trial 294 finished with value: 0.24345080125649568 and parameters: {'n_estimators': 20, 'learning_rate': 0.591579235810152, 'max_depth': 3}. Best is trial 133 with value: 0.24134805988183708.
[I 2023-11-03 23:57:11,812] Trial 314 finished with value: 0.24439525087396938 and parameters: {'n_estimators': 20, 'learning_rate': 0.4466479330756796, 'max_depth': 4}. Best is trial 133 with value: 0.24134805988183708.
[I 2023-11-03 23:57:11,813] Trial 298 finished with value: 0.24358706638224545 and parameters: {'n_estimators': 20, 'learning_rate': 0.875897946825701, 'max_depth': 3}. Best is trial 133 with value: 0.24134805988183708.
[I 2023-11-03 23:57:11,864] Trial 268 finished with value: 0.24267749351237736 and parameters: {'n_estimators': 20, 'learning_rate': 0.6225815462456278, 'max_depth': 3}. Best is trial 133 with value: 0.24134805988183708.
[I 2023-11-03 23:57:11,867] Trial 272 finished with value: 0.2428154129608389 and parameters: {'n_estimators': 20, 'learning_rate': 0.8505441911618059, 'max_depth': 3}. Best is trial 133 with value: 0.24134805988183708.
[I 2023-11-03 23:57:11,906] Trial 253 finished with value: 0.24308423137967564 and parameters: {'n_estimators': 20, 'learning_rate': 0.8526618623464678, 'max_depth': 3}. Best is trial 133 with value: 0.24134805988183708.
[I 2023-11-03 23:57:11,908] Trial 300 finished with value: 0.24346567900563928 and parameters: {'n_estimators': 20, 'learning_rate': 0.8738970204295889, 'max_depth': 3}. Best is trial 133 with value: 0.24134805988183708.
[I 2023-11-03 23:57:11,910] Trial 239 finished with value: 0.2440098016530837 and parameters: {'n_estimators': 20, 'learning_rate': 0.8397851345205484, 'max_depth': 3}. Best is trial 133 with value: 0.24134805988183708.
[I 2023-11-03 23:57:11,913] Trial 233 finished with value: 0.242313711130544 and parameters: {'n_estimators': 20, 'learning_rate': 0.8407644358655247, 'max_depth': 3}. Best is trial 133 with value: 0.24134805988183708.
[I 2023-11-03 23:57:11,920] Trial 236 finished with value: 0.2432384505728289 and parameters: {'n_estimators': 20, 'learning_rate': 0.8403740862215661, 'max_depth': 3}. Best is trial 133 with value: 0.24134805988183708.
[I 2023-11-03 23:57:12,031] Trial 318 finished with value: 0.24474476727714886 and parameters: {'n_estimators': 20, 'learning_rate': 0.8779248033106006, 'max_depth': 3}. Best is trial 133 with value: 0.24134805988183708.
[I 2023-11-03 23:57:12,076] Trial 257 finished with value: 0.24359256550676497 and parameters: {'n_estimators': 20, 'learning_rate': 0.8797246747488611, 'max_depth': 4}. Best is trial 133 with value: 0.24134805988183708.
[I 2023-11-03 23:57:12,273] Trial 285 finished with value: 0.24300470950926933 and parameters: {'n_estimators': 500, 'learning_rate': 0.8691990072306692, 'max_depth': 4}. Best is trial 133 with value: 0.24134805988183708.
[I 2023-11-03 23:57:12,284] Trial 302 finished with value: 0.24271779709858368 and parameters: {'n_estimators': 20, 'learning_rate': 0.4631741623049692, 'max_depth': 4}. Best is trial 133 with value: 0.24134805988183708.
[I 2023-11-03 23:57:12,301] Trial 235 finished with value: 0.24236633801734295 and parameters: {'n_estimators': 500, 'learning_rate': 0.8819177004561854, 'max_depth': 4}. Best is trial 133 with value: 0.24134805988183708.
[I 2023-11-03 23:57:12,315] Trial 296 finished with value: 0.24353414426067285 and parameters: {'n_estimators': 20, 'learning_rate': 0.5958082615731211, 'max_depth': 4}. Best is trial 133 with value: 0.24134805988183708.
[I 2023-11-03 23:57:12,391] Trial 276 finished with value: 0.2437764813939496 and parameters: {'n_estimators': 20, 'learning_rate': 0.879732062002315, 'max_depth': 4}. Best is trial 133 with value: 0.24134805988183708.
[I 2023-11-03 23:57:12,414] Trial 301 finished with value: 0.24276751333778876 and parameters: {'n_estimators': 20, 'learning_rate': 0.8771950094481521, 'max_depth': 4}. Best is trial 133 with value: 0.24134805988183708.
[I 2023-11-03 23:57:13,796] Trial 320 finished with value: 0.2424342061810054 and parameters: {'n_estimators': 500, 'learning_rate': 0.6066716130151945, 'max_depth': 4}. Best is trial 133 with value: 0.24134805988183708.
[I 2023-11-03 23:57:13,980] Trial 313 finished with value: 0.24356078758800712 and parameters: {'n_estimators': 500, 'learning_rate': 0.8886660544515478, 'max_depth': 4}. Best is trial 133 with value: 0.24134805988183708.
[I 2023-11-03 23:57:14,755] Trial 290 finished with value: 0.24189108626187586 and parameters: {'n_estimators': 500, 'learning_rate': 0.8907665983377633, 'max_depth': 4}. Best is trial 133 with value: 0.24134805988183708.
[I 2023-11-03 23:57:15,895] Trial 315 finished with value: 0.24252788400548994 and parameters: {'n_estimators': 500, 'learning_rate': 0.8856654170996638, 'max_depth': 4}. Best is trial 133 with value: 0.24134805988183708.
[I 2023-11-03 23:57:19,263] Trial 307 finished with value: 0.24300094738769643 and parameters: {'n_estimators': 500, 'learning_rate': 0.8853407739534557, 'max_depth': 4}. Best is trial 133 with value: 0.24134805988183708.
[I 2023-11-03 23:57:20,313] Trial 317 finished with value: 0.2440167687034899 and parameters: {'n_estimators': 500, 'learning_rate': 0.8823215272101105, 'max_depth': 4}. Best is trial 133 with value: 0.24134805988183708.
[I 2023-11-03 23:57:21,273] Trial 261 finished with value: 0.2431930683717002 and parameters: {'n_estimators': 500, 'learning_rate': 0.8796740447916512, 'max_depth': 4}. Best is trial 133 with value: 0.24134805988183708.
[I 2023-11-03 23:57:23,267] Trial 266 finished with value: 0.24344978004900697 and parameters: {'n_estimators': 500, 'learning_rate': 0.8977194111522911, 'max_depth': 4}. Best is trial 133 with value: 0.24134805988183708.
[I 2023-11-03 23:57:24,932] Trial 303 finished with value: 0.2430114594782293 and parameters: {'n_estimators': 500, 'learning_rate': 0.8815067617850737, 'max_depth': 4}. Best is trial 133 with value: 0.24134805988183708.
[I 2023-11-03 23:57:26,786] Trial 322 finished with value: 0.2429778680369005 and parameters: {'n_estimators': 500, 'learning_rate': 0.878969079458473, 'max_depth': 4}. Best is trial 133 with value: 0.24134805988183708.
[I 2023-11-03 23:57:27,788] Trial 304 finished with value: 0.24424417207105234 and parameters: {'n_estimators': 500, 'learning_rate': 0.4581277288655455, 'max_depth': 4}. Best is trial 133 with value: 0.24134805988183708.
[I 2023-11-03 23:57:29,012] Trial 312 finished with value: 0.24255854125301402 and parameters: {'n_estimators': 500, 'learning_rate': 0.8869748133528428, 'max_depth': 4}. Best is trial 133 with value: 0.24134805988183708.
[I 2023-11-03 23:57:31,632] Trial 238 finished with value: 0.24347803123766557 and parameters: {'n_estimators': 500, 'learning_rate': 0.8946747413504332, 'max_depth': 4}. Best is trial 133 with value: 0.24134805988183708.
[I 2023-11-03 23:57:33,216] Trial 308 finished with value: 0.24312424930016183 and parameters: {'n_estimators': 500, 'learning_rate': 0.8973871895111476, 'max_depth': 4}. Best is trial 133 with value: 0.24134805988183708.
[I 2023-11-03 23:57:33,877] Trial 324 finished with value: 0.24305269803143006 and parameters: {'n_estimators': 500, 'learning_rate': 0.88819711594202, 'max_depth': 4}. Best is trial 133 with value: 0.24134805988183708.
[I 2023-11-03 23:57:34,848] Trial 309 finished with value: 0.24395665106889156 and parameters: {'n_estimators': 500, 'learning_rate': 0.8880324197446129, 'max_depth': 1}. Best is trial 133 with value: 0.24134805988183708.
[I 2023-11-03 23:57:34,878] Trial 325 finished with value: 0.2427142313224485 and parameters: {'n_estimators': 500, 'learning_rate': 0.871506148232573, 'max_depth': 1}. Best is trial 133 with value: 0.24134805988183708.
[I 2023-11-03 23:57:36,471] Trial 279 finished with value: 0.2427663094974132 and parameters: {'n_estimators': 500, 'learning_rate': 0.8052818670242455, 'max_depth': 1}. Best is trial 133 with value: 0.24134805988183708.
[I 2023-11-03 23:57:36,636] Trial 311 finished with value: 0.242899920533876 and parameters: {'n_estimators': 500, 'learning_rate': 0.8878535879243425, 'max_depth': 1}. Best is trial 133 with value: 0.24134805988183708.
[I 2023-11-03 23:57:37,862] Trial 242 finished with value: 0.24339634495300155 and parameters: {'n_estimators': 500, 'learning_rate': 0.8848430147992363, 'max_depth': 1}. Best is trial 133 with value: 0.24134805988183708.
[I 2023-11-03 23:57:37,881] Trial 319 finished with value: 0.24494748626442142 and parameters: {'n_estimators': 500, 'learning_rate': 0.8923233639338879, 'max_depth': 1}. Best is trial 133 with value: 0.24134805988183708.
[I 2023-11-03 23:57:38,261] Trial 250 finished with value: 0.24311647986739926 and parameters: {'n_estimators': 500, 'learning_rate': 0.8979327496382631, 'max_depth': 1}. Best is trial 133 with value: 0.24134805988183708.
[I 2023-11-03 23:57:38,498] Trial 326 finished with value: 0.24269105686362744 and parameters: {'n_estimators': 500, 'learning_rate': 0.913787662912302, 'max_depth': 1}. Best is trial 133 with value: 0.24134805988183708.
[I 2023-11-03 23:57:39,089] Trial 316 finished with value: 0.24294977518998442 and parameters: {'n_estimators': 500, 'learning_rate': 0.8907480325175076, 'max_depth': 1}. Best is trial 133 with value: 0.24134805988183708.
[I 2023-11-03 23:57:39,727] Trial 327 finished with value: 0.24157548651703056 and parameters: {'n_estimators': 500, 'learning_rate': 0.8986217212134644, 'max_depth': 1}. Best is trial 133 with value: 0.24134805988183708.
[I 2023-11-03 23:57:40,110] Trial 310 finished with value: 0.24376697064187 and parameters: {'n_estimators': 500, 'learning_rate': 0.8878512432594547, 'max_depth': 1}. Best is trial 133 with value: 0.24134805988183708.
[I 2023-11-03 23:57:40,263] Trial 323 finished with value: 0.24406174159620928 and parameters: {'n_estimators': 500, 'learning_rate': 0.8982473478689942, 'max_depth': 1}. Best is trial 133 with value: 0.24134805988183708.
[I 2023-11-03 23:57:40,404] Trial 232 finished with value: 0.24308345962142142 and parameters: {'n_estimators': 500, 'learning_rate': 0.8999549547866653, 'max_depth': 1}. Best is trial 133 with value: 0.24134805988183708.
[I 2023-11-03 23:57:40,418] Trial 321 finished with value: 0.24340036633731033 and parameters: {'n_estimators': 500, 'learning_rate': 0.8123939831283342, 'max_depth': 1}. Best is trial 133 with value: 0.24134805988183708.
[I 2023-11-03 23:57:40,547] Using an existing study with name 'RF' instead of creating a new one.
[I 2023-11-04 00:02:43,230] Trial 251 finished with value: 0.2371855253214735 and parameters: {'n_estimators': 500, 'max_features': 'log2', 'max_depth': 4}. Best is trial 264 with value: 0.23576587037781305.
[I 2023-11-04 00:02:43,231] Trial 242 finished with value: 0.23719634667346765 and parameters: {'n_estimators': 500, 'max_features': 'log2', 'max_depth': 4}. Best is trial 264 with value: 0.23576587037781305.
