[I 2023-11-03 20:11:24,895] Trial 375 finished with value: 0.15288410053742316 and parameters: {'alpha': 0.8060760782543314, 'gamma': 8.055174333952375e-15, 'kernel': 'linear'}. Best is trial 308 with value: 0.14715496668535533.
[I 2023-11-03 20:11:24,933] Trial 364 finished with value: 0.16389327099215587 and parameters: {'alpha': 0.2614265780647359, 'gamma': 5.908196573187785e-15, 'kernel': 'linear'}. Best is trial 308 with value: 0.14715496668535533.
[I 2023-11-03 20:11:25,146] Trial 314 finished with value: 0.17350810203272463 and parameters: {'alpha': 0.27270328415965317, 'gamma': 6.874325218564674e-15, 'kernel': 'linear'}. Best is trial 308 with value: 0.14715496668535533.
[I 2023-11-03 20:11:26,239] Trial 321 finished with value: 0.17599186900423758 and parameters: {'alpha': 0.2620666801683813, 'gamma': 5.8721201760769565e-15, 'kernel': 'linear'}. Best is trial 333 with value: 0.14039191190246494.
[I 2023-11-03 20:11:26,897] Trial 308 finished with value: 0.14715496668535533 and parameters: {'alpha': 0.8699032397044457, 'gamma': 6.9107369410210516e-15, 'kernel': 'linear'}. Best is trial 333 with value: 0.14039191190246494.
[I 2023-11-03 20:11:26,962] Trial 381 finished with value: 0.1500289058757845 and parameters: {'alpha': 0.5268768129284741, 'gamma': 5.922736747451254e-15, 'kernel': 'linear'}. Best is trial 333 with value: 0.14039191190246494.
[I 2023-11-03 20:11:27,460] Trial 341 finished with value: 0.1589463336015777 and parameters: {'alpha': 0.8711181369711308, 'gamma': 6.9407173047822785e-15, 'kernel': 'linear'}. Best is trial 333 with value: 0.14039191190246494.
[I 2023-11-03 20:11:27,725] Trial 350 finished with value: 0.1704288103941817 and parameters: {'alpha': 0.2560855719382329, 'gamma': 8.066467716095119e-15, 'kernel': 'linear'}. Best is trial 333 with value: 0.14039191190246494.
[I 2023-11-03 20:11:27,976] Trial 304 finished with value: 0.15370986123606586 and parameters: {'alpha': 0.2532553182837852, 'gamma': 5.913808602639654e-15, 'kernel': 'linear'}. Best is trial 333 with value: 0.14039191190246494.
[I 2023-11-03 20:11:28,478] Trial 354 finished with value: 0.1583546507119856 and parameters: {'alpha': 0.24857595237419364, 'gamma': 1.890084406477999e-15, 'kernel': 'linear'}. Best is trial 333 with value: 0.14039191190246494.
[I 2023-11-03 20:11:28,506] Trial 356 finished with value: 0.16295381303820144 and parameters: {'alpha': 0.269521146517773, 'gamma': 6.90761690037163e-15, 'kernel': 'linear'}. Best is trial 333 with value: 0.14039191190246494.
[I 2023-11-03 20:11:28,538] Trial 307 finished with value: 0.18343976238571721 and parameters: {'alpha': 0.8704674504234556, 'gamma': 6.760555377898858e-15, 'kernel': 'linear'}. Best is trial 333 with value: 0.14039191190246494.
[I 2023-11-03 20:11:28,617] Trial 309 finished with value: 0.1644242739040436 and parameters: {'alpha': 0.30197919699738573, 'gamma': 5.922525363472758e-15, 'kernel': 'linear'}. Best is trial 333 with value: 0.14039191190246494.
[I 2023-11-03 20:11:28,620] Trial 359 finished with value: 0.14968493413153286 and parameters: {'alpha': 0.7465930065588803, 'gamma': 6.94826671298217e-15, 'kernel': 'linear'}. Best is trial 333 with value: 0.14039191190246494.
[I 2023-11-03 20:11:28,629] Trial 363 finished with value: 0.16929222890946174 and parameters: {'alpha': 0.2685773977253034, 'gamma': 6.764240981003344e-15, 'kernel': 'linear'}. Best is trial 333 with value: 0.14039191190246494.
[I 2023-11-03 20:11:28,768] Trial 313 finished with value: 0.1533605061037272 and parameters: {'alpha': 0.8960246544474295, 'gamma': 6.749662575069441e-15, 'kernel': 'linear'}. Best is trial 333 with value: 0.14039191190246494.
[I 2023-11-03 20:11:28,792] Trial 320 finished with value: 0.15936136255395586 and parameters: {'alpha': 0.8561045703611871, 'gamma': 7.162495830605971e-15, 'kernel': 'linear'}. Best is trial 333 with value: 0.14039191190246494.
[I 2023-11-03 20:11:28,794] Trial 358 finished with value: 0.16114388617285985 and parameters: {'alpha': 0.8879191482482065, 'gamma': 6.966427495610038e-15, 'kernel': 'linear'}. Best is trial 333 with value: 0.14039191190246494.
[I 2023-11-03 20:11:28,814] Trial 357 finished with value: 0.17776152674398235 and parameters: {'alpha': 0.8230634792403535, 'gamma': 5.895898781489645e-15, 'kernel': 'linear'}. Best is trial 333 with value: 0.14039191190246494.
[I 2023-11-03 20:11:28,830] Trial 324 finished with value: 0.15305021086304482 and parameters: {'alpha': 0.8745919350068597, 'gamma': 8.070618376924226e-15, 'kernel': 'linear'}. Best is trial 333 with value: 0.14039191190246494.
[I 2023-11-03 20:11:28,847] Trial 373 finished with value: 0.15787213623255295 and parameters: {'alpha': 0.8779354833111244, 'gamma': 6.734847410438136e-15, 'kernel': 'linear'}. Best is trial 333 with value: 0.14039191190246494.
[I 2023-11-03 20:11:28,974] Trial 387 finished with value: 0.15864066210229352 and parameters: {'alpha': 0.8201520130970855, 'gamma': 8.096708098165801e-15, 'kernel': 'linear'}. Best is trial 333 with value: 0.14039191190246494.
[I 2023-11-03 20:11:29,112] Trial 369 finished with value: 0.15908711895413133 and parameters: {'alpha': 0.24116204959852774, 'gamma': 6.752419397164592e-15, 'kernel': 'linear'}. Best is trial 333 with value: 0.14039191190246494.
[I 2023-11-03 20:11:29,114] Trial 325 finished with value: 0.15809228005405226 and parameters: {'alpha': 0.8809448279268866, 'gamma': 6.962100162558685e-15, 'kernel': 'linear'}. Best is trial 333 with value: 0.14039191190246494.
[I 2023-11-03 20:11:29,117] Trial 365 finished with value: 0.1487974437298001 and parameters: {'alpha': 0.9293023904314254, 'gamma': 6.668920031611467e-15, 'kernel': 'linear'}. Best is trial 333 with value: 0.14039191190246494.
[I 2023-11-03 20:11:29,120] Trial 330 finished with value: 0.16289970535726223 and parameters: {'alpha': 0.8764405153959584, 'gamma': 6.912974189163878e-15, 'kernel': 'linear'}. Best is trial 333 with value: 0.14039191190246494.
[I 2023-11-03 20:11:29,168] Trial 323 finished with value: 0.1599924108210957 and parameters: {'alpha': 0.8187981698882107, 'gamma': 6.907849031759857e-15, 'kernel': 'linear'}. Best is trial 333 with value: 0.14039191190246494.
[I 2023-11-03 20:11:29,477] Trial 389 finished with value: 0.14692187947229748 and parameters: {'alpha': 0.8706539420397903, 'gamma': 7.39938039584076e-15, 'kernel': 'linear'}. Best is trial 333 with value: 0.14039191190246494.
[I 2023-11-03 20:11:29,503] Trial 331 finished with value: 0.15991415203982837 and parameters: {'alpha': 0.8653806870844554, 'gamma': 6.984763126516664e-15, 'kernel': 'linear'}. Best is trial 333 with value: 0.14039191190246494.
[I 2023-11-03 20:11:29,706] Trial 336 finished with value: 0.1788533756777196 and parameters: {'alpha': 0.5231085289487725, 'gamma': 6.87280956656224e-15, 'kernel': 'linear'}. Best is trial 333 with value: 0.14039191190246494.
[I 2023-11-03 20:11:29,892] Trial 342 finished with value: 0.17258871296248635 and parameters: {'alpha': 0.8220214274228289, 'gamma': 8.388530333176392e-15, 'kernel': 'linear'}. Best is trial 333 with value: 0.14039191190246494.
[I 2023-11-03 20:11:29,950] Trial 332 finished with value: 0.16184956520644847 and parameters: {'alpha': 0.30014966544825894, 'gamma': 8.085709994010622e-15, 'kernel': 'linear'}. Best is trial 333 with value: 0.14039191190246494.
[I 2023-11-03 20:11:30,047] Trial 385 finished with value: 0.16612041211179188 and parameters: {'alpha': 0.8742183648314523, 'gamma': 8.098800349968816e-15, 'kernel': 'linear'}. Best is trial 333 with value: 0.14039191190246494.
[I 2023-11-03 20:11:30,611] Trial 303 finished with value: 0.16664450498529507 and parameters: {'alpha': 0.816009848392918, 'gamma': 8.095671614830365e-15, 'kernel': 'linear'}. Best is trial 333 with value: 0.14039191190246494.
[I 2023-11-03 20:11:30,639] Trial 345 finished with value: 0.15206644102600483 and parameters: {'alpha': 0.2531712738232085, 'gamma': 6.967055696447246e-15, 'kernel': 'linear'}. Best is trial 333 with value: 0.14039191190246494.
[I 2023-11-03 20:11:30,658] Trial 343 finished with value: 0.1656362068675391 and parameters: {'alpha': 0.9094046737819277, 'gamma': 7.037537027910684e-15, 'kernel': 'linear'}. Best is trial 333 with value: 0.14039191190246494.
[I 2023-11-03 20:11:30,674] Trial 383 finished with value: 0.16584540218650856 and parameters: {'alpha': 0.8720599339788035, 'gamma': 8.257940459627356e-15, 'kernel': 'linear'}. Best is trial 333 with value: 0.14039191190246494.
[I 2023-11-03 20:11:30,676] Trial 319 finished with value: 0.1709086539118834 and parameters: {'alpha': 0.8483150556351827, 'gamma': 7.247457725781507e-15, 'kernel': 'linear'}. Best is trial 333 with value: 0.14039191190246494.
[I 2023-11-03 20:11:30,725] Trial 360 finished with value: 0.15989710766044543 and parameters: {'alpha': 0.8905723694313804, 'gamma': 7.295173884946924e-15, 'kernel': 'linear'}. Best is trial 333 with value: 0.14039191190246494.
[I 2023-11-03 20:11:30,728] Trial 376 finished with value: 0.16422346002564234 and parameters: {'alpha': 0.8973542184497769, 'gamma': 6.742975328273899e-15, 'kernel': 'linear'}. Best is trial 333 with value: 0.14039191190246494.
[I 2023-11-03 20:11:30,767] Trial 322 finished with value: 0.1776234999481429 and parameters: {'alpha': 0.8660825503214684, 'gamma': 7.274989064696548e-15, 'kernel': 'linear'}. Best is trial 333 with value: 0.14039191190246494.
[I 2023-11-03 20:11:30,795] Trial 386 finished with value: 0.15509049493432492 and parameters: {'alpha': 0.8443019624248242, 'gamma': 8.092010857392682e-15, 'kernel': 'linear'}. Best is trial 333 with value: 0.14039191190246494.
[I 2023-11-03 20:11:30,816] Trial 312 finished with value: 0.17269707775397292 and parameters: {'alpha': 0.7996545593370645, 'gamma': 7.214533169060648e-15, 'kernel': 'linear'}. Best is trial 333 with value: 0.14039191190246494.
[I 2023-11-03 20:11:30,819] Trial 367 finished with value: 0.1589574529334469 and parameters: {'alpha': 0.8644815336449997, 'gamma': 7.502053247122154e-15, 'kernel': 'linear'}. Best is trial 333 with value: 0.14039191190246494.
[I 2023-11-03 20:11:30,836] Trial 318 finished with value: 0.16330905232491258 and parameters: {'alpha': 0.27076655383661463, 'gamma': 6.932513244892971e-15, 'kernel': 'linear'}. Best is trial 333 with value: 0.14039191190246494.
[I 2023-11-03 20:11:30,839] Trial 351 finished with value: 0.16033643672358255 and parameters: {'alpha': 0.7866693048156754, 'gamma': 8.164779844944633e-15, 'kernel': 'linear'}. Best is trial 333 with value: 0.14039191190246494.
[I 2023-11-03 20:11:30,946] Trial 340 finished with value: 0.15684961228800942 and parameters: {'alpha': 0.8048222187228665, 'gamma': 7.320279314493962e-15, 'kernel': 'linear'}. Best is trial 333 with value: 0.14039191190246494.
[I 2023-11-03 20:11:30,985] Trial 329 finished with value: 0.1712860943874571 and parameters: {'alpha': 0.2659085670241939, 'gamma': 5.938732682904899e-15, 'kernel': 'linear'}. Best is trial 333 with value: 0.14039191190246494.
[I 2023-11-03 20:11:30,986] Trial 390 finished with value: 0.14935276334407363 and parameters: {'alpha': 0.8005905681533548, 'gamma': 7.229966360823748e-15, 'kernel': 'linear'}. Best is trial 333 with value: 0.14039191190246494.
[I 2023-11-03 20:11:31,018] Trial 374 finished with value: 0.18002237515986627 and parameters: {'alpha': 0.9044867313743066, 'gamma': 7.238434029509708e-15, 'kernel': 'linear'}. Best is trial 333 with value: 0.14039191190246494.
[I 2023-11-03 20:11:31,059] Trial 335 finished with value: 0.14566250408219736 and parameters: {'alpha': 0.7893272346323579, 'gamma': 7.196378850932168e-15, 'kernel': 'linear'}. Best is trial 333 with value: 0.14039191190246494.
[I 2023-11-03 20:11:31,095] Trial 379 finished with value: 0.1593690744851595 and parameters: {'alpha': 0.8293457758407727, 'gamma': 7.066259220788541e-15, 'kernel': 'linear'}. Best is trial 333 with value: 0.14039191190246494.
[I 2023-11-03 20:11:31,152] Trial 334 finished with value: 0.17714245798258774 and parameters: {'alpha': 0.8507236588103297, 'gamma': 7.112419982602128e-15, 'kernel': 'linear'}. Best is trial 333 with value: 0.14039191190246494.
[I 2023-11-03 20:11:31,200] Trial 361 finished with value: 0.16422938274154741 and parameters: {'alpha': 0.9121167809203123, 'gamma': 7.322588282890285e-15, 'kernel': 'linear'}. Best is trial 333 with value: 0.14039191190246494.
[I 2023-11-03 20:11:31,223] Trial 344 finished with value: 0.1720107095981287 and parameters: {'alpha': 0.8252888866984232, 'gamma': 8.132435073932965e-15, 'kernel': 'linear'}. Best is trial 333 with value: 0.14039191190246494.
[I 2023-11-03 20:11:31,224] Trial 305 finished with value: 0.1496837450935122 and parameters: {'alpha': 0.8528767454132951, 'gamma': 8.112277621563126e-15, 'kernel': 'linear'}. Best is trial 333 with value: 0.14039191190246494.
[I 2023-11-03 20:11:31,280] Trial 353 finished with value: 0.1514367071715754 and parameters: {'alpha': 0.8836580326942098, 'gamma': 7.278669147551486e-15, 'kernel': 'linear'}. Best is trial 333 with value: 0.14039191190246494.
[I 2023-11-03 20:11:31,287] Trial 368 finished with value: 0.1766325758332442 and parameters: {'alpha': 0.9090738734184332, 'gamma': 7.474751598769167e-15, 'kernel': 'laplacian'}. Best is trial 333 with value: 0.14039191190246494.
[I 2023-11-03 20:11:31,302] Trial 333 finished with value: 0.14039191190246494 and parameters: {'alpha': 0.8885343342282718, 'gamma': 8.132642982952687e-15, 'kernel': 'linear'}. Best is trial 333 with value: 0.14039191190246494.
[I 2023-11-03 20:11:31,314] Trial 378 finished with value: 0.1611176294629482 and parameters: {'alpha': 0.8483604851267808, 'gamma': 7.634121054601176e-15, 'kernel': 'linear'}. Best is trial 333 with value: 0.14039191190246494.
[I 2023-11-03 20:11:31,373] Trial 380 finished with value: 0.1544187217386328 and parameters: {'alpha': 0.7974204992326127, 'gamma': 7.222020393396705e-15, 'kernel': 'linear'}. Best is trial 333 with value: 0.14039191190246494.
[I 2023-11-03 20:11:31,396] Trial 392 finished with value: 0.16923677783202729 and parameters: {'alpha': 0.8858508223114563, 'gamma': 7.554599531647743e-15, 'kernel': 'linear'}. Best is trial 333 with value: 0.14039191190246494.
[I 2023-11-03 20:11:31,480] Trial 337 finished with value: 0.17027087478247663 and parameters: {'alpha': 0.918048946922129, 'gamma': 7.733232948879766e-15, 'kernel': 'laplacian'}. Best is trial 333 with value: 0.14039191190246494.
[I 2023-11-03 20:11:31,482] Trial 362 finished with value: 0.1471840726619291 and parameters: {'alpha': 0.9220119118646309, 'gamma': 7.416508450875814e-15, 'kernel': 'laplacian'}. Best is trial 333 with value: 0.14039191190246494.
[I 2023-11-03 20:11:31,486] Trial 384 finished with value: 0.1875251763400093 and parameters: {'alpha': 0.9068046905182736, 'gamma': 7.357674450701916e-15, 'kernel': 'laplacian'}. Best is trial 333 with value: 0.14039191190246494.
[I 2023-11-03 20:11:31,506] Trial 352 finished with value: 0.17078244481107063 and parameters: {'alpha': 0.9179623634419032, 'gamma': 7.445422605088429e-15, 'kernel': 'laplacian'}. Best is trial 333 with value: 0.14039191190246494.
[I 2023-11-03 20:11:31,532] Trial 355 finished with value: 0.14961470201891325 and parameters: {'alpha': 0.9262389769557309, 'gamma': 7.462616876318269e-15, 'kernel': 'laplacian'}. Best is trial 333 with value: 0.14039191190246494.
[I 2023-11-03 20:11:31,540] Trial 339 finished with value: 0.17331984123568148 and parameters: {'alpha': 0.9125703556129475, 'gamma': 7.780275174626204e-15, 'kernel': 'laplacian'}. Best is trial 333 with value: 0.14039191190246494.
[I 2023-11-03 20:11:31,549] Trial 395 finished with value: 0.15562351356013224 and parameters: {'alpha': 0.9284016630026842, 'gamma': 7.58395514901593e-15, 'kernel': 'laplacian'}. Best is trial 333 with value: 0.14039191190246494.
[I 2023-11-03 20:11:31,555] Trial 349 finished with value: 0.16394571683943462 and parameters: {'alpha': 0.832878798919439, 'gamma': 8.197452439899627e-15, 'kernel': 'linear'}. Best is trial 333 with value: 0.14039191190246494.
[I 2023-11-03 20:11:31,704] Trial 399 finished with value: 0.1578269919982788 and parameters: {'alpha': 0.8408836966668328, 'gamma': 7.495197743686812e-15, 'kernel': 'laplacian'}. Best is trial 333 with value: 0.14039191190246494.
[I 2023-11-03 20:11:31,814] Trial 306 finished with value: 0.155028461183406 and parameters: {'alpha': 0.9300542246148007, 'gamma': 7.571378636933613e-15, 'kernel': 'laplacian'}. Best is trial 333 with value: 0.14039191190246494.
[I 2023-11-03 20:11:31,836] Trial 328 finished with value: 0.184009577539898 and parameters: {'alpha': 0.9002714137262586, 'gamma': 7.75067654217469e-15, 'kernel': 'laplacian'}. Best is trial 333 with value: 0.14039191190246494.
[I 2023-11-03 20:11:31,856] Trial 388 finished with value: 0.16568879528809055 and parameters: {'alpha': 0.9165071534807476, 'gamma': 7.525533041239865e-15, 'kernel': 'laplacian'}. Best is trial 333 with value: 0.14039191190246494.
[I 2023-11-03 20:11:31,906] Trial 391 finished with value: 0.1693064749259174 and parameters: {'alpha': 0.8486308016646648, 'gamma': 7.552066113236771e-15, 'kernel': 'laplacian'}. Best is trial 333 with value: 0.14039191190246494.
[I 2023-11-03 20:11:31,913] Trial 348 finished with value: 0.1713056874749691 and parameters: {'alpha': 0.918436104088267, 'gamma': 7.357239935004309e-15, 'kernel': 'laplacian'}. Best is trial 333 with value: 0.14039191190246494.
[I 2023-11-03 20:11:31,914] Trial 394 finished with value: 0.1445857644567614 and parameters: {'alpha': 0.933791270577209, 'gamma': 7.700940203921613e-15, 'kernel': 'laplacian'}. Best is trial 333 with value: 0.14039191190246494.
[I 2023-11-03 20:11:31,982] Trial 316 finished with value: 0.16247655935260424 and parameters: {'alpha': 0.9138329400545808, 'gamma': 7.424439808350996e-15, 'kernel': 'laplacian'}. Best is trial 333 with value: 0.14039191190246494.
[I 2023-11-03 20:11:31,984] Trial 396 finished with value: 0.169405530442747 and parameters: {'alpha': 0.9244117483658922, 'gamma': 7.823823874690254e-15, 'kernel': 'laplacian'}. Best is trial 333 with value: 0.14039191190246494.
[I 2023-11-03 20:11:32,014] Trial 315 finished with value: 0.15318468827261233 and parameters: {'alpha': 0.8377913064336284, 'gamma': 7.725681250946185e-15, 'kernel': 'laplacian'}. Best is trial 333 with value: 0.14039191190246494.
[I 2023-11-03 20:11:32,084] Trial 326 finished with value: 0.16066872787256214 and parameters: {'alpha': 0.8969279041057103, 'gamma': 7.18598057321917e-15, 'kernel': 'linear'}. Best is trial 333 with value: 0.14039191190246494.
[I 2023-11-03 20:11:32,112] Trial 382 finished with value: 0.17043526957362642 and parameters: {'alpha': 0.842178271463504, 'gamma': 7.726230408735383e-15, 'kernel': 'laplacian'}. Best is trial 333 with value: 0.14039191190246494.
[I 2023-11-03 20:11:32,117] Trial 377 finished with value: 0.15327846044615082 and parameters: {'alpha': 0.8451310405151908, 'gamma': 7.55967290851425e-15, 'kernel': 'laplacian'}. Best is trial 333 with value: 0.14039191190246494.
[I 2023-11-03 20:11:32,138] Trial 398 finished with value: 0.15557252986675182 and parameters: {'alpha': 0.9304993088334104, 'gamma': 7.701532345398379e-15, 'kernel': 'laplacian'}. Best is trial 333 with value: 0.14039191190246494.
[I 2023-11-03 20:11:32,149] Trial 302 finished with value: 0.15428323239558234 and parameters: {'alpha': 0.9582459667680985, 'gamma': 7.825548230382257e-15, 'kernel': 'laplacian'}. Best is trial 333 with value: 0.14039191190246494.
[I 2023-11-03 20:11:32,178] Trial 393 finished with value: 0.15966816511025989 and parameters: {'alpha': 0.9009235464248208, 'gamma': 7.889174889229944e-15, 'kernel': 'laplacian'}. Best is trial 333 with value: 0.14039191190246494.
[I 2023-11-03 20:11:32,192] Trial 371 finished with value: 0.14377768018134549 and parameters: {'alpha': 0.9067140190119777, 'gamma': 7.431284035251602e-15, 'kernel': 'laplacian'}. Best is trial 333 with value: 0.14039191190246494.
[I 2023-11-03 20:11:32,598] Trial 347 finished with value: 0.15245305490683939 and parameters: {'alpha': 0.7951526002467862, 'gamma': 7.56163856258463e-15, 'kernel': 'laplacian'}. Best is trial 333 with value: 0.14039191190246494.
[I 2023-11-03 20:11:32,611] Trial 311 finished with value: 0.16990755798328794 and parameters: {'alpha': 0.9324201337340079, 'gamma': 7.807805142825439e-15, 'kernel': 'linear'}. Best is trial 333 with value: 0.14039191190246494.
[I 2023-11-03 20:11:32,781] Trial 317 finished with value: 0.151271665670653 and parameters: {'alpha': 0.9182903085550502, 'gamma': 7.500754602825213e-15, 'kernel': 'laplacian'}. Best is trial 333 with value: 0.14039191190246494.
[I 2023-11-03 20:11:32,788] Trial 370 finished with value: 0.15470171452030834 and parameters: {'alpha': 0.9403099894040866, 'gamma': 7.542775377529295e-15, 'kernel': 'laplacian'}. Best is trial 333 with value: 0.14039191190246494.
[I 2023-11-03 20:11:32,851] Trial 372 finished with value: 0.1753561983674186 and parameters: {'alpha': 0.8478167994916291, 'gamma': 7.75868192965509e-15, 'kernel': 'laplacian'}. Best is trial 333 with value: 0.14039191190246494.
[I 2023-11-03 20:11:32,884] Trial 366 finished with value: 0.1563589990398213 and parameters: {'alpha': 0.757515009464869, 'gamma': 7.66869818357092e-15, 'kernel': 'laplacian'}. Best is trial 333 with value: 0.14039191190246494.
[I 2023-11-03 20:11:32,958] Trial 401 finished with value: 0.1652052846118969 and parameters: {'alpha': 0.9400395995556504, 'gamma': 7.845033765113586e-15, 'kernel': 'linear'}. Best is trial 333 with value: 0.14039191190246494.
[I 2023-11-03 20:11:32,962] Trial 400 finished with value: 0.1515138720400213 and parameters: {'alpha': 0.9324369972359923, 'gamma': 7.691607005308541e-15, 'kernel': 'linear'}. Best is trial 333 with value: 0.14039191190246494.
