[I 2023-11-03 20:14:19,989] Trial 309 finished with value: 0.16875267598281182 and parameters: {'n_estimators': 200, 'learning_rate': 0.15466413866128434, 'max_depth': 3}. Best is trial 332 with value: 0.14253886734486645.
[I 2023-11-03 20:14:19,992] Trial 367 finished with value: 0.1760616012989833 and parameters: {'n_estimators': 200, 'learning_rate': 0.07875203160817235, 'max_depth': 3}. Best is trial 332 with value: 0.14253886734486645.
[I 2023-11-03 20:14:20,001] Trial 364 finished with value: 0.17326135282427046 and parameters: {'n_estimators': 200, 'learning_rate': 0.8881449099244928, 'max_depth': 3}. Best is trial 332 with value: 0.14253886734486645.
[I 2023-11-03 20:14:20,131] Using an existing study with name 'RF' instead of creating a new one.
[I 2023-11-03 20:17:11,013] Trial 292 finished with value: 0.1656748824568539 and parameters: {'n_estimators': 500, 'max_features': 'auto', 'max_depth': 4}. Best is trial 294 with value: 0.15193967719153859.
[I 2023-11-03 20:17:11,020] Trial 284 finished with value: 0.17537888863286555 and parameters: {'n_estimators': 500, 'max_features': 'auto', 'max_depth': 3}. Best is trial 294 with value: 0.15193967719153859.
[I 2023-11-03 20:17:11,046] Trial 288 finished with value: 0.1750365304708776 and parameters: {'n_estimators': 500, 'max_features': 'auto', 'max_depth': 3}. Best is trial 294 with value: 0.15193967719153859.
[I 2023-11-03 20:17:11,066] Trial 309 finished with value: 0.16203445840335542 and parameters: {'n_estimators': 500, 'max_features': 'auto', 'max_depth': 3}. Best is trial 294 with value: 0.15193967719153859.
[I 2023-11-03 20:17:11,071] Trial 298 finished with value: 0.15549891279210779 and parameters: {'n_estimators': 500, 'max_features': 'auto', 'max_depth': 3}. Best is trial 294 with value: 0.15193967719153859.
[I 2023-11-03 20:17:12,783] Trial 280 finished with value: 0.15307749325625372 and parameters: {'n_estimators': 500, 'max_features': 'auto', 'max_depth': 3}. Best is trial 294 with value: 0.15193967719153859.
[I 2023-11-03 20:17:25,299] Trial 326 finished with value: 0.1731319410564527 and parameters: {'n_estimators': 500, 'max_features': 'auto', 'max_depth': 3}. Best is trial 294 with value: 0.15193967719153859.
[I 2023-11-03 20:17:40,518] Trial 282 finished with value: 0.1628170151245397 and parameters: {'n_estimators': 500, 'max_features': 'auto', 'max_depth': 3}. Best is trial 294 with value: 0.15193967719153859.
[I 2023-11-03 20:17:40,608] Trial 333 finished with value: 0.19118571964971634 and parameters: {'n_estimators': 500, 'max_features': 'auto', 'max_depth': 3}. Best is trial 294 with value: 0.15193967719153859.
[I 2023-11-03 20:17:49,984] Trial 296 finished with value: 0.15419998512420666 and parameters: {'n_estimators': 500, 'max_features': 'auto', 'max_depth': 3}. Best is trial 283 with value: 0.15093152257120881.
[I 2023-11-03 20:17:50,869] Trial 300 finished with value: 0.1793886528276548 and parameters: {'n_estimators': 500, 'max_features': 'auto', 'max_depth': 3}. Best is trial 283 with value: 0.15093152257120881.
[I 2023-11-03 20:17:55,975] Trial 295 finished with value: 0.17814023306422086 and parameters: {'n_estimators': 500, 'max_features': 'auto', 'max_depth': 3}. Best is trial 283 with value: 0.15093152257120881.
[I 2023-11-03 20:17:57,446] Trial 306 finished with value: 0.1789917747736045 and parameters: {'n_estimators': 500, 'max_features': 'auto', 'max_depth': 3}. Best is trial 283 with value: 0.15093152257120881.
[I 2023-11-03 20:17:57,448] Trial 338 finished with value: 0.16481193744244038 and parameters: {'n_estimators': 500, 'max_features': 'auto', 'max_depth': 3}. Best is trial 283 with value: 0.15093152257120881.
[I 2023-11-03 20:17:59,032] Trial 305 finished with value: 0.16651406309427183 and parameters: {'n_estimators': 500, 'max_features': 'auto', 'max_depth': 5}. Best is trial 283 with value: 0.15093152257120881.
[I 2023-11-03 20:18:01,217] Trial 315 finished with value: 0.15470553937905582 and parameters: {'n_estimators': 500, 'max_features': 'auto', 'max_depth': 3}. Best is trial 283 with value: 0.15093152257120881.
[I 2023-11-03 20:18:04,029] Trial 317 finished with value: 0.16575070095178404 and parameters: {'n_estimators': 500, 'max_features': 'auto', 'max_depth': 4}. Best is trial 283 with value: 0.15093152257120881.
[I 2023-11-03 20:18:11,199] Trial 325 finished with value: 0.15450868914880667 and parameters: {'n_estimators': 500, 'max_features': 'auto', 'max_depth': 3}. Best is trial 283 with value: 0.15093152257120881.
[I 2023-11-03 20:18:15,818] Trial 271 finished with value: 0.19332833129767146 and parameters: {'n_estimators': 500, 'max_features': 'auto', 'max_depth': 3}. Best is trial 283 with value: 0.15093152257120881.
[I 2023-11-03 20:18:15,820] Trial 328 finished with value: 0.1572353650100717 and parameters: {'n_estimators': 500, 'max_features': 'auto', 'max_depth': 3}. Best is trial 283 with value: 0.15093152257120881.
[I 2023-11-03 20:18:16,506] Trial 329 finished with value: 0.15202692203454715 and parameters: {'n_estimators': 500, 'max_features': 'auto', 'max_depth': 4}. Best is trial 283 with value: 0.15093152257120881.
[I 2023-11-03 20:18:17,953] Trial 272 finished with value: 0.15969606755621946 and parameters: {'n_estimators': 500, 'max_features': 'auto', 'max_depth': 3}. Best is trial 283 with value: 0.15093152257120881.
[I 2023-11-03 20:18:17,956] Trial 331 finished with value: 0.18245033598942825 and parameters: {'n_estimators': 500, 'max_features': 'auto', 'max_depth': 3}. Best is trial 283 with value: 0.15093152257120881.
[I 2023-11-03 20:18:30,461] Trial 286 finished with value: 0.2034352922921586 and parameters: {'n_estimators': 500, 'max_features': 'auto', 'max_depth': 4}. Best is trial 283 with value: 0.15093152257120881.
[I 2023-11-03 20:18:31,621] Trial 287 finished with value: 0.15885809550728847 and parameters: {'n_estimators': 500, 'max_features': 'auto', 'max_depth': 5}. Best is trial 283 with value: 0.15093152257120881.
[I 2023-11-03 20:18:33,620] Trial 299 finished with value: 0.17544015863433918 and parameters: {'n_estimators': 500, 'max_features': 'auto', 'max_depth': 3}. Best is trial 283 with value: 0.15093152257120881.
[I 2023-11-03 20:18:34,703] Trial 283 finished with value: 0.15093152257120881 and parameters: {'n_estimators': 500, 'max_features': 'auto', 'max_depth': 3}. Best is trial 283 with value: 0.15093152257120881.
[I 2023-11-03 20:18:36,219] Trial 294 finished with value: 0.15193967719153859 and parameters: {'n_estimators': 500, 'max_features': 'auto', 'max_depth': 3}. Best is trial 283 with value: 0.15093152257120881.
[I 2023-11-03 20:18:36,788] Trial 335 finished with value: 0.16980566057062374 and parameters: {'n_estimators': 500, 'max_features': 'auto', 'max_depth': 3}. Best is trial 283 with value: 0.15093152257120881.
[I 2023-11-03 20:18:36,824] Trial 302 finished with value: 0.16697838313435578 and parameters: {'n_estimators': 500, 'max_features': 'auto', 'max_depth': 3}. Best is trial 283 with value: 0.15093152257120881.
[I 2023-11-03 20:18:36,831] Trial 304 finished with value: 0.1777697768065598 and parameters: {'n_estimators': 500, 'max_features': 'auto', 'max_depth': 3}. Best is trial 283 with value: 0.15093152257120881.
[I 2023-11-03 20:18:36,842] Trial 313 finished with value: 0.1873962545029184 and parameters: {'n_estimators': 500, 'max_features': 'auto', 'max_depth': 3}. Best is trial 283 with value: 0.15093152257120881.
[I 2023-11-03 20:18:36,858] Trial 301 finished with value: 0.18650451487154654 and parameters: {'n_estimators': 500, 'max_features': 'auto', 'max_depth': 3}. Best is trial 283 with value: 0.15093152257120881.
[I 2023-11-03 20:18:46,526] Trial 312 finished with value: 0.16436125045476277 and parameters: {'n_estimators': 500, 'max_features': 'auto', 'max_depth': 3}. Best is trial 283 with value: 0.15093152257120881.
[I 2023-11-03 20:18:47,728] Trial 341 finished with value: 0.16210051152786747 and parameters: {'n_estimators': 500, 'max_features': 'auto', 'max_depth': 3}. Best is trial 283 with value: 0.15093152257120881.
[I 2023-11-03 20:18:47,808] Trial 321 finished with value: 0.15604620437043057 and parameters: {'n_estimators': 500, 'max_features': 'auto', 'max_depth': 3}. Best is trial 283 with value: 0.15093152257120881.
[I 2023-11-03 20:18:51,032] Trial 327 finished with value: 0.17963509470993885 and parameters: {'n_estimators': 500, 'max_features': 'auto', 'max_depth': 3}. Best is trial 283 with value: 0.15093152257120881.
[I 2023-11-03 20:18:52,817] Trial 274 finished with value: 0.18755220210480036 and parameters: {'n_estimators': 500, 'max_features': 'auto', 'max_depth': 3}. Best is trial 283 with value: 0.15093152257120881.
[I 2023-11-03 20:18:53,331] Trial 344 finished with value: 0.2059097785370021 and parameters: {'n_estimators': 500, 'max_features': 'auto', 'max_depth': 3}. Best is trial 283 with value: 0.15093152257120881.
[I 2023-11-03 20:18:53,361] Trial 318 finished with value: 0.193672785361823 and parameters: {'n_estimators': 500, 'max_features': 'auto', 'max_depth': 3}. Best is trial 283 with value: 0.15093152257120881.
[I 2023-11-03 20:18:54,479] Trial 268 finished with value: 0.18053016269148747 and parameters: {'n_estimators': 500, 'max_features': 'auto', 'max_depth': 3}. Best is trial 283 with value: 0.15093152257120881.
[I 2023-11-03 20:18:54,497] Trial 273 finished with value: 0.1760432141964495 and parameters: {'n_estimators': 500, 'max_features': 'auto', 'max_depth': 3}. Best is trial 283 with value: 0.15093152257120881.
[I 2023-11-03 20:18:57,127] Trial 269 finished with value: 0.16621325543576862 and parameters: {'n_estimators': 500, 'max_features': 'auto', 'max_depth': 3}. Best is trial 283 with value: 0.15093152257120881.
[I 2023-11-03 20:18:58,344] Trial 291 finished with value: 0.15901355196116254 and parameters: {'n_estimators': 500, 'max_features': 'auto', 'max_depth': 4}. Best is trial 283 with value: 0.15093152257120881.
[I 2023-11-03 20:18:58,355] Trial 279 finished with value: 0.15781987927858487 and parameters: {'n_estimators': 500, 'max_features': 'auto', 'max_depth': 3}. Best is trial 283 with value: 0.15093152257120881.
[I 2023-11-03 20:18:58,359] Trial 290 finished with value: 0.15859037635619228 and parameters: {'n_estimators': 500, 'max_features': 'auto', 'max_depth': 3}. Best is trial 283 with value: 0.15093152257120881.
[I 2023-11-03 20:19:00,789] Trial 270 finished with value: 0.18379376810865167 and parameters: {'n_estimators': 500, 'max_features': 'auto', 'max_depth': 3}. Best is trial 283 with value: 0.15093152257120881.
[I 2023-11-03 20:19:00,827] Trial 348 finished with value: 0.1745902729246557 and parameters: {'n_estimators': 500, 'max_features': 'auto', 'max_depth': 3}. Best is trial 283 with value: 0.15093152257120881.
[I 2023-11-03 20:19:00,836] Trial 320 finished with value: 0.16820580763752477 and parameters: {'n_estimators': 500, 'max_features': 'auto', 'max_depth': 3}. Best is trial 283 with value: 0.15093152257120881.
[I 2023-11-03 20:19:01,807] Trial 340 finished with value: 0.1735831294396125 and parameters: {'n_estimators': 500, 'max_features': 'auto', 'max_depth': 3}. Best is trial 283 with value: 0.15093152257120881.
[I 2023-11-03 20:19:01,867] Trial 297 finished with value: 0.16107560679352764 and parameters: {'n_estimators': 500, 'max_features': 'auto', 'max_depth': 3}. Best is trial 283 with value: 0.15093152257120881.
[I 2023-11-03 20:19:01,873] Trial 339 finished with value: 0.17358671678105378 and parameters: {'n_estimators': 500, 'max_features': 'auto', 'max_depth': 3}. Best is trial 283 with value: 0.15093152257120881.
[I 2023-11-03 20:19:01,898] Trial 277 finished with value: 0.17227734038829387 and parameters: {'n_estimators': 500, 'max_features': 'auto', 'max_depth': 3}. Best is trial 283 with value: 0.15093152257120881.
[I 2023-11-03 20:19:01,940] Trial 308 finished with value: 0.15846293244601142 and parameters: {'n_estimators': 500, 'max_features': 'auto', 'max_depth': 3}. Best is trial 283 with value: 0.15093152257120881.
[I 2023-11-03 20:19:01,959] Trial 323 finished with value: 0.15997848458552855 and parameters: {'n_estimators': 500, 'max_features': 'auto', 'max_depth': 5}. Best is trial 283 with value: 0.15093152257120881.
[I 2023-11-03 20:19:01,968] Trial 316 finished with value: 0.17253223079168567 and parameters: {'n_estimators': 500, 'max_features': 'auto', 'max_depth': 3}. Best is trial 283 with value: 0.15093152257120881.
[I 2023-11-03 20:19:02,255] Trial 289 finished with value: 0.17754961250433307 and parameters: {'n_estimators': 500, 'max_features': 'auto', 'max_depth': 3}. Best is trial 283 with value: 0.15093152257120881.
[I 2023-11-03 20:19:02,262] Trial 303 finished with value: 0.1833362007802416 and parameters: {'n_estimators': 500, 'max_features': 'auto', 'max_depth': 3}. Best is trial 283 with value: 0.15093152257120881.
[I 2023-11-03 20:19:02,269] Trial 342 finished with value: 0.1657111062122275 and parameters: {'n_estimators': 500, 'max_features': 'auto', 'max_depth': 3}. Best is trial 283 with value: 0.15093152257120881.
[I 2023-11-03 20:19:02,324] Trial 307 finished with value: 0.171957767711391 and parameters: {'n_estimators': 500, 'max_features': 'auto', 'max_depth': 3}. Best is trial 283 with value: 0.15093152257120881.
[I 2023-11-03 20:19:02,338] Trial 311 finished with value: 0.16338600262666267 and parameters: {'n_estimators': 500, 'max_features': 'auto', 'max_depth': 3}. Best is trial 283 with value: 0.15093152257120881.
[I 2023-11-03 20:19:02,341] Trial 275 finished with value: 0.1703316435099098 and parameters: {'n_estimators': 500, 'max_features': 'auto', 'max_depth': 3}. Best is trial 283 with value: 0.15093152257120881.
[I 2023-11-03 20:19:02,521] Trial 349 finished with value: 0.16092414078177117 and parameters: {'n_estimators': 500, 'max_features': 'auto', 'max_depth': 3}. Best is trial 281 with value: 0.15029046523877912.
[I 2023-11-03 20:19:02,540] Trial 357 finished with value: 0.16515638824876158 and parameters: {'n_estimators': 500, 'max_features': 'auto', 'max_depth': 3}. Best is trial 283 with value: 0.15093152257120881.
[I 2023-11-03 20:19:02,565] Trial 354 finished with value: 0.16178088842062352 and parameters: {'n_estimators': 500, 'max_features': 'auto', 'max_depth': 3}. Best is trial 281 with value: 0.15029046523877912.
[I 2023-11-03 20:19:02,584] Trial 276 finished with value: 0.1798553380121344 and parameters: {'n_estimators': 500, 'max_features': 'auto', 'max_depth': 3}. Best is trial 281 with value: 0.15029046523877912.
[I 2023-11-03 20:19:02,675] Trial 347 finished with value: 0.15938341864547712 and parameters: {'n_estimators': 500, 'max_features': 'auto', 'max_depth': 3}. Best is trial 281 with value: 0.15029046523877912.
[I 2023-11-03 20:19:02,681] Trial 278 finished with value: 0.15303869570436376 and parameters: {'n_estimators': 500, 'max_features': 'auto', 'max_depth': 3}. Best is trial 281 with value: 0.15029046523877912.
[I 2023-11-03 20:19:02,721] Trial 353 finished with value: 0.17004214676660437 and parameters: {'n_estimators': 500, 'max_features': 'auto', 'max_depth': 3}. Best is trial 281 with value: 0.15029046523877912.
[I 2023-11-03 20:19:02,869] Trial 360 finished with value: 0.17888385519649028 and parameters: {'n_estimators': 500, 'max_features': 'auto', 'max_depth': 3}. Best is trial 281 with value: 0.15029046523877912.
[I 2023-11-03 20:19:02,931] Trial 281 finished with value: 0.15029046523877912 and parameters: {'n_estimators': 500, 'max_features': 'auto', 'max_depth': 3}. Best is trial 281 with value: 0.15029046523877912.
[I 2023-11-03 20:19:02,939] Trial 355 finished with value: 0.190379517239227 and parameters: {'n_estimators': 500, 'max_features': 'auto', 'max_depth': 3}. Best is trial 281 with value: 0.15029046523877912.
[I 2023-11-03 20:19:09,338] Trial 356 finished with value: 0.16583773900754614 and parameters: {'n_estimators': 500, 'max_features': 'auto', 'max_depth': 3}. Best is trial 351 with value: 0.14710050077921766.
[I 2023-11-03 20:19:09,471] Trial 351 finished with value: 0.14710050077921766 and parameters: {'n_estimators': 500, 'max_features': 'auto', 'max_depth': 3}. Best is trial 351 with value: 0.14710050077921766.
[I 2023-11-03 20:19:10,431] Trial 363 finished with value: 0.178846126373805 and parameters: {'n_estimators': 500, 'max_features': 'auto', 'max_depth': 3}. Best is trial 351 with value: 0.14710050077921766.
[I 2023-11-03 20:19:12,697] Trial 352 finished with value: 0.16371175094012694 and parameters: {'n_estimators': 500, 'max_features': 'auto', 'max_depth': 3}. Best is trial 351 with value: 0.14710050077921766.
[I 2023-11-03 20:19:14,412] Trial 365 finished with value: 0.1852395068357514 and parameters: {'n_estimators': 500, 'max_features': 'auto', 'max_depth': 3}. Best is trial 351 with value: 0.14710050077921766.
[I 2023-11-03 20:19:16,194] Trial 310 finished with value: 0.16593137426741664 and parameters: {'n_estimators': 500, 'max_features': 'auto', 'max_depth': 3}. Best is trial 351 with value: 0.14710050077921766.
[I 2023-11-03 20:19:19,601] Trial 343 finished with value: 0.16474044728015666 and parameters: {'n_estimators': 500, 'max_features': 'auto', 'max_depth': 3}. Best is trial 351 with value: 0.14710050077921766.
[I 2023-11-03 20:19:22,484] Trial 358 finished with value: 0.18806162232953275 and parameters: {'n_estimators': 500, 'max_features': 'auto', 'max_depth': 3}. Best is trial 351 with value: 0.14710050077921766.
[I 2023-11-03 20:19:25,918] Trial 319 finished with value: 0.1656526212392769 and parameters: {'n_estimators': 500, 'max_features': 'auto', 'max_depth': 3}. Best is trial 351 with value: 0.14710050077921766.
[I 2023-11-03 20:19:28,269] Trial 359 finished with value: 0.19422698895258564 and parameters: {'n_estimators': 500, 'max_features': 'auto', 'max_depth': 3}. Best is trial 351 with value: 0.14710050077921766.
[I 2023-11-03 20:19:29,813] Trial 330 finished with value: 0.19283935627962778 and parameters: {'n_estimators': 500, 'max_features': 'auto', 'max_depth': 3}. Best is trial 351 with value: 0.14710050077921766.
[I 2023-11-03 20:19:30,203] Trial 285 finished with value: 0.17230575633162803 and parameters: {'n_estimators': 500, 'max_features': 'auto', 'max_depth': 5}. Best is trial 351 with value: 0.14710050077921766.
[I 2023-11-03 20:19:31,731] Trial 293 finished with value: 0.15370969500710926 and parameters: {'n_estimators': 500, 'max_features': 'auto', 'max_depth': 5}. Best is trial 351 with value: 0.14710050077921766.
[I 2023-11-03 20:19:33,666] Trial 361 finished with value: 0.16044031682659332 and parameters: {'n_estimators': 500, 'max_features': 'auto', 'max_depth': 5}. Best is trial 351 with value: 0.14710050077921766.
[I 2023-11-03 20:19:36,114] Trial 334 finished with value: 0.18609325431842935 and parameters: {'n_estimators': 500, 'max_features': 'auto', 'max_depth': 5}. Best is trial 351 with value: 0.14710050077921766.
[I 2023-11-03 20:19:38,043] Trial 350 finished with value: 0.16443228005319652 and parameters: {'n_estimators': 500, 'max_features': 'auto', 'max_depth': 5}. Best is trial 351 with value: 0.14710050077921766.
[I 2023-11-03 20:19:39,120] Trial 336 finished with value: 0.15576491547506932 and parameters: {'n_estimators': 500, 'max_features': 'auto', 'max_depth': 5}. Best is trial 351 with value: 0.14710050077921766.
[I 2023-11-03 20:19:41,068] Trial 364 finished with value: 0.15586086832407028 and parameters: {'n_estimators': 500, 'max_features': 'auto', 'max_depth': 5}. Best is trial 351 with value: 0.14710050077921766.
[I 2023-11-03 20:19:41,614] Trial 314 finished with value: 0.16110948374546713 and parameters: {'n_estimators': 500, 'max_features': 'auto', 'max_depth': 5}. Best is trial 351 with value: 0.14710050077921766.
[I 2023-11-03 20:19:42,566] Trial 322 finished with value: 0.1843794187916655 and parameters: {'n_estimators': 500, 'max_features': 'auto', 'max_depth': 5}. Best is trial 351 with value: 0.14710050077921766.
[I 2023-11-03 20:19:42,584] Trial 366 finished with value: 0.19289028614814793 and parameters: {'n_estimators': 500, 'max_features': 'auto', 'max_depth': 5}. Best is trial 351 with value: 0.14710050077921766.
[I 2023-11-03 20:19:43,820] Trial 346 finished with value: 0.1781569043611592 and parameters: {'n_estimators': 500, 'max_features': 'auto', 'max_depth': 5}. Best is trial 351 with value: 0.14710050077921766.
[I 2023-11-03 20:19:43,861] Trial 332 finished with value: 0.15375663427896621 and parameters: {'n_estimators': 500, 'max_features': 'auto', 'max_depth': 5}. Best is trial 351 with value: 0.14710050077921766.
[I 2023-11-03 20:19:44,075] Trial 362 finished with value: 0.16336478751568542 and parameters: {'n_estimators': 500, 'max_features': 'auto', 'max_depth': 5}. Best is trial 351 with value: 0.14710050077921766.
[I 2023-11-03 20:19:44,123] Trial 337 finished with value: 0.17141488740758515 and parameters: {'n_estimators': 500, 'max_features': 'auto', 'max_depth': 5}. Best is trial 351 with value: 0.14710050077921766.
[I 2023-11-03 20:19:44,144] Trial 367 finished with value: 0.16400431974504073 and parameters: {'n_estimators': 500, 'max_features': 'auto', 'max_depth': 5}. Best is trial 351 with value: 0.14710050077921766.
[I 2023-11-03 20:19:44,281] Using an existing study with name 'ANN' instead of creating a new one.
[I 2023-11-03 23:23:03,651] Trial 285 finished with value: 0.22198121470254004 and parameters: {'learning_rate_init': 0.07611759734835714, 'hidden_layer_sizes': [20]}. Best is trial 14 with value: 0.22186978015941017.
[I 2023-11-03 23:24:26,746] Trial 275 finished with value: 0.2477285531903801 and parameters: {'learning_rate_init': 0.06366110254036801, 'hidden_layer_sizes': [20]}. Best is trial 14 with value: 0.22186978015941017.
[I 2023-11-03 23:25:08,504] Trial 235 finished with value: 0.22648286904904172 and parameters: {'learning_rate_init': 0.06218971494485766, 'hidden_layer_sizes': [10]}. Best is trial 14 with value: 0.22186978015941017.
